Artist,Song,Year,Review,Reviewer,Ranking,Source,Source Title
Talib Kweli,Get By,2003,"When Nina Simone passed on April 21, 2003, she left more than a half-century of spit and soul. Her wandering spirit still skips poles with ease and class. A month before her death in France, Simone embarked on another musical divergence, only this departure would transplant the sonorous vox behind the holy incantations of ""Sinnerman"" onto Kanye's galloping snare and John Legend's collapsing piano. ""Get By"" is wrapped in the power of desperation. Already well-versed in the griot's exhortations, Brooklynite Talib Kweli revisits the storyteller ethic to weave a tale of real pain stripped of New York Post fanaticism. Painting vivid soliloquies that range from his grandmother's trials as a single mother to the tragedy of gangsterism, Kweli mated his socially responsible former self with his commercially viable necessity. The resulting irony was delicious. ""Get By"" had kids in the club screaming Nina Simone between sips of Grey Goose while teens at the prom high-stepped to the epilogues of the welfare state. Now that's some crazy shit.",Jamin Warren,77,Pitchfork,The Top 100 Singles of 2000-04
Interpol,Obstacle 1,2003,"Despite harboring the infamous ""Her stories are boring and stuff/ She's always calling my bluff"" couplet (see also frenzied bellows of: ""It's in the things that she puts in my hair!""), Interpol's ""Obstacle 1"" is a strange, thoughtful meditation on love and time, anchored by throbbing post-punk guitar and Paul Banks' deep, tottering vocals. Banks' slippery lyrics rub up against anxious, aggressive guitar bits (themselves engaged in prickly interplay, all ups and downs, highs and lows), creating a song as bewildering as it is engaging. In 2002, Interpol had to endure an entirely absurd amount of comparisons to Joy Division, but ""Obstacle 1"" proved that they were standing on their very own suit-clad legs: ""Obstacle 1"" is a dynamic, unpredictable, and wholly distinct triumph.",Amanda Petrusich,76,Pitchfork,The Top 100 Singles of 2000-04
Radiohead,There There,2003,"Such is our love for Radiohead that ""Creep"", instead of haunting the band well into their sine-wave phase, has been-- in a rare show of fanboy magnanimity-- quietly dismissed as juvenilia. That's too bad, actually, because it contains more than a germ of the Radiohead to come. The song's biggest hook, for instance, was not the Explosive Chorus (a sad cliche by 1993) but the two terrifying string slaps that preceded it: A device so simple it had every guitarist in the world surprised how in the hell hadn't they thought of it first. On ""There There"", Radiohead manage to top themselves in the same department: the nervous center of the song is, unbelievably, a drum fill. You know which one: it ends the tune. Composed of two robotic, Dave Grohl-style snare rolls, three 16th-notes each, it sounds almost exactly like Greenwood's ""Creep"" figure; the rest of the song is so accomplished it's a yawn to describe-- a gorgeous vocal singing about a siren singing you to shipwreck (!), terrifically twisty changes, complicated yet totally lucid mix-- but it's this weird little self-salute reaching from 2003 to 1993 that makes it, well, perfect.",Michael Idov,75,Pitchfork,The Top 100 Singles of 2000-04
Destiny's Child,Say My Name,2000,"The fact (1) that every man, woman, and child in America can sing the vocal hook from this song despite the fact (2) that the beat and bassline sequence underneath that hook is so deeply tricked out and bizarre (we're talking deliriously fast doubletime offset snare runs on top of wah guitar, Martian sleighbells, lite classical string stabs and acoustic fingerpicking, y'all) could be called a testament to the ideological triumph of Ms. Knowles and company's yummy vocal delivery over the icily brilliant formalism of Rodney Jerkins' programming, were it not for the fact (3) that both the singing and the programming are shot through with the exact same precision-tooled logic of control-freak paranoia. Which is why this is such a distinctly American anthem. Facts are facts.",Drew Daniel,74,Pitchfork,The Top 100 Singles of 2000-04
Belle and Sebastian,'m Waking Up to U,2001,"On ""I'm Waking Up to Us"", Belle and Sebastian make manifest their long-latent adoration of Love's Forever Changes as Stuart Murdoch expertly channels Arthur Lee's sleepy-lidded romanticism. With the help of Mike Hurst (producer of such pop landmarks as Petula Clark's ""Downtown""), the group slices a sliver of perfection from a lush confection of oboe, flute, and bassoon. And there's more homage paid on ""I Love My Car"", whereon Murdoch sings ""I love my Carl/ I love my Brian, my Dennis, and my Al/ I could even find it in my head to love Mike Love"" as the song's playful horns eventually join into a full-fledged Dixieland promenade. The closing ""Marx and Engels"" is the type of effortless piano-driven trifle that probably falls out of Murdoch's pockets when he's boarding the Metro, but packed alongside these companions it reflects a handsome glow.",Matthew Murphy,73,Pitchfork,The Top 100 Singles of 2000-04
Luomo,Tessio,2003,"Sneak preview time: Vocalcity unfortunately just missed our album list, but ""Tessio"" is a worthy avatar-- and one of the most debilitating tracks I have ever heard. Finnish tech-house producer Vladislav Delay initiated the Luomo project to examine his own bouts with love; he's very thorough, and his heart is quite deep. Over cold, fleshy clicks-- winter hands without gloves-- at one point a man and a woman sing in duet: ""I'm trying to be all yours/ Although I ain't answering your calls/ Don't say, it's false/ I'm only following my thoughts."" A bit feta-cheesy on their own, the lines teethe as ""Tessio"" grows longer, less fragmented, more cocksure in its purge. That's where the devastation lies: A lovesick purge is never 100%, and the only thing we can get over is that we will never get over.",Nick Sylvester,72,Pitchfork,The Top 100 Singles of 2000-04
White Stripes,Dead Leaves and the Dirty Ground,2002,"""Dead Leaves and the Dirty Ground"" opened the White Stripes' breakthrough White Blood Cells with the same whiff of amp feedback and lunkheaded distorted riffing that launched a thousand Estrus Crust Club singles, and for those first few seconds it certainly didn't appear that anything noteworthy was about to transpire. That impression changed permanently, however, the moment Jack and Meg casually wrapped their meat hooks around this song's burly chords and methodically ground them into powder. Despite all the ink that's been spilled on the White Stripes, Jack remains a drastically underrated lyricist, and this track contains his most subtle and evocative portrait of the lonesome disillusionment that accompanies a fading relationship. ""Any man with a microphone can tell you what he loves the most,"" he cries, but these two barely needed a microphone for you to hear this powerhouse of a song coming down the hall.",Matthew Murphy,71,Pitchfork,The Top 100 Singles of 2000-04
M83,Run Into Flowers,2004,"""Run Into Flowers"" wrenches so much beauty from artificial sources it makes me want to cry. Not because of how that beauty affects me directly but because the song makes it obvious that we're headed inexorably for a technological future where robots will be our masters and all of our jobs will be outsourced to microprocessors in Peru. What a bright, brilliant, beautiful future, though-- it turns out the robots actually like us and lavish us with libations and improved vibrating back massage technology. The song builds up from a base of rhythmically nattering electronic insects-- they live amongst the flowers one supposes",Joe Tangari,70,Pitchfork,The Top 100 Singles of 2000-04
The Darkness,I Believe In a Thing Called Love,2003,"Why was the Darkness' fourth UK single their first in the U.S.? Because, like some kind of magical zeitgeist-spackle, ""I Believe In A Thing Called Love"" filled an ugly hole in the states' Fall 2003 musical ceiling. Americans were ready to feel ambiguously excited about 1970s glam rock, 80s hair metal, and 90s hard-rock ballads again. Americans were ready to remember that crazy foreigners (such as Queen, AC/DC, and Def Leppard) were responsible for those genres' roots and peaks. Americans were ready to wonder if unironic fun was possible after so much self-conscious self-consciousness had permeated the national (self-) consciousness. But mostly, Americans were ready for wonderfully brainless operatic pop (come on, this song's closest cousin is Whitney Houston's ""I Wanna Dance With Somebody"") sprinkled with Slash-caliber axework, and maybe a Clash shuffle-strum during a one-drum-breakdown to guarantee a positive vibe. Stadium-melting six-strings have never been so amenable to dance remixes and crunk mash-ups (for further evidence of this tune's reach, consult Lemar's somewhat desexualized soul cover, complete with Marvin-Gaye-homaging stop-the-violence shout-outs). Just as the comedian Eddie Izzard wouldn't be half as funny if he weren't British, no band from the world's last remaining superpower could have pulled this song off.",William Bowers,69,Pitchfork,The Top 100 Singles of 2000-04
Coldplay,Clocks,2003,"When people talk shit on Coldplay, they call the band ""lite rock"" or ""music for people who don't give a shit about music."" But the thing that makes ""Clocks"" nearly perfect is its lightness: It's helium, lighter than air, floating upwards and hovering, disappearing into the atmosphere. The arrangement implies house music, swirling and climbing without ever locking into a 4/4 beat. It's not tied to anything on this earth: that tumbling, glistening piano, those surging otherworldly background synth chimes, that voice. Especially that voice. Chris Martin's elegantly, gorgeously meaningless angelic falsetto says more than his lyrics do (""Confusion never stops/ Closing walls and ticking clocks"", whatever); it's sad and tired and hopeful and perfectly empty. It works like a comfort blanket; it may not solve any real problems, but it wraps you up and keeps you warm and tells you that everything's OK.",Tom Breihan,68,Pitchfork,The Top 100 Singles of 2000-04
Panjabi MC [ft. Jay-Z],Mundian to Bach Ké (Beware of the Boys),2003,"It's the centuries-old Indian folk music bhangra and David Hasselhoff's talking-car TV show Knight Rider-- together at last! Yeah, you might be laughing, but that's because you haven't heard the damn thing. The original version of this track (released five years before Jay-Z, and most of America, came around) hit it big on an international scale-- indeed, Mr. Carter caught wind of this track while clubbing in Switzlerland. The combination of that space-age Trans Am bass line and the dhol-- the double-barreled drum that makes bhangra bang-- is hard to resist, especially in conjunction with the impassioned hollering of the non-Hov vocals. The Indian lyrics expound on the song's title",David Raposa,67,Pitchfork,The Top 100 Singles of 2000-04
Sean Paul,Like Glue,2003,"When Sean Paul first broke through to U.S. listeners on the singles ""Gimme the Light"" and ""Get Busy"", his voice was a fiery robotic lockstep. The tracks were grim, stentorian dancefloor bangers, and his flow was just one element in the mix rather than the force at its center. But he's a revelation on ""Like Glue"", growling bleary-eyed hungover hangdog charm over warm, burbling electro soul. The track is simply gorgeous; the skidding organ riffs and walking bassline and humming synths gel perfectly into a wistful morning glow. Sean Paul may just be singing about how much he loves to fuck, but with that grinning baritone growl, he could be talking about chopping up old ladies and it would still sound like the prettiest little love song you ever heard.",Tom Breihan,66,Pitchfork,The Top 100 Singles of 2000-04
Missy Elliott [ft. Ludacris],One Minute Man,2001,"""Get Ur Freak On"" was the aesthetic manifesto, the statement of warped intent, the dizzy alien futuristic banger, the invitation to another universe. The first time you heard it, you knew the world was a completely different place. ""One Minute Man"" has a different purpose. It doesn't carry the burden of changing music; it's just a murder-hot club jam about dudes who blow it, and so it's free to be light and playful and frisky in ways that ""Get Ur Freak On"" couldn't be. Timbaland's science fiction sunburst lope leaves room Missy to layer creepy, sexy hooks on top of each other, harmonizing with herself with robotic, multitracked panache. And Ludacris stops by with possibly the best guest appearance of his entire career, clamping down on every syllable like a rabid pitbull, just bursting with horny joy: ""Enough of tips and advice and thangs/ I'm big dog, having women seeing stripes and thangs/ They go to bed, start snoring, counting sheep and shit / They so wet that they body started leakin' shit!"" Just nasty.",Tom Breihan,65,Pitchfork,The Top 100 Singles of 2000-04
New Pornographers,The Laws Have Changed,2003,"When I hear this song, I picture a video that finds the group participating in some Frankie and Annette beach blanket bongo party with the radiant Neko Case in the oh-so-crucial Ann-Margaret role: Everyone's young and shiny, doing the mashed potato and the other 9,999 dances in demure bikinis and flattering swim trunks (with A.C. Newman, of course, wearing peroxide on his schnozz), kicking back with some dogs and pop, having a grand old time in the sun as the song's perpetual motion machine chugs along. Of course, the actual video for this song does have the dance moves down, and features a fair amount of sand, but-- in true rockin' indie fashion-- it's a dour ""thoughtful"" affair and doesn't actually bother featuring any of the band members on screen (excepting part-time Pornographer/fulltime Destroyer Dan Bejar as a mute bartender). And, of course, a quick scan of the lyrics while listening to a report on the goings-on in the U.S. government can give one a bit of topical whiplash: ""Pharaoh, all your methods have taught me is to/ Separate my blood from bone"". But maybe it's not a song about de-evolution, but about revolution: ""Alone in the chain, it remains to be seen how/ How well you can play when the pawn takes a queen now"". Or maybe it's just about Neko Case putting her foot up the ass of a combustible pop song and kicking it into the stratosphere where it becomes the sun and Earth becomes its loving satellite until the next Big Bang. For the record, escape velocity is achieved at the point where Neko starts forming a line and the rest of the band turn into her doo-dooing Pips. Would any of you wallflowers care to join in?",David Raposa,64,Pitchfork,The Top 100 Singles of 2000-04
Roots [ft. Cody Chestnutt],The Seed 2.0,2002,"Under Statute 402.3 of the Critic's Code, we're required to mention in every piece about The Roots how they perform their own music and play their own instruments, so that everyone knows just how much more ""authentic"" they are than all those other hip-hop groups. ""The Seed 2.0"" might be the first time that's really been a relevant point, as it's their only single to really sound like it was made by a traditional band, a slinky remake of Chestnutt's ode to pollination. The Roots' take is more than just a fidelity upgrade; Black Thought's verses smooth out Chestnutt's unfortunate views on sexual relations, while ?uestlove whips up a tidy beat to keep that drunken guitar riff upright. All told, ""The Seed"" ends up being a photo-negative take on the rap-rock that scourged the century's early years, with hip-hop's house band showing the mongrel genre can be full of sensual swagger instead of Neanderthal catharsis.",Rob Mitchum,63,Pitchfork,The Top 100 Singles of 2000-04
Spoon,The Way We Get By,2003,"Girls Can Tell catapulted Spoon from being an American Supergrass in the bad way (meaning: they were also-rans) to being an American Supergrass in the good way (meaning: they reliably delivered intense grit-pop). This one song from Kill the Moonlight would earn them such mainstream love-debris as a cellphone ringtone and a spot on a soundtrack to something called ""The O.C."" Unapologetic and unjudgmental, this brief bit of skeletal rock rubs Billy Joel piano-pop up against classic streetlife confessions by the Misfits, Cramps, Make-Up, and, yah, Supergrass. Even straight edge theologians are susceptible to humming along with this tune's drug-dropping and vague convictions. Like religion, though, the song uses simple repetition to achieve sneaky cognitive effects. When indie goes Broadway, expect this track to be featured in the revue, prior to intermission, as an enticement to stick around.",William Bowers,62,Pitchfork,The Top 100 Singles of 2000-04
Justin Timberlake,Like I Love You,2002,"JT's first solo single didn't waste much time in setting up his career as a superstar. Of course, he had a lot of help: The Neptunes' track is one of their best and most distinctive, with muscle-bound funk drums, matador guitar and strategically placed synth blips. Timberlake, for his part, recognized that the world had been without a listenable Michael Jackson song for too long. You know, I really don't want to undersell him, but can you imagine what kind of mega-smash this song would have been had it actually been recorded by Jackson? Anyway, good for JT, good for the legacy of the boy bands, good for pop radio, good for the Neptunes, good for us. With any luck, Timberlake plays his cards this well in the second half of the decade.",Dominique Leone,61,Pitchfork,The Top 100 Singles of 2000-04
Electric Six,Danger! High Voltage!,2003,"Oh god, how can I possibly sum up this song? Here, the dancing-about-architecture divide between music and words seems most unbridgeable, and the task of trying to convey all the silly fun, the unabashed disco-ness, the shameless sax solo, the way singer Dick Valentine punctuates a line with an exclamation of ""lover!"" seems daunting for a stuffy rock critic like myself...or maybe it's the bottle of wine I just drank while dancing around the room and asking the wife, ""Don't you wanna know how I keep starting fires?!"" This is the song that made me order a burrito from Taco Bell. Thankfully, Valentine and Jack ""no recording equipment before 1963"" White didn't make fun of disco",Joe Tangari,60,Pitchfork,The Top 100 Singles of 2000-04
The Flaming Lips,Do You Realize??,2002,"My inner cynic sure had fun with the first single from Yoshimi Battles the Pink Robots. I found myself sitting in a graduate school class listening to a daily newspaper rock crit explicate the song's barely earned key changes as an adjunct professor compared the opening acoustic guitar to early Plastic Ono Band. Quoth my cynic: If Wilco was ""dad rock,"" what did that make this once-cacophonous Oklahoma ensemble? What's lamer than appearing in an AOL commercial? Why was I here? Fortunately, I'd first heard the song during a dreamlike drive to a river near California's Sierra Nevada, and I could never again hear its joyful overproduction without visualizing that region's vivid, almost hyper-real hues. ""Do You Realize??"" offers childlike lyrics (""Do you realize/ Happiness makes you cry""), congregation-moving arrangements, and bold, Sharpie-on-a-tie-dye-shirt melodies. But unlike other tunes of its ilk, ""Do You Realize??"" can bring even the most hardened Wicker Park hipsters to tears. (Alas, I was only cool enough to live in Evanston.) Sure, its theme is shopworn, but so are love songs. Then again, this track is something of a love song to the here and now",Marc Hogan,59,Pitchfork,The Top 100 Singles of 2000-04
Eminem,Stan,2001,"Same old same old-- lightweight misanthropic potty-mouthed hip-hop artist known for controversially goofing on pop culture, social mores, and himself releases single that deals with a serious topic in an intelligent, harrowing fashion. Of course, that's all reductive garbage-- there's plenty of evidence prior to ""Stan"" of Slim Shady's wit and wisdom, and it's not as if this track is free of the button-pushing that poisons his more notorious work. That is, unless you don't consider the way Em disposes of Stan and his wife-to-be anything less than sensational. And let's not forget subverting Dido's tra-la-la chirp for some manipulative ironic counterpointing. Also, Em isn't discovering the new world with this track-- there are plenty of examples of hip-hop shucking its jive for a more serious countenance (cf. um, almost all of it). So what separates ""Stan"" from other attempts is what separates Eminem, at his best, from the rest of the pack",David Raposa,58,Pitchfork,The Top 100 Singles of 2000-04
Le Tigre,Deceptacon (DFA Remix),2002,"Eric Carr panned the poopflakes out of this song in 2002: ""It puts the disco before the discussion...the DFA's remix of 'Deceptacon' sucks out all of the original's Joy Division-ish bassy goodness in favor of a simplistic funk pattern looped ad nauseam."" Woof. Where to begin? That simplistic funk pattern-- the one with eight kinds of handclaps and dense synths and that sparse sub-bass thwok on the ones-- that ""pattern"" gave punkies a chance to actually dance, not that bullshit half-skank side-stepping they'd been doing for 20-plus to Wanna Buy A Bridge? Equally sympathetic to dance and punk, the DFA had found its signature remix sound here, and everyone from Junior Senior to Britney wanted a piece. Oh, and fuck all does the groove depoliticize the rhyme. Quite the opposite: Hannah's rant is still here, but with the bigger beat, she's less bratty, more compelling",Nick Sylvester,57,Pitchfork,The Top 100 Singles of 2000-04
The Hives,Hate to Say I Told You So,2002,"Whether or not the Hives are the best band in the world-- as they readily claim-- is unimportant; what's crucial is the fact that they play like they are. Riding the crest of the garage-rock wave behind the Strokes and the Vines (remember them?), the Hives set themselves apart from so many trend-jumping upstarts with this calling card, the deadliest WMD in their nuclear arsenal known as Vini Vidi Vicious . Nicholaus Arson's chugging guitar riff provides a perfect soundtrack for webslinging, and Howlin' Pelle Almqvist delivers a screaming stump speech full of campaign promises: ""Gonna get through your head what the mystery man said...Gonna call all the shots, all the no's and the not's..."" Not because he has to, but ""because I wanna!"" Ultimately, ""Hate to Say I Told You So"" not only lives up to the band's notorious self-proclamations (they titled a singles collection Your New Favorite Band), but spanks you for not believing them in the first place.",Joe Tangari,56,Pitchfork,The Top 100 Singles of 2000-04
Jürgen Paape,So Weit Wie Noch Nie,2002,"I've never been able to figure out what the hell is happening here. Scratchy vocal samples from what sounds like an ancient German cabaret record combined with a fiber-optic tech-house beat to make something that sounds neo-New Romantic. But then, maybe the latter quality is my own baggage. With the vaguely Nena-esque cast to the voice, the wordless vocal on the bridge (an almost unbearable heart-rending cry that deserves to echo forever inside some empty ballroom) evokes the soaring break on ""99 Luftballons"". At least, to these Yankee ears it does. Beyond the mysterious vocals and the weird threads stretching through several eras of pop, this song also has a surface beauty: Too slow to dance to, the icy music of ""So Weit Wie Noch Nie"" is designed to be admired from the outside, like an elegant and precise fetish object.",Mark Richardson,55,Pitchfork,The Top 100 Singles of 2000-04
Animal Collective,Who Could Win A Rabbit?,2004,"Put any kid of a certain age in the vicinity of a drum and he's going to start pounding on it with all his might: ""Must...make...noise!"" This innate biological reflex happens at a pre-conscious level and is thus not to be punished; if we're lucky, we hold on to some of that spirit and learn how to channel it at appropriate times, like when a club filled with people has paid money to watch you. When people describe Animal Collective as existing in relationship to childhood, this is what they're talking about: combining Boredoms' Joy of Noise with Langley Schools' Joy of Song. ""Who Could Win a Rabbit"" is the catchiest melody they've written but the real key to its appeal is that it ends so soon, dropping out just as it reaches it's peak. At that point all you can do is repeat.",Mark Richardson,54,Pitchfork,The Top 100 Singles of 2000-04
Eminem,Lose Yourself,2002,"Rewind: ""Menime...""-- Barbra Streisand's eyebrows return to their natural level-- ""...ot seog Racso eht dna""-- past the two full years of clutching trinkets on various podia, past the morning-zoo parodies, past the stilted, hagiographic 8 Mile itself-- did the same guy really direct Wonder Boys ?-- and stop. There it is: less a rap song than a talking rocker, with its weirdly indie guitar figure, its dumbass fake-choir backup (""Opportunity!""), its Vegas piano. An odd, gangly composition, ""Lose Yourself"" towers over 2002 for one reason and one reason only: It contains Eminem's best rhyme scheme ever. Something in my throat still clenches up when the first verse kicks off in earnest: ""Snap/ Back to reality."" The barrage that follows-- 12 lines with each accented syllable rhyming throughout",Michael Idov,53,Pitchfork,The Top 100 Singles of 2000-04
