Artist,Song,Year,Review,Reviewer,Ranking,Source,Source Title
The Strokes,he Modern Ag,2001,"The onslaught of hype that accompanied The Modern Age EP was unsurprising. The formula was there from the beginning: the swinging 50s rhythms, the crooning into a distorted microphone, captivating melodies and chugging guitars that are reminiscent of that ""V"" band (""The Modern Age"" may be one of the few tracks to merit the comparison)-- all recorded with a raw, rough-demo production. ""Barely Legal"" closes with a different guitar solo, and both that song and ""Last Nite"" sound more like the work of a band (and are arguably better) than their album-track counterparts. Ever since this release, every band that expertly mixes melody and undiluted guitar chords is inevitably called ""the next Strokes."" And none of those bands are worthy of the tag.",Jason Crock,26,Pitchfork,The Top 100 Singles of 2000-04
Franz Ferdinand,Take Me Out,2004,"Franz Ferdinand open ""Take Me Out"" with perfectly serviceable post-punk strumming and drumming. One would expect, the way Paul Thompson rides the hi-hat, and Nick McCarthy and Alex Kapranos' guitars are just biding time, that the band will step it up a notch and bring the rock. But then they slow the damn thing down-- to go disco. However, unlike other better-known disco tracks reputed for their delicious misdirection (Donna Summer's ""Last Dance"", Gloria Gaynor's ""I Will Survive""), ""Take Me Out"" doesn't open up into flaxen fields of orchestral glory-- it tightens the screws and starts to work the chain gang. Thompson goes down on the one like a jackhammer and drags the rest of the group in line. And it always comes back to the one-- a little guitar figure filigree here, some chirpy chorus action there, and no matter how far the rest of the group meanders, they just snap right back to that sexy beat. It's fitting that there's a little sex bubbling underneath this drive-by take-me-home-tonight tale, as that's where the group separate themselves from their more obvious predecessors. Praise the Gang of Four until the votive candles smoulder, but even the most ardent zealot has to realize that the Go4 were a sexless group of funk-loving fun-haters. Thankfully, Franz Ferdinand is willing to go all the way. Hallelujah.",David Raposa,25,Pitchfork,The Top 100 Singles of 2000-04
Basement Jaxx,Romeo,2001,"Felix Buxton and Simon Ratcliffe's least disjointed, most traditionally structured single is arguably their best. Nothing hinders its follow-the-bouncing-ball groove because nothing touches the ground long enough. Kele Le Roc's vocals are sassily soulful, kept aloft by the ""oh-oh-oh-ay-ohs"" in the background, and the Jaxx's concentrated beats yo-yo so energetically, their production is so mind-bogglingly layered, and the whole thing coheres so delightfully that you can't help but hit the repeat button. The result is a dance-pop track that's organic and infectious and communicates all the contradictions that pop music is supposed to convey. In this case, it's not just Le Roc's emotional resilience in the face of a failed relationship, but her excitement in learning she possesses enough romantic fortitude to dump the chump and move on.",Joe Tangari,24,Pitchfork,The Top 100 Singles of 2000-04
Dizzee Rascal,I Luv U,2003,"""Sproing. Pop, pop!"": the sound of grime blowing up. Like a Playstation breaking, the beat on ""I Luv U""-- Dizzee Rascal's kindersurprise of an unplanned parenthood track-- had every corner of the internet and UK pirate radio afire in the spring of '03. The 17-year-old, anomic MC known to his mother as Dylan Mills spat grit and consonants in a bendy, South-London-twanged accents; on ""I Luv U"", he mugs hard as an affront to a girl who may or may not be carrying his seed. It's a sad tale of battle-amour, the thin line between love and hate between a young buck and his maybe-baby's mom. The chorus was a he-said/she-said shell game to a new girl-- the kind that playas play to sidestep their web of booty calls-- buried beneath a pregnancy scare and splattered out in a loveless, detached interplay between Dizzee and a teenaged lover from the block: ""That girl's some bitch you know/ She don't leave me alone.../ She keep ringing me at home/ These days I don't answer my phone."" ""I Luv U"" wasn't really hip-hop (though the bwoy wonder himself told me in an interview he wrote the beat to mirror the one on Memphis Bleek's ""Is That Yo Chick""), but it came out right around the time the UK was balls-deep in the same kinds of social ills that, perhaps coincidentally, also paralleled the U.S.' best era of rap to date. With the interdependent problems of poverty, crack, and gang violence rising in London, here was a man from the projects untangling it all for the sake of his own sanity. And, because ""I Luv U"" is a clear dare to take up arms in the gender war, young grime MC Shystie jacked the beat and played the Roxanne Shante to Dizzee's UTFO in her own version of the track: ""That boy's some prat you know... I buy clothes from his dough... Does he get sex? No.""",Joe Tangari,23,Pitchfork,The Top 100 Singles of 2000-04
Jay-Z,99 Problems,2004,"This track melts rap and rock (the secret ingredient is cowbell) into two tons of testosterone, one dropped right after the other to the massive beat. Over that Rick Rubin beat, our hero takes the opportunity to teach critics how to use their home stereos, impersonates a stuttering lawman, and waxes pious for anyone else who gets in his way. Jay-Z also dismisses any haters within earshot while confronting police prejudice (albeit with tongue-in-cheek), all without losing an ounce of smirking humor or bravado. Detractors should take notes on how to blend rap and rock without sacrificing the best elements of either",Jason Crock,22,Pitchfork,The Top 100 Singles of 2000-04
Kelis,Milkshake,2003,"Is it the hook? The synth line? The ""la-la, la la la""? Kelis makes due with less than anyone to the right of Missy Elliott, dishing out only the barest of melodies, sitting atop the barest of Neptunes tracks, and somehow this song still seems bursting with detail. It's efficient-- using the simple parts to their best advantages-- but it's also big and bright and catchy in the only way that's worth talking about. I not only remember everything about this song",Dominique Leone,21,Pitchfork,The Top 100 Singles of 2000-04
M.I.A.,Galang,2004,"Her country sinking, Sri Lanka-to-London garage-hop/mix-tape It girl Maya Arulpragasam (aka M.I.A.) and her exuberant Slits-on-Missy octave-flip accrue a revolutionary dare-to-dance poignancy on Piracy Funds Terrorism, Vol. 1 and her official debut, the forthcoming Arular . It already has a lot of competition, but ""Galang"" (and its accompanying graffiti-tron video) is her most instantly infectious moment, a pack of distorto soul-stir wrapped in steel-drum-cum-keyboard reggae rattle. And hey, instead of diffusing that joy by locking ""Galang"" (and the rest of her oeuvre) in the simplified human-interest carnival of the tsunami tragedy, try absorbing M.I.A.'s jubilant blaze-a-laze on its own terms. Yes, music-for-music's-sake is incredibly naive, but besides the obvious beats, wrapped inside the syllables of ""Galang""'s tossed off doggerel, there's some truly soothing balm.",Brandon Stosuy,20,Pitchfork,The Top 100 Singles of 2000-04
LCD Soundsystem,Yeah (Crass Version),2004,"What will I tell my grandkids about LCD Soundsystem? ""Well, it was this group, or this one guy, and he made these great pop songs. Or no, they were dance songs. And they weren't actually all that popular, but they were great, and he would have these really stupid lyrics. Well, they weren't stupid, they were funny. But they were pretty stupid, too, and he would say them over and over again, and the music would get louder and crazier, and he was doing this thing like Mark E. Smith with his vocals. Mark E. Smith? Oh, nevermind. But they-- I mean he-- had this one song where it was really long, and did all that stuff I just talked about, and it was great. It was like acid house but kind of post-punk and... acid house and post-punk? Nevermind. You should really just listen to it, it's great. I mean, it might not compare to your Aural Recursive Consciousness exercises, but it made us happy back then.""",Joe Tangari,19,Pitchfork,The Top 100 Singles of 2000-04
Outkast,Ms. Jackson,2001,"Unless you're in the habit of digging up b-list Gerald Levert albums, the sentiment ""Ms. Jackson"" expresses is rare within any genre of music. Even now, Outkast's courageous and tender worldwide apology from single dads to ""baby's mommas and baby's momma's momma's"" sounds like a revelation. Tempered by a cascading piano line and a pained, heartfelt timbre, Andre 3000 explains to Ms. Jackson the pitfalls of puppy love and pregnancy, with an arresting chorus: ""I'm sorry, Ms. Jackson/ But I am for real/ Never meant to make ya daughter cry/ I apologize a trillion times."" Meanwhile, Big Boi's oft-ignored verses detail an anguished attempt at dialogue: the plight of the single dad who's trying hard to be involved with his child's life, but getting shut out by his child's grandmother. It is the jam, quirky-funk soul-salve with a goofy wedding bell sample, but it also feels much bigger-- a brave attempt to make up for the myriad songs in rock, hip-hop, blues, etc., about thuggin' 'em, fuckin' em, and cutting out before the due date. Softly, with the kind of clarity that's borne of tumult, Dre laments, ""You can plan a pretty picnic, but you can't predict the weather."" How could we not forgive him?",Julianne Shepherd,18,Pitchfork,The Top 100 Singles of 2000-04
50 Cent,In Da Club,2003,"I once took a class generously dubbed Expanding the Canon of Poetry, where we examined the lyrics to modern pop stalwarts like ""In Da Club"". A student patiently explained to our supercilious prof the differences between traditional love and so-called thug love: Like when you're ""into having sex,"" but ""ain't into making love."" Of course, no one gave a shit, because ""In Da Club"" was blowing up, along with about a half-dozen other cuts from Get Rich or Die Tryin'. Today, it's the most enduring of that album's singles, and with any luck, it'll be how we remember 50 Cent-- and probably the rest of G-Unit, too-- when these singles are the stuff of oldies radio. The track's success lies in the details: How the handclaps slur a fragment ahead of the beat, how the beeline shaker somehow gives the song a discreet shuffle, and how the galvanized strings manage to match 50's deep self-assuredness. It's what Four Tet's Kieran Hebden called ""super heavy wicked production,"" and it's downright epochal.",Sam Ubl,17,Pitchfork,The Top 100 Singles of 2000-04
Daft Punk,Digital Love,2001,"Since the overwhelming majority of commercially inclined dance acts would do well to write something on par with an average Daft Punk tune, an above-average Daft Punk tune is a special thing indeed. ""Digital Love"" is better than an above-average Daft Punk tune-- it's their best-- and as such, is probably a serious contender for the most perfect five minutes in the history of bubblegum pop. A brain-melting synthesis of wet keyboard riffs, sweep filters, and vocoders, this without doubt is the first track I would reach for if someone asked me to play the sound of pure, unmitigated joy. From the liquid keyboard sample at its heart to the baroque electronic guitar solo at its conclusion, ""Digital Love"" is one of the few songs from the last five years that still feels like it has genuine magic coursing through its veins.",Mark Pytlik,16,Pitchfork,The Top 100 Singles of 2000-04
Radiohead,Pyramid Song,2001,"True confession time: I've never heard a complete Radiohead album in my life. Seriously. I just don't seek that shit out. It's just really not my thing, so I don't bother, except... A few years ago, there I was, reclining in the Brinks-like tomb of Fort Snob, lecturing a select crowd of stuffed animals about the proper maintenance of my Borbetomagus collection, safe in the knowledge that I was the undisputed lord of a Radiohead-free zone (and for a while, such spaces were all too rare), when-- ninja-like, with a stealthy flutter of jazz piano chords and tumbling snares-- in crept That Voice singing a melody so goddamn gorgeous that Fort Snob kinda caved in and went all mushy inside. I jumped into the river, and black-eyed angels swam me to an obsidian necropolis where The One Great Radiohead Song lies dead but dreaming. It was a painful episode and I'd rather not talk about it; here at the Yorke-Greenwood Institute for Recovering Music Snobs we're told to take it one day at a time.",Drew Daniel,15,Pitchfork,The Top 100 Singles of 2000-04
White Stripes,Fell in Love With a Girl,2002,"Forget the candy-cane costumes and the in-quotes ""garage rock"" labels. Disregard that Lego music video in all its look-at-me genius. Piss on your copy of Elephant and your roommate's short-lived in-quotes ""blues band."" Whether ""Fell in Love With a Girl"" is the dusty depot where blind bluesmen named Willie hopped the last freight train to Indie Rock or merely Jack White's snotty rejoinder to the Buzzcocks' ""Ever Fallen in Love?"", its self-consciously sloppy pop racket is instantly mammoth. The first time a friend played it for me, as we stuffed envelopes for an online record store, the stupid-smart power chords hit us like expired Jolt cola spiked with that new Red-Bull-and-lighter-fluid shot drink all the club kids swear by. A few Ohio State Theta Kappa Epsilons expecting the new O.A.R. record were probably mystified at first by the 1000 Hz voodoo pumping from their Pathfinders. ""I was going to send it back,"" read one cryptic e-mail to customer service, ""but track four helped me bench a buck ninety."" No refunds were requested.",Marc Hogan,14,Pitchfork,The Top 100 Singles of 2000-04
Britney Spears,Toxic,2004,"Somehow, Britney Spears keeps going. Like her would-be idol Madonna, she's managed to adapt to changes in pop production and image. (Perhaps tomorrow's pop historians will look upon the handful of artists who survived the late 90s through the first half of the 00s intact as a race of superpeople.) Avant and Bloodshy's track referenced the Middle East just subtly enough that you didn't think of it is just another one of those Middle Eastern-sounding songs, and its fingernails-on-blackboard string hook lodged in our heads. ""Toxic"" is bouncy, concise. and even clever",Dominique Leone,13,Pitchfork,The Top 100 Singles of 2000-04
R. Kelly,Ignition (Remix),2003,"It's one of the great miracles of modern pop music that a figure as colossally fucked up and patently ridiculous as Robert Kelly should also happen to be one of its finest songwriters. To that end, the fucked-up, ridiculous, and fine ""Ignition (Remix)"" is his greatest moment, a sticky bit of loverboy bombast so infectious and so absurd that it momentarily transcends any questions of depravity. Kelly sort of sing-raps here, and has more fun with the English language over three minutes than a lot of rappers do for entire albums. He toasts for a line, makes some train noises, rhymes ""fro"" with ""radio,"" and beats crunk to the joy of ""unk"" by a solid six months. It takes a special kind of man to write a vagina-as-car-part metaphor, and it takes a whole other kind of special man to wear a Muppet pelt in public",Mark Pytlik,12,Pitchfork,The Top 100 Singles of 2000-04
Justin Timberlake,Cry Me a River,2002,"Justin Timberlake was one of the first contemporary teen-pop stars to be acknowledged and back-patted by erstwhile rock critics (even the impossibly stodgy New Yorker begrudgingly anointed ""Cry Me a River"" a ""perfect pop song"") long accustomed to disdainfully snorting at any artist, save the Beatles, whose primary demographic consists of pre-teen girls. Timberlake's solo debut, the wincingly titled Justified, may have included a few too many snotty shouts of ""Oh!,"" but second-single ""Cry Me a River"" solidified his importance as a songwriter (or, okay, collaborator) capable of more than just hyper-choreographed dance moves and/or sheepish grins. ""Cry"" opens with raindrops and faux-opera caterwauls devolving into a honking kazoo melody and squirrely beat-noise; later, a one-million-voiced Justin yawns his puppy-dog laments over seagull-caws and synthesized strings, as each of the song's countless squawking bits coalesces into a seamless whole. Theoretically, ""Cry Me a River"" falls in the uncomfortable gap between ""club banger"" and ""jam for sobbing into your pillow,"" but the awkwardness of what to do with your feet is more than compensated for by Timbaland's genius staccato beats and Timberlake's bananas vocal harmonies: ""Cry Me a River"" is dark and oddly pretty, sinister and sexy, and impossibly compelling.",Amanda Petrusich,11,Pitchfork,The Top 100 Singles of 2000-04
Yeah Yeah Yeahs,Maps,2003,"""Maps"" is a song of contrasts: Nick Zinner's towering guitar lines against Karen O's soft vocals, the song's romantic gentleness against the album's frictive buzz, its openhearted emotions against the band's reputation for over-the-top posturing. Singing ""Wait... they don't love you like I love you,"" Karen O transforms from stage goddess into insecure lover, without letting her vulnerability sound like weakness or whining. Heard on the radio, playlisted between Hoobastank and 3 Doors Down, ""Maps"" becomes a hipster delegate to the masses, proving that the line between ""mainstream"" and ""underground"" is perhaps more porous than many people thought. Heard within the context of Fever to Tell, it kicks off a near-perfect three-song set that closes the album and proves the Yeah Yeah Yeahs deserved all that backlash-baiting hype.",Joe Tangari,10,Pitchfork,The Top 100 Singles of 2000-04
The Rapture,House of Jealous Lovers,2002,"I'm surprised that indie rock dudes went from blasting this song on repeat 700 days in a row to vilifying it like the band had committed some horrible sex crime. I'm also surprised how all-kinds-of-music dudes went from vilifying indie kids for not dancing to blasting them even more for thinking dance-punk was ""real"" dance music. You're all assholes, frankly: ""House of Jealous Lovers"" is still an incredible song, wirey and stuffed with hooks from its bassline to Luke Jenner's man-perm. What made ""HOJL"" the token punk song for house DJs and the token house track for punks though was the DFA's respectable middle ground: Tim and James kept the original drum sounds intact but sliced and reordered them; they doubled the snare with handclaps and ten-volted guitars with electro accents; they put so much cowbell in the mix, Will Ferrell had to quit SNL. Christ, guys, this song is so not the enemy.",Nick Sylvester,9,Pitchfork,The Top 100 Singles of 2000-04
Missy Elliott,Work It,2002,"In ""Work It"", Missy Elliott hops up as a sexually and culturally empowered super-force, encouraging staid, glaring men everywhere to ""go downtown""-- and then, when they're finished, to go old school, stop fearing the moonwalk (""Everybody had a zipper jacket, and half of these thugs had a glove to match it!""), and just ""have fun."" Missy's is deceptively simple advice, given the staggering innovation of ""Work It"", which ultimately functions as a whole lot more than just an excuse to moan, giggle, and dance. Timbaland's space signals and raucous scratches are almost as squiggly and backwards as Missy's twisted vocals and homegrown dialect (unsurprisingly, ass as ""ga-donk-a-donk-donk"" didn't take terribly long to slip into the vernacular), creating loads of heady artist/producer synergy. Spastic and addictive, ""Work It"" somehow eschews pop's typically self-perpetuating habits and introduces a brand new aesthetic, a paradigm so weird and uncompromising that it just can't be reproduced-- making ""Work It"" one of the most mind-blowingly bizarre pop songs to ever top the Billboard charts.",Amanda Petrusich,8,Pitchfork,The Top 100 Singles of 2000-04
Beyoncé [ft. Jay-Z],Crazy in Love,2003,"All she really had to do was show up, right? She had the beat, the guest-rap, the chorus, the fucking pre-chorus; Beyoncé's melody was as smooth as it was minimal as it was hard to actually mimic. She has better flow than Jay-Z here, and when she accuses her man of making a fool of her, it's as desperate a declaration of love as it is hard to believe. The track itself is a throwback, not to the disco anthems of Donna Summer but to the soul-symphonettes of Ike &amp; Tina Turner and the Supremes, with more than a pinch of Aretha Franklin's fingerwagging-- not to mention her voice. Beyoncé sings like everything is hopeless, but sounds on edge. ""Uh oh, uh oh, uh oh, oh no-no,"" goes her mantra, and so goes the this song, spiraling down a drain where, at the bottom, sits love and lust and sweat, and yes, it's getting hot in here, and yes, we play this when things are getting really good after they were already incredible. A classic.",Mark Pytlik,7,Pitchfork,The Top 100 Singles of 2000-04
Annie,Heartbeat,2004,"It still feels like a shocking upset that Annie ended up at the top of our '04 singles pocket playlist, somewhat akin to Valparaiso cutting down the nets at the NCAA Tournament. The cultural significance of that Cinderella story was already nicely put by our staff's Chief Ambassador of Pop-Indie Relations, but now, just a few short months later, we can just ramble about what a frickin' awesome song it is. Packed with shimmery keyboards and euphoric harmonies that shoot out light rays like a sunrise, Annie provides just the right amount of breathless innocence in her vocals-- dig how her voice can't handle that high-note ""truuuuly!""",Rob Mitchum,6,Pitchfork,The Top 100 Singles of 2000-04
Kylie Minogue,Can't Get You Out of My Head,2001,"On April 1, 2002-- in accordance with an announcement that it had been sold to a major media conglomerate-- Pitchfork published an April Fool's issue that contained glowing reviews of Alanis Morissette's Under Rug Swept , Jars of Clay's The Eleventh Hour and-- wait for it-- Kylie's Fever.* ""Now back to our regular programming. We hope we didn't freak you guys out too much!"" Around the same time, I remember reading a handful of apologetic pieces from local music critics bashfully declaring their love for ""Can't Get You Out of My Head"". I like to think that kind of coming-out would seem almost anachronistic now, but in the days before mashups and bootlegs and blogs and the golden age of the American pop producer, some hand-wringing was certainly required before you could publicly like the song you secretly loved. ""Can't Get You Out of My Head"" is 231 seconds long, which is not a very long time in which to change someone's mind. The reason I voted for it as my favorite single of the decade so far is because I feel that, more than any single from the last four years, it represents an important change in the way that we thought about and selected our music. Whether that's because of something fundamental about the song itself or because it was written and released at the right time or because someone wrote an entire book about the history of pop music with these 231 seconds as its basis, I'm not really sure. What I do know is that my #2** was a very, very distant second.",Mark Pytlik,5,Pitchfork,The Top 100 Singles of 2000-04
Missy Elliott,Get Ur Freak On,2001,"A Short Didactic Play(Scene: Hip hop Mount Olympus, high above the Virginia plain. A Japanese herald announces the dramatis personae) Missy: ""Headbanger, gimme some new shit"". Timbaland (acting nonchalant, but he knows he's at his best here): ""Behold, I have reached down from the clouds and rolled up the entirety of the musical heritage of the Indian subcontinent into a bouncing rubber ball, and all this I have bound with a bassline of woozy buzzes scavenged from a dodgy rave. It's yours."" (She takes it from him, and begins to flow on top of it, and as she flows it is as if for that three-and-a-half minutes the entire world must stop whatever it was just doing and instead attend wholeheartedly to getting its collective freak on.) Missy (speaking to the grizzled hag Radio): ""Listen to me now, I'm lastin' 20 rounds."" Radio (shaking like Missy's got a gun, but secretly plotting to neutralize her through overexposure): ""I cave in to your demands; we're going to play this one to death."" (evil laughter) Missy (hocking a loogie): ""Silence when I spit it out!"" Troll Chorus of Music Critics (in tears): ""Hail Missy, Queen of Heaven, we grant thee the laurels."" Missy (bitterly): ""Don't copy me. Y'all do it sloppily"". Goblin Chorus of Bootleggers and Mash-Up Arrivistes: ""Copy Thee"" Programmer Wraiths: ""Ditto"" Missy (triumphant): ""I'm the best around, with this crazy style"" (The song travels the earth, and then re-ascends to paradise, impervious and hardy despite the plots of Radio. Much Rejoicing. The end.)",Joe Tangari,4,Pitchfork,The Top 100 Singles of 2000-04
