Artist,Song,Year,Review,Reviewer,Ranking,Source,Source Title
Perfume Genius,Ugly Season,2022,"On the LGBTQ+ anthem “Queen,” Mike Hadreas embraced the power in being viewed by homophobes as a “sea witch with penis tentacles.” Eight years later, over the skeletal reggae beat of “Ugly Season,” his exploration of queerness veers further left: He is a heathen outcast finding abject pleasure and autoerotic arousal in filth, rot, and hearty handfuls of Vaseline. Hadreas’ voice is high and pure amid guttural screams and mammalian lurches, offering hymnic bon mots that could have been written by Jean Genet: “Split, black, pit.” This year, asqueerartistspowerfully embraced monstrousness-as-dissent, “Ugly Season” burrows into outsider living to emerge as a swamp creature with carnal allure and a tender caress.",Owen Myers,64,Pitchfork,The 100 Best Songs of 2022
Azealia Banks,New Bottega,2022,"Azealia Banks considers the difference between fashion (what you wear) and style (what you possess) on “New Bottega,” which is to say, she is aware of how much she lays claim to. Some of the biggest albums this year drew on club sounds like a strategy, but the Harlem-bred Banks has always made a home inside house music. As she lists the names of designers she likes and doesn’t like in a bad Italian accent, “New Bottega” enters into the Banksian capsule collection—a staple in a malcontent designer’s oeuvre.",Mina Tavakoli,63,Pitchfork,The 100 Best Songs of 2022
Fever Ray,What They Call Us,2022,"This is the sound of crisis approaching from all sides: the escalating cruelties against its subjects (“did you hear what they call us?”) and the indifference of those watching it happen (“can you fix it, can youcare?”). In a desperate plea for mercy, Karin Dreijer sings as if they’re grinding their teeth down to the nerve; the track shudders and startles at every turn, desolate synths circling the arrangement like vultures above wasteland. Despite this, “What They Call Us” is not the sound of defeat. It’s a defiant snarl in the face of circumstance: “I will stay if Idare.”",Katherine St. Asaph,62,Pitchfork,The 100 Best Songs of 2022
Amber Mark,What It Is,2022,"Uncertainty can gnaw at your psyche, boxing out every other thought. But Amber Mark imbues the troubling feeling with celestial wonder on “What It Is,” looking to a higher power to answer her questions following a failed love. The neat and simmering groove moves in lockstep underneath the R&B singer’s vocals, which mix her patient tone with agile vocal runs and gasping harmonies. Adrift in a stream of milky synths, she shows how powerful it is to be lost.",Brandon Callender,61,Pitchfork,The 100 Best Songs of 2022
Plains,Problem With It,2022,"The charm of Katie Crutchfield and Jess Williamson’s album is how they seamlessly combine their simpatico strengths—the plainspoken emotiveness, the pretty melodies, the diaristic attention to experiences big and small—into easy-breezy country-pop that wouldn’t sound out of place on Nashville radio. “Problem With It” is the shining jewel from their debut LP as Plains, an airy travelogue of deep feelings about wanderlust and wack lovers that glides by like a fast car on an empty interstate. And the harmonies! There’s true joy in their vocal communion, most striking when the instruments drop out and it’s just the two of them singing, finding their peace and place in the world within each other’s presence.",Jeremy Gordon,60,Pitchfork,The 100 Best Songs of 2022
Alabaster DePlume,Don’t Forget You’re Precious,2022,"The Mancunian saxophonist and spoken-word artist Alabaster DePlume meanders through the stuff stuck in his mind: an ex’s email address, a train transfer, assorted strings of identifying digits. Despite these thoughts—or even deeper, more abstracted aches—he delivers a serene reminder of what matters most. “They can’t use us on one another if we don’t forget we’re precious,” he offers. Against airy background vocals and fluttering strings, DePlume’s comforting reassurance feels like a secular blessing, a private rallying point away from life’s greedy clamor.",Allison Hussey,59,Pitchfork,The 100 Best Songs of 2022
Kehlani,melt,2022,"Kehlani’s desire for intimacy is insatiable, even as they tangle with their lover in bed. Over Happy Perez and Pop Wansel’s blissful backbeat, Kehlani meticulously and melismatically details a fantasy where they share a physical form with their partner, with only Kehlani’s tattoos differentiating them. In an era flush withsapphic love songs,“melt” stands out for both its grandiose string arrangement and its specificity, finding the most happiness in quiet moments.",Hannah Jocelyn,58,Pitchfork,The 100 Best Songs of 2022
Camp Cope,Running With the Hurricane,2022,"Fiona Applespread like strawberries and climbed like peas and beans; Camp Cope run with the hurricane, setting aside the heavy balloon of depression and obsessive self-loathing to keep pace with the forces that might otherwise knock them flat. There’s some Springsteen-y heroism in their full-pelt charge towards daylight—“Look out boys/I’m on fire and I’m not going out,” Georgia Maq announces—but the Australian trio is mostly guided by their country-punk foremothers: the Chicks, Lucinda Williams, Gillian Welch, Neko Case. The song rattles along in a lovely cacophony of jangling piano, lunging bass, and a baton-swap of choruses, like some junker with sturdy suspension and everything else nailed down just barely enough to make your escape.",Laura Snapes,57,Pitchfork,The 100 Best Songs of 2022
Beyoncé,Break My Soul,2022,"“Break My Soul” demands its listeners leave all psychic weight at the door. “Release the stress!” a Big Freedia sample commands inside an Earth-shaking house pulse, as Beyoncé presides over the dancefloorlike she just rode in on the back of a hologram horse. Bey gives a fully embodied performance that invites the rest of us to luxuriate inside our own bodies—to spit out the toxins and savor the pleasure that floods in once they’re gone. Unleashed at the height of summer, “Break My Soul” ushered in a sorely needed season of abandon and relief, serving as balm and catalyst at the same time.",Sasha Geffen,56,Pitchfork,The 100 Best Songs of 2022
"Black Country, New Road",Basketball Shoes,2022,"It’s impossible to know precisely how many songs have been written about Charli XCX wet dreams, but you could reasonably assume only one is a 12-minute chamber-rock requiem whose reference to Concord Air Jordans bore a concept record about the Concorde jet disaster. “Basketball Shoes” erupts with the essentials of Black Country, New Road: frenetic tempo changes, bright arpeggiation, violin, saxophone, glockenspiel, distortion, screaming, doorbell chimes. Concluding more than their albumAnts From Up There, the finale bids adieu to singer Isaac Wood, who left the band days before its release.",Hannah Seidlitz,55,Pitchfork,The 100 Best Songs of 2022
DJ Python,Angel,2022,"Reggaeton always seems to figure into discussions of DJ Python’s music—the New York-based producer did previously coin the term “deep reggaeton” to describe his sound—but while “Angel,” the lead track from hisClub Sentimientos Vol. 2EP, is built atop a loosely Caribbean shuffle, the sprawling tune is better suited to an afternoon of lounging by the pool than a sweaty night of perreo. Gliding across nearly 11 minutes of plush textures and dreamily plinking tones, the song has a hypnotic, almost womb-like allure, its patient pulse exuding a luxurious (but never ostentatious) sense of cool.",Shawn Reynaldo,54,Pitchfork,The 100 Best Songs of 2022
FKA twigs,honda,2022,"Where FKA twigs’ 2019 albumMAGDALENEpeeled back the skin of a visceral pain, her 2022 mixtapeCAPRISONGSrediscovered a sense of somatic joy. twigs leans all the way into that physicality on “honda,” a dubby duet with the English artist Pa Salieu. Over a bone-deep bassline, Salieu and twigs’ voices twist around one another, mirroring the tangled, dancing limbs they sing about. At first listen, “honda” is all sensual chemistry, felt across a dancefloor, or speeding down the highway. But Salieu’s breezy monologue about looking at himself in the mirror frames the song in a different light: It’s also about those moments you feel entirely in your own body, reclaiming your “one-of-a-kind” self.",Aimee Cliff,53,Pitchfork,The 100 Best Songs of 2022
Fontaines D.C.,Jackie Down the Line,2022,"The lead single from Fontaines D.C.’sSkinty Fiais seductively dark, with a menacing bassline, gnarly ’90s post-punk guitar skeins, and a lyric that masquerades as a toxic-boyfriend confession. Like much of the album, “Jackie Down the Line” reveals itself with unpacking as ameditation on Irish identity: in this case, an examination of the way that cultural marginalization can breed self-hate and self-fulfilling prophecy. Grian Chatten’s Dublin brogue, flecked with the soulful British surliness of Mark E. Smith and Noel Gallagher, complicated things further. So did the song’s video premiere, brilliantly stagedfor the Tonight Showin a deserted theater for a roving camera that seemed unable to get a fix on the singer—much like the singer himself.",Will Hermes,52,Pitchfork,The 100 Best Songs of 2022
KH,Looking at Your Pager,2022,"Kieran Hebden’s flair for tunes that intersect credibility and popularity already put him in a lofty position, but “Looking at Your Pager” proved another beast entirely. With fangs added to 3LW’skiss-offand those signature pearlescent Four Tet chimes dashed against a pair of impudent basslines—like fine snow gracing an enormous, stinking cement mixer in mid-churn—2021’s fervently sought track ID became 2022’s great dancefloor unifier: It runs with the current UK vogue for growling mechanical steppers while offering sanctuary to nomads wandering America’s post-EDM plains in search of a new thrill. Although “Pager” gifted countless DJs a get-out-of-jail card this summer, they should be on red alert. Hebden’s ear for a monster hit is only getting stronger.",Gabriel Szatan,51,Pitchfork,The 100 Best Songs of 2022
Danger Mouse / Black Thought,Belize,2022,"MF DOOM’s appearance onCheat Codesrepresents a bit of unfinished business: Danger Mouse, who originally produced DOOM’s long-vaulted verse, had long wanted the Roots’ Black Thought for the track. What could’ve been an autumnal team-up between two all-time rap technicians became, with DOOM’s passing in 2020, a melancholic meeting across the veil. The Villain’s sardonic epitaph (“They knew he was a negro/So no need to show faces”) draws as much blood as the world’s longest Erik Estrada joke, while Black Thought’s polished yet playful verse is a tribute to the sly anarchy DOOM could elicit, whether or not he was in the room.",Brad Shoup,50,Pitchfork,The 100 Best Songs of 2022
Jessie Ware,Free Yourself,2022,"The beloved British singer responsible for one of the pandemic’s premiere pop albums teamed up with studio whizz Stuart Price and returned this summer with another ode to love and dancing. “Free Yourself” takes Ware’s blend of ’70s disco and ’80s boogie and shimmies it ecstatically into the ’90s—jacking acid house drum fills, flamboyant male backup singers, gospel piano—without losing an ounce of charm. And when, this fall, she finally sang it live in front of a New York crowd pitched to Judy-at-Carnegie-Hall pandemonium? It became a new classic.",Jesse Dorris,49,Pitchfork,The 100 Best Songs of 2022
Ravyn Lenae,Light Me Up,2022,"“Light Me Up” is about the soft hope of a blossoming romance. The Steve Lacy-produced song begins with uncertainty, pacing in circles over tranquil bass guitar and kicks that pulse like a slowed heart. Lenae’s tender vocal runs descend like creek water as she describes the exhilaration of trying on someone new: “No coming down, I love the view.” The song’s private intensity makes it fit for a closed-doors affair in a candle-lit room, but Lenae’s weightless voice and quiet vulnerability makes it impossible not to want to listen in.",Jane Bua,48,Pitchfork,The 100 Best Songs of 2022
Maren Morris,Circles Around This Town,2022,"Maren Morris does the impossible: She makes driving in Nashville sound fun. A sly bit of memoir set to music, the first single fromHumble Questrecalls the singer’s earliest days as a Tennessee transplant, driving her “Montero with the AC busted” through traffic to look for a record deal and maybe find a little inspiration on the radio. It’s been a decade since she arrived in town, but she might as well be singing about what she did last weekend. She arrived in Nashville hungry. Several years and many miles later, she still is.",Stephen Deusner,47,Pitchfork,The 100 Best Songs of 2022
Drake,Sticky,2022,"On an album that often sounds like he’s searching for something (novelty, if you’re being generous; relevance if you’re not), “Sticky” is where Drake issues his demands: for more guests at the Met Gala, for police escorts, for a kiss, requested in curling French-Canadian. Like the best Drake songs, “Sticky” pressure-cooks his brashest impulses until they congeal into something tender. The club closes; the neon lights sputter out, and “it’s you alone with your regrets.” The stickiest situations are always the ones that trap you in your own thoughts.",Dani Blum,46,Pitchfork,The 100 Best Songs of 2022
Lucrecia Dalt,El Galatzó,2022,"Lucrecia Dalt’s forceful whisper seems to lightly kiss the microphone, capturing the uncomfortable intimacy of another’s breath against your ear. A flute swirls in the stereo mix, and by the third minute of “El Galatzó,” the strings swell into a crescendo and her plaintive speech gives way to a soulful chorus of spirits. This is, of course, the alien Preta, the protagonist of her latest album¡Ay!, who arrives flush with newly realized erotic power, rejecting the illusion of linear time. It’s a blast of sci-fi folklore, with an anti-colonial POV. The songs and stories of our ancestors aren’t relegated to the past; that kind of temporality, Dalt suggests, is merely a misconception of the unevolved.",Matthew Ismael Ruiz,45,Pitchfork,The 100 Best Songs of 2022
Taylor Swift,Anti-Hero,2022,"Sometimes the world really does revolve around Taylor Swift: Is there any other artist who could force urgency into the federal investigation of a music industry monopolyjust by going on tour? With “Anti-Hero,” Taylor mirrors an entire lifetime of being a coy main character—the bleacher seat-warmer, the “insane” jealous ex, the doomed princess—with one addictive, charming declaration of self-awareness. Her vocal theatrics are spiked with the very millennial instinct to disguise confidence with self-deprecation, using the tools of a generation obsessed with self-reflection to make one of the best pop songs of the year.",Puja Patel,44,Pitchfork,The 100 Best Songs of 2022
Carly Rae Jepsen,Western Wind,2022,"A “jubilation” conjures such a specific kind of party—maybe a little Catholic, maybe a little royal, something grand and elegant with streamers, champagne, castles. When Carly Rae Jepsen sings the word “jubilation” on “Western Wind”—a midtempoLive, Laugh, Lovepop song produced by Rostam from Jepsen’s album *The Loneliest Time—*it’s about a memory of her clearing aside all the furniture in her living room to make a space to sing and dance with her family. It’s so simple, so delightful, so inviting. The sneakily well-built song bubbles along softly, like a sleepy little “Freedom! ’90,” a road trip jam that can silence everyone in the car as Jepsen sings this question: “Do you feel home from all directions?” Not sure what it means, but like the best songs, the answer when you’re listening is an unequivocalyes.",Jeremy D. Larson,43,Pitchfork,The 100 Best Songs of 2022
MJ Lenderman,Tastes Just Like It Costs,2022,"When MJ Lenderman’s guitar gently weeps, his songwriting keeps a stiff upper lip. Like everything on the indie rocker’s breakthrough albumBoat Songs, “Tastes Just Like It Costs” contrasts the looseness of his playing—a saggy opening riff reminiscent of Queens of the Stone Age, some curdled Dinosaur Jr. soloing—with the extreme economy of his lyrics. In a handful of four- and five-line verses, he sketches a scene appropriate for aPortlandiasketch, or maybe a horror film: an upscale butcher shop, a “dumb hat,” a sourceless scream. “Mm, honey/It tastes just like it costs,” he drawls over glowing charcoal fuzz, savoring the sweetness of the ambiguity.",Philip Sherburne,42,Pitchfork,The 100 Best Songs of 2022
Charlotte Adigéry / Bolis Pupul,It Hit Me,2022,"On the Belgian electropop duo Charlotte Adigéry and Bolis Pupul’s debut LP,Topical Dancer, “It Hit Me” pierces through their theatrical scrim. Tackling the fraught subject of sexual spectacle—from the grimy discomfort of being leered at for the first time to the inane seduction techniques found in women’s magazines—“It Hit Me” guides us through the funhouse mirror of navigating one’s sexuality. The chorus underscores the weight of Adigéry and Pupul’s realizations, letting us feel the gut punch with them—and inviting us to dance through it all.",Sue Park,41,Pitchfork,The 100 Best Songs of 2022
Yaya Bey,keisha,2022,"“keisha” is a breakup anthem made for a specific type of bad bitch: an independent woman who puts up with annoying “Where my hug at?” dudes, but still just wants to be loved and madly desired. Yaya Bey knows her audience is foul-mouthed, slightly toxic, lovestruck, and aroused by good, flirty conversation, so she adopts a feathery guitar riff that floats through the song. But when she sings the indelible chorus—“Yeah the pussy so, so good/And you still don’t love me”—it’s comedy and tragedy all rolled into one.",Tarisai Ngangura,40,Pitchfork,The 100 Best Songs of 2022
Megan Thee Stallion,Plan B,2022,"The high road is unsatisfying and often boring. Mud-slinging reveals something closer to the truth, and on “Plan B,” the truth sets the Houston Hottie free: “Fuck you, still can’t believe I used to trust you/The only accolade you ever made is that I fucked you.” Bolstered by a Jodeci sample, Meg spits with equal parts force and charisma, confronting not just the anger of a bad relationship but also the pain. Just ’cause you’re a bad bitch doesn’t mean you can’t have your feelings hurt.",Jessica Kariisa,39,Pitchfork,The 100 Best Songs of 2022
Angel Olsen,Big Time,2022,"Even the brightest-burning romances are made up of quiet moments. With “Big Time,” Angel Olsen gives listeners a glimpse into that kind of intimacy: She and her partner Beau Thibodeaux, who co-wrote the song, drink coffee, lay in the tall grass, and walk down to the lake, singing Chris de Burgh’s “The Lady in Red.” Olsen’s brassy, stuck-out-of-time voice and the breezy, country-inspired arrangement imbue those details with the gleam of universal truth. The sweetly delivered line “I’m loving you big time” is a beacon in Olsen’s hands. Its disarming simplicity cracks open her incandescent partnership, letting its light pour out all over everything.",Brad Sanders,38,Pitchfork,The 100 Best Songs of 2022
Sudan Archives,Home Maker,2022,"With the world coming back outside again, “Home Maker” shows that staying in the crib can be just as worthwhile. Sudan Archives sidesteps the opaque nature of some of her previous work for a straight-ahead introvert’s anthem. “I cry when I’m alone,” she coos atop propulsive drums and looping handclaps. “All these people don’t know/That I deal with all of these doubts.” Yet the song doesn’t wallow in sadness; it is empowered, therapeutic, and honest.",Marcus J. Moore,37,Pitchfork,The 100 Best Songs of 2022
yeule,Bites on My Neck,2022,"Part hyperpop cyborg, part suffering bedroom songwriter, yeule deals in emo-tinged laments that conceal deep, impossible desires: to be numb and euphoric at once; to be touched without a body. The Singaporean musician floats between dissociative sing-speak and lullaby coos on “Bites on My Neck,” corralling meteor-shower synths and pugilistic kick drums to offer a fresh perspective on pleasure-centric dance pop. Co-written and produced with Danny L Harle and Mura Masa, the track owes as much to M83’s starbound symphonies and Laurie Anderson’s deadpan alienation as to post-PC Music clubland. Yeule hijacks that garish pop paradigm in service of more vaporous emotions, funneling a post-breakup identity crisis into an immaterial rush.",Jazz Monroe,36,Pitchfork,The 100 Best Songs of 2022
Special Interest:,Midnight Legend” [ft. Mykki Blanco],2022,"When the drugs have run dry and you’re about to ditch the club, “Midnight Legend” will call you back. You hear those bouncing ’90s house keys, the synthetic snares that clack like costume jewelry on a cheap bartop. Special Interest vocalist Alli Logout pulls double duty: They are your disco deity, your rave therapist. “They all pine for you/Built you to destroy you,” Logout belts, before partner-in-crime Mykki Blanco slides in with a brassy verse. “Daddy pay the bill but I don’t fuck him,” Blanco snaps over a four-on-the-floor pulse. The divas have arrived—dancefloor salvation.",Madison Bloom,35,Pitchfork,The 100 Best Songs of 2022
Grace Ives,Shelly,2022,"Grace Ives’Janky Starsprings to life like a miniature jukebox of sputtering New York love songs, each delectable hook blaring through with a raggedy kind of charm. Where most of the album channels the raunchy electro-pop of the aughts, “Shelly” calls out the oldies: its power poppy, guitar-chugging strut feels more of a piece withPulporRick Springfield. Ives cheekily lusts after a woman who reminds her of the titularTwin Peakscharacter, breathily proclaiming, “I wanna 1-2-3-4-5 her.” It’s as winking as it is sweetly sincere, like a parody of all those unrequited-love karaoke classics that’s so positively giddy it ends up becoming the real thing.",Sam Goldner,34,Pitchfork,The 100 Best Songs of 2022
Big Thief,Spud Infinity,2022,"What exactly is the connection between potatoes and human existence? Who knows. But the absurd central metaphor in Big Thief’s “Spud Infinity” makes it both the band's homeliest song and possibly their most beautiful, escaping like a big, snorty laugh from their murmuring double album,Dragon New Warm Mountain I Believe in You. The mouth harp and see-sawing fiddle are the perfect accompaniment to Adrianne Lenker’s outrageously playful lyrics, rhyming “finish” with “potato knish” in a flourish that would make John Prine crack a mile-wide grin.",Jayson Greene,33,Pitchfork,The 100 Best Songs of 2022
Chief Keef,Bitch Where,2022,"Chief Keef is at an emotional crossroads. The Chicago native is still as wild and irreverent as ever (“At the gun range, sound checkin’, it sound clear”) but he’s also uncharacteristically grateful to still be alive and creating after a decade in the industry. “Bitch Where” plays these fantastical tonal leaps against a triumphant beat made for a king returning from war, but once the smoke clears, a message from Keef’s grandmother maintains the air of gratitude: “Keep going, baby. Keep going. Granny just love how you move and doing yourself.”",Dylan Green,32,Pitchfork,The 100 Best Songs of 2022
Charli XCX,Constant Repeat,2022,"There are glimmers of Charli’s cyborg tendencies onCrashstandout “Constant Repeat”—the high-pitched blips, the sliced-and-diced vocal outro—but it moves more lightly ​​than the revved-up pop for which she’s become known. Charli is at ease, luxuriating in Jacuzzi-jet synths while delivering a resolute assertion of her worth to someone who let her go. Ostensibly about a breakup, the song becomes all the more potent consideringCrash’smeta-narrativeabout a fed-up pop star dipping out on her major-label overlords. Charli demands stardom on her own terms; the mainstream machine can take it or leave it.",Olivia Horn,31,Pitchfork,The 100 Best Songs of 2022
Ice Spice,Munch (Feelin’ U),2022,"Merriam-Webster defines “munch” as a verb that means “to eat with a chewing action.” Which is wrong. Or, at least, incomplete. Because according to Ice Spice, the word is a noun that describes a particularly clueless kind of guy—a dummy, a sucker, a simp. “You thought I was feelin’ you?” the Bronx drill rapper eyerolls on one of the year’s most memorable hooks, “That nigga a munch/Nigga a eater he ate it for lunch/Bitch I’m a baddie I get what I want.” Ice Spice grew up idolizing both Cardi B and Erykah Badu, and she balances her brashness with a supremely unbothered delivery, as if she’s been swatting away munches for decades. Centuries, even. Merriam-Webster, it’s time to catch up.",Ryan Dombal,30,Pitchfork,The 100 Best Songs of 2022
Jockstrap,Greatest Hits,2022,"A song called “Greatest Hits” might seem like hubris, but subversive audacity is encoded into Jockstrap’s DNA. On this highlight ofI Love You Jennifer B, the London duo takes the fundamentals of disco—sashaying glamor, sumptuous strings—and laces them with hyperpop mischief. “Imagine I’m Madonna/Imagine I’mtheMadonna,” vogues Georgia Ellery, self-actualizing her stardom. In an alternate reality, “Greatest Hits” is soundtracking a scene of eyebrow-raising decadence in Studio 54 at this very moment. In our timeline it’s playing out on less opulent stages, but even the humblest trappings can’t tarnish its sense of unabashed rapture.",Louis Pattison,29,Pitchfork,The 100 Best Songs of 2022
