Artist,Song,Year,Review,Reviewer,Ranking,Source,Source Title
Victoria Monét,On My Mama,2023,"The centerpiece of an album that’s equally plush and splashy, “On My Mama” is a ritzy “feeling myself” moment decked in showy horns and a stalking bass that unfurls like a red carpet. Singing confidently over a retro Chalie Boy rap sample that’s like a cool uncle playing hype man, R&B virtuoso Victoria Monét has fun luxuriating in her own sex appeal, shit-talking and whispering sweet affirmations to herself. All she wants is a good time—and the “permanent ecstasy” she deserves.",Clover Hope,30,Pitchfork,The 100 Best Songs of 2023
Four Tet,Three Drums,2023,"Four Tet just might be the most unlikely mainstream breakthrough star of the year. After spending the last two decades honing his luscious, humanistic take on dance music, he suddenly became a Coachella and Madison Square Garden headliner alongside buddies Fred Again.. and Skrillex, dishing out EDM euphoria to the masses. But “Three Drums,” released three days after the Coachella gig, has him back in classic mode. Stately and tranquil for its entire eight-minute run, it’s better suited for the ocean floor than the dancefloor. Turns out the same things that make him a fantastic party-starter—patient builds, detailed textures, pitch-perfect percussion—are also what make “Three Drums” so gripping on headphones.",Patrick Lyons,29,Pitchfork,The 100 Best Songs of 2023
Mitski,My Love Mine All Mine,2023,"The twilit centerpiece of Mitski’s The Land Is Inhospitable and So Are We became a surprise phenomenon this year when its lullaby chorus grabbed hold on TikTok, lifting it to become her first-ever Hot 100 hit. With little more than a twangy guitar, piano, and her gentle voice, the snowglobe of a ballad is simple and to the point, with a poignant emotional center. It’s a perfect snapshot of the singer-songwriter’s wistful craftsmanship—tender-hearted and sharp-toothed—as she dedicates herself to the cosmos to ensure that the all-encompassing experience of loving, and having been loved, will endure for generations to come.",Eric Torres,28,Pitchfork,The 100 Best Songs of 2023
100 gecs,Hollywood Baby,2023,"On “Hollywood Baby,” Dylan Brady and Laura Les take the alt-rock crunch, pop-punk brattiness, and skate-kid rhyming that ruled the culture of their youth and supersize the living fuck out of it. The result is a chaotic pile-up with enough molten hooks and melodic ideas to power an album’s worth of songs, wrapped in a spangly package that demands an immediate test of your speakers’ volume limits.",Mark Richardson,27,Pitchfork,The 100 Best Songs of 2023
Water From Your Eyes,Barley,2023,"Nate Amos and Rachel Brown, who record as the warped electronic duo Water From Your Eyes, compose with the sharp planes and severe angles of brutalist architects. “Barley” is a mass of meticulously placed protrusions: the clipped rhythm of a shaker that sounds packed with ice shards, synth bursts that twinkle like Mario leaping through a row of coins. What sets the pair apart from their noisemakering peers is their ability to amplify those extremes with cottony contrasting textures. Brown’s voice, temperate and deadpan, heightens the detuned bend of Amos’ guitar riffs, while husky bass fleshes out an arrangement spiked with high frequencies. The component parts of “Barley” shouldn’t necessarily work together, but the duo’s sneaky knack for pop melodies makes these serrated edges irresistible.",Madison Bloom,26,Pitchfork,The 100 Best Songs of 2023
Cole Pulice,"If I Don’t See You in the Future, I’ll See You in the Pasture",2023,"For the uninitiated, it may seem like Cole Pulice is simply leaning their forearm on all the white keys of an organ before wailing on a saxophone across this very long song. But what you are actually hearing is all saxophone, including its sound being manipulated through signal processing live in the studio by the Oakland-based electro-acoustic composer’s feet. The auditory illusion fits the mood of the piece: liminal, transitory, extremely trippy. Pulice saves the best for the end, when they repeat a squiggly little pitch-bendy riff over and over: As the production is stripped away, they intimately struggle with their altissimo register, like they’re trying to crawl back into the last 22 minutes of a dream slipping away from memory.",Jeremy D. Larson,25,Pitchfork,The 100 Best Songs of 2023
Avalon Emerson,Dreamliner,2023,"Avalon Emerson shifts away from club music and toward pop on her debut album, but she doesn’t entirely abandon the sound that has made her a celebrated DJ across the last six years or so. On “Dreamliner,” she bridges the transition across the course of the track: Thumping kicks and stiffly sequenced arpeggios evoke the mechanical techno of her back catalog, but the dance groove gradually subsides, making space for a playful synth melody that carries the song’s second half. Through it all, her cool, muted vocals do double duty as both pointillist tone color and hummable melody—a reminder that, for a musician with the requisite vision and skills, you can, in fact, have it both ways.",Rob Arcand,24,Pitchfork,The 100 Best Songs of 2023
Sexyy Red,SkeeYee,2023,"No artist left less to the imagination this year than Sexyy Red, who broke out with a single called “Pound Town” and its extremely memorable opening declaration: “My coochie pink, my booty hole brown.” That blunt approach extends to “SkeeYee,” a summer anthem off the St. Louis rapper’s debut mixtape, Hood Hottest Princess, that’s now universal enough to have countless viral remixes and a place in Fat Joe’s vocabulary. Amid a bell-chiming beat, Red explains exactly what the song’s emphatic hook means: pull up! Turns out that’s a solid rallying cry. It’s also just really fun to say “skeeyee!”—especially when you’re supposed to be quiet. “Pound Town” may have established Red on the charts, but this is the song that distills her disruptive glee.",Hattie Lindert,23,Pitchfork,The 100 Best Songs of 2023
MJ Lenderman,Knockin,2023,"In the hard-luck world of MJ Lenderman, Bob Dylan isn’t the one singing “Knockin’ on Heaven’s Door.” It’s not Axl Rose or Warren Zevon, either. Instead, it’s John Daly, the pro golfer as well-known for getting drunk and fighting as he is for his championship victories. Lenderman’s reference to Daly in “Knockin” is funny, but it’s not merely a joke: The PGA’s tragic wildman knows as much about staring down darkness as any of those other guys. Over soaring pedal steel, Lenderman places his performance among other similarly bathetic scenes: a bird singing while trapped in a hardware store, a declaration of love whose speaker knows it’s hackneyed but delivers it anyway. The point is not to poke fun at the mundanity, but to exalt it.",Andy Cush,22,Pitchfork,The 100 Best Songs of 2023
Mannequin Pussy,I Got Heaven,2023,"On “I Got Heaven,” Mannequin Pussy find salvation in rage. Marisa Dabice’s gritty screams rip the track open, as she condemns the religious powers that seek to judge and divide us in the bluntest of terms: “What if Jesus himself ate my fucking snatch?” But the song reveals sweeter sentiments in the Philadelphia band’s sparkly, shoegaze chorus, with Dabice championing the inherent worth inside of all of us. It’s a purifying song, a punk purge for the lapsed Christians still making sense of the institution that once defined them.",Maria Eberhart,21,Pitchfork,The 100 Best Songs of 2023
Kelela,Contact,2023,"Is the dancefloor ever as transcendent as it sounds on “Contact”? Atop flickering breakbeats, Kelela makes you thirst for the kind of night when bodies blur and brush against one another until last call. With her weightless voice, she makes the club sound sensual and otherworldly, like none of your problems matter as long as you and your friends have a buzz and some bass going well after midnight.",Alphonse Pierre,20,Pitchfork,The 100 Best Songs of 2023
Caroline Polachek,I Believe,2023,"Born from the holy trinity of an acid trip, grief, and Celine Dion, “I Believe” is a prismatic diva anthem dedicated to the late avant-pop pioneer SOPHIE. Robotic beeps punctuate a breakbeat, as Polachek’s voice gently cuts through the mix like a celestial strobe light. Her aerial runs spiral upwards, twisting until the song is suspended in mid-air: “I don’t know, but I believe/We’ll get another day together,” she attests over a church organ. It’s a transcendent moment of faith, a promise that Polachek will keep celebrating her friend in this life until they meet again in the next one.",Jane Bua,19,Pitchfork,The 100 Best Songs of 2023
L’Rain,Pet Rock,2023,"The patterns in L’Rain’s music are constantly shifting and weaving, like a technicolor kaleidoscope. With “Pet Rock,” the Brooklyn-based multi-instrumentalist, whose work blends experimental and pop sounds into songs that take on themes of grief and identity, turns a tongue-in-cheek nod to the Strokes into a psychedelic reverie. Drums begin with a simple rhythm and get gradually wilder until they burst into a cascade of syncopations, while electric guitars wind and interlock. The component pieces may be familiar, but L’Rain’s ever-evolving combination of them is anything but.",Vanessa Ague,18,Pitchfork,The 100 Best Songs of 2023
billy woods / Kenny Segal,Year Zero,2023,"It’s the end of the world as we know it, and billy woods is feeling particularly nihilistic. The deadpan New York rap realist sounds like he’s burrowed into a bunker on this doomsaying spiral from Maps, his staggering album with the producer Kenny Segal. Bleak thoughts fester inside his skull. Living in the only country on Earth with more guns than people, he dreams up a nightmare in which there are “two unrelated active shooters—same place, same time.” The song’s most brutal gut punch, meanwhile, is a simple matter of fact: “My taxes pay police brutality settlements.” If woods is stewing underground in this dystopian hellscape, Danny Brown is commandeering an abandoned amusement park and reveling in the anarchy. Over queasy feedback that squeals like a zombie radio signal, Brown tosses off rhetorical bicycle kicks, rhymes Cool Runnings with Good Will Hunting, and cracks wise about out-of-service McDonald’s soft serve machines. Together, the two rappers conjure an apocalypse that’s as hopeless as it is hilarious, the cruelest possible joke.",Ryan Dombal,17,Pitchfork,The 100 Best Songs of 2023
Amaarae,Co-Star,2023,"Eschewing the “Afropop” pigeonhole, the Ghanaian-American artist Amaarae uses her roots as a muse rather than a constraint, allowing her music to shapeshift endlessly. “Co-Star” channels the sugar-coated sparkle of hyperpop and the millennial obsession with astrology over fast, syncopated drums that crackle like Pop Rocks. Depending on where you stand, you might also hear PinkPantheress, a little amapiano, or, in her catty sing-rapping, a nostalgic callback to Teeyah’s early aughts diaspora hit “Couper-décaler.” That fluidity is the secret ingredient of Amaarae’s star power: We might know where she comes from but we’ll never know where she’s going.",Jessica Kariisa,16,Pitchfork,The 100 Best Songs of 2023
Big Thief,Vampire Empire,2023,"For Big Thief, 2023 counted as a quiet year. No new album—let alone a double album, or a pair of albums—just a lone 7” single. But what a single. On this rough-and-ready studio recording of live favorite “Vampire Empire,” Adrienne Lenker’s deep sensitivity to everything around her is at its most finely tuned. Atop ragged folk-rock, she spills forth about sex that transcends gender and drugs that don’t work, embracing and then escaping her demons in a whirlwind plunge.",Marc Hogan,15,Pitchfork,The 100 Best Songs of 2023
Baby Keem / Kendrick Lamar,The Hillbillies,2023,"It’s nice to see Kendrick having fun again. On “The Hillbillies,” atop bright Jersey club drums and a Bon Iver sample, the rapper and his cousin Baby Keem ride a jangling beat as they battle for the best one-liners. Lamar sets the tone, spouting off about getting “four McDonald’s”—that is, probably, $4 million—“every time I land, bro,” while Keem responds with his own goofy flex about liking “irregular girls.” Their natural chemistry is off-the-charts and addictive, like watching two All-Stars scoring style points instead of trying to win the game.",Matthew Strauss,14,Pitchfork,The 100 Best Songs of 2023
Fever Ray,Shiver,2023,"Lust is a battlefield and Karin Dreijer is sweeping for mines. As they wade through the muck of desire, a synth-horn swells into a siren warning of danger ahead; sinister drums echo back and forth in anticipation, the air becomes thick with electricity. “Shiver” is so magnetic, so precise in drawing the dizzying shape of a fantasy, that it makes having a crush sound like an affliction. It could all change with just one more hang, just a little touch. By the time they’ve gathered the courage, a terrifying thought takes hold: Can I trust you?",Puja Patel,13,Pitchfork,The 100 Best Songs of 2023
ANOHNI and the Johnsons,It Must Change,2023,"Seven years ago, ANOHNI cast modern society as a font of pure hopelessness. But on “It Must Change,” she suggests even the most oppositional forces are mutable. “You know how they always said that light is the opposite of darkness?” she asks. “It’s just fire in darkness…/ So those opposites, they don’t exist.” With these lines, the demand of the song’s title turns into an olive branch, as if she’s reaching beyond any one listener to a greater cause. Her voice surges above production that harks back to classic-era Motown and Muscle Shoals, tapping into what may be the last remaining universal human truth: We’re all just trying to survive.",Shaad D’Souza,12,Pitchfork,The 100 Best Songs of 2023
Nourished by Time,Daddy,2023,"“Daddy” deserves a place in the grand pantheon of sad bangers. Over a deeply danceable house thump, Nourished by Time’s Marcus Brown croons his hook with the confidence of an ’80s R&B lothario. But there’s a palpable longing at the heart of this song’s club euphoria. Created in his parents’ basement—with an equally great live version filmed in their cluttered garage—the track includes raps about not being able to compete with a lover’s sugar daddy. There’s a displaced giddiness to the song’s sped-up vocal promise that he’ll never be alone, especially as Brown delivers the killshot: “I say, ‘I love you’/You say, ‘Whatever.’”",Evan Minsker,11,Pitchfork,The 100 Best Songs of 2023
Earl Sweatshirt,Making the Band (Danity Kane),2023,"“Making the Band (Danity Kane)” is a swift shattering of every preconceived notion of what an Earl Sweatshirt song sounds like. Gone are the magnetically morose raps laid over dusty soul loops. Instead, as Evilgiane and Clams Casino’s chattering, anti-gravity production churns behind him, Earl expertly navigates an alien landscape, sounding newly invigorated. His quotables about MTV-era pop stars and the Incredible Hulk feel akin to proverbs, and lines about dancing in the rain and cracking bank safes come off as keys to enlightenment. Where Earl’s music was once ruled by murkiness and confusion, he’s now crystal clear—if only for a couple of minutes.",Matthew Ritchie,10,Pitchfork,The 100 Best Songs of 2023
Troye Sivan,Rush,2023,"Reeling from the one-two punch of a breakup and a lockdown, Troye Sivan sought solace in Melbourne’s gay bars: sweaty clubs, cold beer, love affairs that start after dark and end by sunrise. The pop star captures those endless evenings on “Rush,” a song that could easily soundtrack the best night of your life, from its chaotic opening to a hook chanted by your friendly neighborhood rugby team hunks. While the fluidity and frankness of “Rush” is bracing, the song’s sensuality and confidence finds Sivan in conversation with like-minded icons of decades past: consider Janet Jackson circa “Together Again,” or George Michael looking for “Fastlove.” Spinning personal anguish into liquid honey has yielded the singer’s most timeless work yet—a reminder that pain may be temporary, but poppers are forever.",Jamieson Cox,9,Pitchfork,The 100 Best Songs of 2023
Wednesday,Chosen to Deserve,2023,"The love of your life is a dirtbag who skipped school, pissed in the street, and bummed around with dumbass friends who chugged Benadryl like PBRs—and she’s perfect, baby. Part down-home devotional, part miscreant’s statement of purpose, Wednesday’s “Chosen to Deserve” is a country-rock slammer where frontwoman Karly Hartzman confesses her unsavory past to her partner, proceeding with faith that when the story’s over, he’ll still be smiling. “We always started by tellin’ all our best stories first/So now that it's been awhile, I'll get around/To tellin’ you all my worst,” she begins. A casually observant Jewish girl raised in the Bible thumping South, Hartzman appropriates the language of predestination to deliver one of the most romantic tributes of the year, a wide-open love song that proves that everyone, no matter how fucked up, is a miracle to someone.",Cat Zhang,8,Pitchfork,The 100 Best Songs of 2023
NewJeans,Super Shy,2023,"Zero-to-hero anthem “Super Shy” is the daydream wafting through the mind of an overlooked heroine while she eyes the most popular boy in school. Minji, Hanni, Danielle, Haerin, and Hyein exude quiet confidence as they plot to catch a cutie by surprise. Built around a riff on the Powerpuff Girls theme and a bass drum like a hiccuping heartbeat, the song was co-written by Erika de Casier, who expertly guides the group towards a soft, sensitive take on drum’n’bass. Embedded in its message of demure power is a sliver of meta-commentary on NewJeans’ approach: More sonically understated than many of their K-pop contemporaries, they have quickly become chart titans nonetheless. “You don’t even know my name, do you?” the girls ask impishly on the hook. The “but you will” is implied.",Olivia Horn,7,Pitchfork,The 100 Best Songs of 2023
SZA,Kill Bill,2023,"With her wrenching self-examination, SZA’s songwriting encourages the kind of deep emotional inquiry that, as with all the greats, helps us understand ourselves better. Not so much (one hopes) on the murderous “Kill Bill.” At the start of SOS’s fierce stylistic melange, this inescapable boom-bap thriller instantly revealed the singer’s morbid humor and the range of her pen; it’s SZA gone full auteur. Playing the villain, she crafts her allegorical single in the spirit of murder ballads and action films, fantasizing, in the uncannily cool-headed chorus, about the most extreme revenge imaginable against a boyfriend who’s moved on. Her hard-boiled extravagance and acute psychological attunement might just kill the ex living in your head. Yet it’s her drolly disarming boasts—“I got me a therapist,” “I did all of this sober”—that suggest what really drives the song’s deathly fiction: SZA’s own bid for self-preservation.",Jenn Pelly,6,Pitchfork,The 100 Best Songs of 2023
Olivia Rodrigo,get him back!,2023,"One way or another, Olivia Rodrigo is gonna get ya. On the deliriously fun third single from her second album GUTS, she rattles off an ex’s red flags with an amused detachment that channels the Waitresses’ Patty Donahue and Blondie’s Debbie Harry. Over a fuzzy three-chord melody, Rodrigo waxes vindictive on the song title’s double meaning, conjuring alternately violent and reconciliatory fantasies that her therapist father (who gets a shout-out!) might attribute to “anxious attachment.” “get him back!” quite literally sounds like the contrasting highs and lows of Rodrigo’s warring impulses, her voice taking on the quality of a school bully on the song’s rapped verses and a bubbly cheerleader on its exuberant choruses. The quiet-loud dynamic culminates in a final whispered bridge, which sends the frenetic peak of the song’s last chorus into orbit. From its false start to Rodrigo’s devilish final laugh, “get him back!” is as messy, flawed, and ultimately freeing as a breakup feels.",Arielle Gordon,5,Pitchfork,The 100 Best Songs of 2023
Noname,Namesake,2023,"Noname isn’t afraid to delve into the messiness of making art with a global consciousness while toiling within a capitalist economy. On “Namesake,” she laments the pervasiveness of complacency, admits we’re all complicit, and rails against war crimes from inside a cloud of blunt smoke. Over a percolating funk beat, Noname calmly eviscerates the very concept of sacred cows, adopting a faux-cheerleader lilt as she connects the dots between Super Bowl headliners Beyoncé, Kendrick, and Rihanna, and the NFL’s longtime association with the military industrial complex. In the next breath, she calls out the woman in the mirror for playing Coachella after she said she wouldn’t. “Namesake” is a ruthless song about accountability from which no one is safe—not even Noname.",Matthew Ismael Ruiz,4,Pitchfork,The 100 Best Songs of 2023
Sufjan Stevens,Will Anybody Ever Love Me?,2023,"The question at the center of this song is the same one Sufjan Stevens has been asking in his music for the last 20 years, though he’s never been quite this direct about it. It’s easy to understand why: His trembling whisper of a voice and the way he can make the pluck of an acoustic guitar ring out like the loneliest sound ever created are instantly devastating on their own, so cutting them with poetic storytelling and elaborate arrangements can feel both merciful and necessary. But “Will Anybody Ever Love Me?” is pure, undiluted, raw—the kind of song that makes your face crinkle up before a single word is sung. Casually tossing the song into the “sad” pile and waiting for it to soundtrack your next breakup doesn’t do it justice. Though Stevens begins the song on his own, lamenting alongside a fingerpicked guitalin, he’s soon joined by a chorus of background singers who offer much-needed consolation. And while the love he longs for may be the romantic kind, with verses that dream of funeral pyres and golden blades, there could be something bigger and more mysterious at play: Is it God’s love that he’s after? At 48, Stevens knows that answering these kinds of questions doesn’t get any easier. But simply saying them aloud carries its own power.",Ryan Dombal,3,Pitchfork,The 100 Best Songs of 2023
PinkPantheress / Ice Spice,Boy’s a liar Pt. 2,2023,"The boy in question was never the point. On this star-making TikTok megahit—a bubbly fusion of Jersey Club and the sounds of Super Nintendo—Gen Z’s most beloved pop/rap princesses don’t actually seem to care that much about some dude’s mendacity: PinkPantheress assesses her situationship in a sing-songy chirp, while Ice Spice raps well-argued rhetoric about a bro’s sad two-timing, making it very clear that she knows he's not worth her time. What ""Boy's a liar Pt. 2"" is really about is how much fun it is to bitch with your friends. In the video, the sparkling duo and their pink-clad posse own the streets and subways of New York, a vision of baddies in need of nothing but each other, turning a track about a trifling boy into the ultimate declaration of girl friendship.",Julianne Escobedo Shepherd,2,Pitchfork,The 100 Best Songs of 2023
Lana Del Rey,A&W,2023,"“American whore” sounds almost like “American woman,” and I’ll tell you how often people say one to mean the other. Picture vintage 2012 Lana in the Budweiser T-shirt. “Ride” was her bid for total freedom and she prefaced it with a monologue about what that meant: broken dreams, the open road, and being the other woman, the one with no attachments. On “A&W,” co-written with Jack Antonoff, she approaches her destination with a seven-minute autofiction epic that breaks like a storm cloud over Did you know that there’s a tunnel under Ocean Blvd. Lana seeks the source of her ill humors and speaks of lost youth, a distant mother, predation, addiction, and desperate, toxic validation. Little rivulets of piano trickle through the melody, wearing out the paint. Hear her sing the word “raped” with the same polite trepidation they’ll use to suggest that she asked for it: No point explaining, she knows what they’d call her. Her exposition is its own kind of dark comedy, like, I know the app says I’m in Rosemead—can you come to my hotel room? Lana can be tender but the American whore is ice cold, smiling: She challenges us to ask how she ended up here and the answer is defensive and unsatisfying. She knows that being bad feels amazing—delirious, sharp like new money, concussive like the riptide bass that sucks us into the song’s furious, twisted fantasy denouement. “Surf’s up!” When the switch flips it’s Lana’s script, The Experience of Being an American Whore, one of those trendy youth dramas full of sex, drugs, and Cocoa Puffs. And here’s mystery Jimmy, the habit that uses her back. Doesn’t the melody sound like it’s spiraling? The perfect victim is silent so Lana becomes loud, stubborn, unbreakable. She’s got a “your mom” joke that’s gonna stop his heart: What if I told her everything?",Anna Gaca,1,Pitchfork,The 100 Best Songs of 2023
