Artist,Song,Year,Review,Reviewer,Ranking,Source,Source Title
Soccer Mommy,Shotgun,2022,"Sophie Allison was put on God’s green Earth to write vivid, melancholy songs. On “Shotgun,” the undulating lead single fromSometimes, Forever, she masters the complicated rush of falling into an unsustainable love, painting a twisted picture of twentysomething romances. “You know I’ll take you as you are/As long as you do me,” she sings over muddy layers of grungy guitar chords produced expertly by Oneohtrix Point Never. “Shotgun” is about doing vulnerable and delusional things in love, knowing they’re just quick fixes, and not giving a damn anyway.",Gio Santiago,28,Pitchfork,The 100 Best Songs of 2022
Steve Lacy,Bad Habit,2022,"Steve Lacy is a lovelorn Eeyore on “Bad Habit,” hisGemini Rightsanthem for the undecided. He dutifully trods around in his own head, assuaging the guilt of not pursuing a love interest. Still, he allows himself to daydream. In a year that’s felt directionless for many, it’s clear why a song about living in ambiguity would become a No. 1 hit and every TikTok introvert’s soundtrack. More than the wispy pangs of regret or plaintive falsetto, what propels the song is a steady pulse of uncertainty, relatable to anyone who’s ever talked themselves out of following their heart.",Clover Hope,27,Pitchfork,The 100 Best Songs of 2022
Cate Le Bon,Moderation,2022,"“Moderation,” a highlight of Cate Le Bon’sPompeii, is a beguiling elegy to uncertainty. Atop a strutting new wave bassline and lonesome horns, the Welsh musician faces the habits she can’t quite knock, reckoning with guilt and her own good intentions. “Moderation/I can’t have it/I don’t want it/I want to touch it,” she sings, lingering on each word as if to briefly possess its essence. In this strange space between emotions, Le Bon stands transfixed by the unknown.",Quinn Moreland,26,Pitchfork,The 100 Best Songs of 2022
Burna Boy,Last Last,2022,"Has heartbreak ever sounded so liberating? “Last Last” is Burna Boy’s paean to pain and things that, well, don’t last—his layered vocals soaring freely over lolloping kicks. But played against the charismatic defiance of his drink- and smoke-soaked performance is that shivering riff of Toni Braxton’s “He Wasn’t Man Enough”; it rings like eternal doubt—maybe itwasme, not you, after all?—and delivers the tension that triggered the song’s explosion across street parties and beach stages all summer.",Will Pritchard,25,Pitchfork,The 100 Best Songs of 2022
Daphni,Cherry,2022,"Daphni’s third album,Cherry, feels like it was bashed out in a few hours, in the best possible way. It’s rave music as garage rock, with a giddy sense of freedom that makes it feels like a breakthrough for the dance-music project of Caribou’s Dan Snaith. Standing astride the record is the title track, composed of a few eccentric but judiciously arranged elements—a frog-chorus of pitch-shifted hi-hats, a simple melody played on a pneumatic chord preset—threaded along a synth loop that sounds like a chain of exploding Pop Rocks. Simply yet counterintuitively constructed, “Cherry” is proof a rave anthem can be patched together out of anything.",Daniel Bromfield,24,Pitchfork,The 100 Best Songs of 2022
Weyes Blood,"It’s Not Just Me, It’s Everybody",2022,"Natalie Mering transforms a biting moment of interiority—feeling unseen at a party—into a plea for empathy and interconnectivity. She notices the increasing loneliness in herself, then the loneliness in everyone, everywhere: a testament to the fact that we’re all “a part of one big thing.” The song beams with ’70s sonic nostalgia, Mering’s languid voice soaring over soft piano and taut drums. But the sentiments in “It’s Not Just Me, It’s Everybody” are hardly backwards-looking. Mering searches for a way forward, embracing mercy as a path to ourselves and each other. –Brady Brickner",Wood,23,Pitchfork,The 100 Best Songs of 2022
Two Shell,home,2022,"Two Shell could really piss you off if their music wasn’t so fantastic. Forget the duo’s inane firstinterviewthat self-destructed before you could read it, or theirBoiler Roomset where they twiddled knobs to a pre-recorded set in goat hats and sunglasses. Forget the passcode-protected hacker website that makes you feel like you have to steal the Declaration of Independence to get in. It all evaporates in the face of a big, phosphorescent floor-filler like “home,” in which pitched-up vocals from a 2016 alt-R&Bsongemit an irresistible rainbow sheen, texturized by whirring jungle beats and slobbery bubble-popping noises. It’s dippy, synthetic, and blindingly fun, a sure sign that even at closing time your night is on the up.",Cat Zhang,22,Pitchfork,The 100 Best Songs of 2022
Monaleo,We Not Humping (Remix),2022,"When pop-culture feminism goes full-throttle on misandry, the Miami bass-inflected “We Not Humping (Remix)” will be the movement’s rallying song. Equally bratty and lacerating, Monaleo and Flo Milli take turns using the alpha-male ego like a punching bag. Sparing no feelings, these Southern women giggle at erectile dysfunction, berating those who can only last for the duration of a TikTok video, and shaming the ones who failed Eater 101 in a playground-taunt delivery. Don’t worry, they just might let you hang—just come with your jaw loose and most importantly keep your pants zipped.",Heven Haile,21,Pitchfork,The 100 Best Songs of 2022
Caroline Polachek,Billions,2022,"Caroline Polachek dives headfirst into the twists and turns of a mutually obliterative infatuation. She breathily gasps about “sexting sonnets” and “working the angles,” before plunging down an octave to seethe “headless angel / body upgraded / but it's dead on arrival.” And then a sharp turn: She hands off the final chorus to a British children's choir, whose voices sound so weightless they could be simulated. “I never felt so close to you,” they sing, modeling what all the best pop music does: taking a specific situation between a particularIand a particularyouand inviting everyone else in the world to fill it with their own dreams and nightmares.",Sasha Geffen,20,Pitchfork,The 100 Best Songs of 2022
Beth Orton,Friday Night,2022,"Beth Orton’s astonishing “Friday Night” captures the moment when a disarrayed consciousness finally arranges itself into a shape that makes sense. The haunted background vocals and vaporous synths suggest the time-travel of memory as much as the lyric about Proust’s madeleine, but Orton has no desire to live in the past. Though she’s a little unsteady, hobbling along to the tumbling beat of the drum, she’d rather move forward. As “Friday Night” unfolds, Orton sounds both weary and sneakily energized, ready to discover what’s next.",Mark Richardson,19,Pitchfork,The 100 Best Songs of 2022
Björk,Ancestress,2022,"Björk wrote “Ancestress,” a long and stirring highlight fromFossora, in the wake of her mother’s death. She penned pages of words before whittling them down and enlisting her son, Sindri Eldon, to harmonize. In the moments they sing together, Björk and Eldon sketch out a lifecycle, each honoring their own matriarch. Björk pays tribute to her mother’s dyslexia—an “idiosyncratic sense of rhythm” and the “ultimate free form.” But she doesn’t just sing about it: She echos it with musical structure, shoving aside delicate chimes and dispatching atonal bells and jagged percussion. “Ancestress” is not only a song about Björk’s mother; it is her mother transposed into song.",Madison Bloom,18,Pitchfork,The 100 Best Songs of 2022
Nilüfer Yanya,Midnight Sun,2022,"Play a round of Heardle with “Midnight Sun” and you might easily guess anIn Rainbowssong. Nilüfer Yanya translates Radiohead’s signature elements—minor-key trickery, layered guitar loops, cryptic lyrics punctuated with anxiety—into a heavily redacted diary entry. From the sharp intake of a drum roll that opens the song to the scuzzy, major-key blowout that offers a long-awaited catharsis, “Midnight Sun” uses rock’s ominous side to ward off an unidentified threat. Consider it a talisman for a new decade of misinformation, paranoia, and emotional spiraling.",Nina Corcoran,17,Pitchfork,The 100 Best Songs of 2022
Kendrick Lamar,The Heart Part 5,2022,"One of the worst strains of discourse in the field of Kendrickology is the idea that Kendrick Lamar never asked to be considered a spokesperson for the affairs of Black America, that he’s merely a savant that stumbled into a spotlight he’s not suited for, and never wanted. What an insult. “The Heart Part 5” is a three-hundred-and-thirty-two-second-long declaration of Kendrick’s unabashed desire for the pulpit, contending with whether the world no longer has use for his earnestness, and whether he should be ashamed to indulge his ambitions to moral superheroics. That’s actually exactly what the world wants, and it’s what Kendrick wants, too.",Adlan Jackson,16,Pitchfork,The 100 Best Songs of 2022
Rachika Nayar,Heaven Come Crashing,2022,"Though Rachika Nayar’s previous works of gossamer ambient play along a rich spectrum of feeling, they often expressed their intensity softly. The first half of the Brooklyn guitarist-composer’s “Heaven Come Crashing” glides along in a familiar quietude, with clusters of vocals from fellow guitarist Maria BC. When it abruptly drops into a motorway-paced drum’n’bass section, the catharsis is surprising but earned, like a natural discharge of energy. Amid all the noise and rhythm, the familiar sound of a processed guitar becomes something new and majestic.",Zhenzhen Yu,15,Pitchfork,The 100 Best Songs of 2022
Pharrell,Cash In Cash Out,2022,"“Cash In Cash Out” sounds like Pharrell heard a Gen-Zer refer to him as “the Minions song guy” and took it personally. Returning to a grittier sound after his work on Pusha-T’sIt’s Almost Dry, he sought out two “ravenous wolves”—Tyler the Creator and 21 Savage—to attack extraterrestrial 808s and militant snares. Both rappers trade braggadocious bars, neither relegated to feature status—21 surfing the high-tempo beat while Tyler double-dutches with an increasingly frenetic flow culminating in his conclusive “Woof!”",Heven Haile,14,Pitchfork,The 100 Best Songs of 2022
The 1975,Part of the Band,2022,"“Part of the Band” is both the thesis and the outlier of the 1975’sBeing Funny in a Foreign Language. Its patient orchestral folk and tongue-twisting one-liners about “vaccinista tote bag chic baristas” stand apart from the bittersweet synth-pop found elsewhere on the album. The song’s vulnerability feels distinct in its precision, too. As frontman Matty Healy sings of exactly how long it’s been since he last used heroin, down to the minute, toward the end of the track, the production swells to a crescendo, pushing him further ahead.",Matthew Strauss,13,Pitchfork,The 100 Best Songs of 2022
Aldous Harding,Fever,2022,"Nobody darts around the edges of narrative and inscrutability quite like the folk-pop enigma Aldous Harding. On “Fever,” the New Zealand singer deals out impressionistic morsels of an 11-day love affair in a faraway city, shouting the first word of each measure like a schoolteacher calling roll. “Fever” may seem like a straightforward tale by Harding’s cryptic standards, but from the lopsided piano groove that anchors the tune to the dada wisdom that “one will fry if the other’s connected,” everything remains pleasantly askew.",Zach Schonfeld,12,Pitchfork,The 100 Best Songs of 2022
Ethel Cain,American Teenager,2022,"Ethel Cain approaches her music as a sound designer as much as a songwriter, eschewing conventional structure for marginal vibrations and layered sensations, which makes an arena-ready pop anthem like “American Teenager” something of a revelation. On a lost highway turnoff somewhere between Bruce Springsteen and Brandon Flowers, Ethel rides a sepia-tinged carousel of all-American imagery: tears under the bleachers, wasted nights gone wrong, and forlorn prayers to Jesus. While her songs are frequently extended epics, somewhere between slowcore and chopped & screwed choral music, “American Teenager” is immediate and succinct, but not any less careful in its construction.",Nadine Smith,11,Pitchfork,The 100 Best Songs of 2022
Hikaru Utada,Somewhere Near Marseilles,2022,"Hikaru Utada reinvented themselves on their eighth album,BADモード, dialing from J-pop toward sleek, mellow dance music. Featuring co-production from Floating Points’ Sam Shepherd, the LP’s jet-setting, showstopping finale frames a Mediterranean tryst in finger snaps and rubbery synths. It’s a glamorous setup for breathless intimacy: “Maybe I’m afraid of love/Say I’m not the only one,” they murmur as the song builds toward a blissed-out dance breakdown. Spiked with unfettered yearning, “Somewhere Near Marseilles” makes falling hard and fast sound like its own euphoric form of escape.",Eric Torres,10,Pitchfork,The 100 Best Songs of 2022
Bad Bunny,Tití Me Preguntó,2022,"Bad Bunny regards seductive mischief as inextricable from his sensitive disposition: This is how he lets us know he’s complex. The arrangement reflects Bunny’s amiable disregard for monogamy. Producer MAG treats Bunny’s first solo stab at dembow like a coming-out party, lavishing him with keyboard swirls, sampled camera effects, a beat switch-up in the outro, and, terrifyingly, his aunt to shake her finger at her nephew. But Tití doesn’t have to ask for details—Benito will tell her. He giggles at his own admissions, and of course, like cads before him, admits that what hereallywants is… love.",Alfred Soto,9,Pitchfork,The 100 Best Songs of 2022
Alan Braxe / DJ Falcon,Step by Step,2022,"French house kingpins Alan Braxe and DJ Falcon made their long-awaited return on “Step by Step,” rolling out gentle waves of modular synths that sound like they come from an old AM radio. Panda Bear gives the duo’s subtle glow a narrative framework, singing about the aftermath of an idyllic past. But “Step by Step” is really about moving forward: The synths suddenly come alive, acoustic drums breathe momentum into the song’s sails, and Panda Bear—multi-tracked into an elated choir, and delivering the crown jewel of his already laudable 2022 discography—becomes a chorus of trusted advisors whose collective force, and copious repetitions, transform an old self-help chestnut into a life-changing belief system.",Evan Minsker,8,Pitchfork,The 100 Best Songs of 2022
Rosalía,SAOKO,2022,"Pressing play on “SAOKO” feels like opening a matchbox to find a blaze already lit inside. It’s the crackling, compact powerhouse that realizes Rosalía’s stated desire tohear something she’s never heard before. In just over two minutes, she darts through a Wisin and Daddy Yankeeinterpolation, digital distortion, and organic, jazzy interludes while laying bars harder than the diamonds she affixed to her teeth this year. “Yo me transformo”—“I transform myself”—is her refrain throughout, and a mission statement for how she synthesizes cross-cultural influences into a totalizing, transcendent vision of pop.",Olivia Horn,7,Pitchfork,The 100 Best Songs of 2022
Yeah Yeah Yeahs,Spitting Off the Edge of the World,2022,"Time may have tamed their more volatile inclinations, but Yeah Yeah Yeahs is still for the kids: whether in the context of literal parenthood, the younger artists for whom their influence abounds, or the emerging generation at the heart of this quietly epic song. On the cinematic lead single from their first album in eight years, Yeah Yeah Yeahs obliquely trace the contours of our consequential historical moment, of what the young will inherit: “Cowards, here’s the sun/So bow your heads.” Its atmosphere conjures a world slowly turning, putting rage into a cool, cutting stare.",Jenn Pelly,6,Pitchfork,The 100 Best Songs of 2022
Beyoncé,Alien Superstar,2022,"At least now we’ll be prepared if a UFO ever touches down in the club. “Alien Superstar” is a new-gen ballroom staple with a synth-drenched hook beamed down from a higher plane. Beyoncé has never lacked for confidence, but over Prince-ly funk paired with interstellar electronic flourishes, her assertions about being a “masterpiece, genius” with a “drip intravenous” feel particularly justified. Add to the audaciousness a grouping of samples that, were it not for the House of Yoncé’s copious resources, would surely never have been assembled under one roof: Dancefloor staplesForemost PoetsandPeter Rauhofermeet aRight Said Fredinterpolation that culminates in anoutroby Barbara Ann Teer, founder of the National Black Theater. The result is20-plus creditson a track that both soars and swaggers, a new bar set by a star always game to raise it.",Emma Carmichael,5,Pitchfork,The 100 Best Songs of 2022
Alex G,Runner,2022,"Alex G writes songs because,he says, he doesn’t have the “technical skill” for fiction. Probably you would not get a book deal on this premise: “Runner” might be a song about a dog, but it’s also a song aboutdog spelled backward. “I have done a couple bad things,” he howls, the tortured Judas cry of that most Easter bunnies-and-puppies of Alex G albums,God Save the Animals. “Judge me for what I do,” he reminds us, and as is true of many spiritual texts, the detail is kind of inscrutable while the story comes alive in sound: creeping-ivy melodies, spooky beatboxing, that primal scream. The scream leaves the human realm, meets the animal, approaches the perfect love to which we now aspire in the form of perfect two-and-a-half-minute pop songs. Alex G, like the dog who catches the car, keeps running.",Anna Gaca,4,Pitchfork,The 100 Best Songs of 2022
Glorilla / Hitkidd,F.N.F. (Let’s Go),2022,"Landing like a crunkafied version of Trina’s “Single Again” but witha rowdy Lil Phat on the chorus, Glorilla’s “F.N.F.” is a flashy relationship-status update that makes a breakup feel like a riot. Instead of solitary nights spent crying over a tub of ice cream, Glo goes looking for debauchery with her home girls, leading the charge into the streets with an invigorating “Let’s goooo!!!!” Flanked by her bad bitch army, she stomps over a thunderous HitKidd beat and has the last laugh over an ex who wasted her time: “Life's great, pussy still good/Still eating cake, wishing that a bitch would.” Don’t even try texting: Glorilla’s too busy twerking at intersections, hanging out car windows, and making the world know she’sfree.",Heven Haile,3,Pitchfork,The 100 Best Songs of 2022
Destroyer,June,2022,"“Speaking of lifelike,thisis what life’s like,” Dan Bejar declares midway through “June,” a gloriously surreal destination following three decades of journeying into the heart of his subconscious. The Canadian songwriter’s spoken-word vocals are processed to sound like a montage of various Dan Bejars complimenting and contradicting one another, musing on art and existence or cracking an “I barely know her!” joke while pondering the meaning of love. The onslaught of non sequiturs is chopped and layered against wafting disco, like the soundtrack to a mirrorball head-trip sequence in the Hollywood adaptation of his life. If we’re to take him at his word, this reallyiswhat life is like—alternately gliding in ecstasy and waging war on each passing thought, all while still making time for the everyday absurdity that falls in between. A crown jewel of one of indie rock’s most ambitious songbooks, “June” found its home in a world that seems as absurd, doomed, and oddly romantic as Bejar has always seen it.",Sam Sodomsky,2,Pitchfork,The 100 Best Songs of 2022
Alvvays,Belinda Says,2022,"Alvvays frontwoman Molly Rankin recently cited the Canadian short story master Alice Munro as an influence, noting the way the writer’s work can “knock the wind out of you.” Rankin and her band offer their own bracing wallop with “Belinda Says,” a heartbreaking sketch of an unexpected pregnancy that’s also a modern power-pop classic. She only needs one line to render vivid scenes: a warm vodka cooler chugged behind a hockey rink, a tense phone call with a would-be father, a forlorn move to the countryside soundtracked by Belinda Carlisle’s “Heaven Is a Place on Earth.” Like a heroine in one of Munro’s timeless stories, the narrator’s life is altered forever by a single choice of impossible magnitude. The song’s bittersweet, sighing melody, one that could easily be repurposed within an antique music box, is magnified by production that weaponizes shoegaze signifiers in service of the narrative. Guitars smother like wet wool and shrieking seagulls fly over the coast; there's an overwhelming heightening of stakes, like your heart is being squeezed by a trash compactor. As Rankin soars into a final high note, it might feel like you’re leaving with a whiff of hope—but the solo that takes you home is messy, discordant, a little confused. It’s an appropriate finale for a song about the moments in people’s lives that defy clear articulation, when your only choice is surrender to a swirling maelstrom of emotion.",Jamieson Cox,1,Pitchfork,The 100 Best Songs of 2022
