Artist,Song,Year,Review,Reviewer,Ranking,Source,Source Title
Harry Styles,As It Was,2022,"“As It Was” is the kind of twinkly little confection that would easily get the indie kids pogoing at any local DIY dance night at any point in the last two decades. It just happens to have been recorded by one of the biggest pop stars in the world in 2022 instead of, say, the Strokes twenty years earlier. “You know it’s not the same as it was,” Harry Styles sighs, giving a nod to the easy bait of nostalgia. A pointillist synth line tap dances through the song, and all over that nagging pandemic-era malaise we’re all desperately trying to shake. Resistance is futile.",Amy Phillips,100,Pitchfork,The 100 Best Songs of 2022
Black Midi,Welcome to Hell,2022,"Many songs have contended that war is hell; few have ever depicted that hell as crazed as this. Black Midi’s “Welcome to Hell” is four minutes of disorientation, a trillion-BPM assault on the senses that plays likeSaving Private Ryan’s Normandy scene as a fast-forwarded Bugs Bunny cartoon. Somewhere amid all the Les Claypool riffage and incalculable time signatures, the band squeezes in a bizzaro homage to Shirley Bassey’s James Bond themes. The ridiculousness of the pastiche doesn’t dull its intensity one bit.",Evan Rytlewski,99,Pitchfork,The 100 Best Songs of 2022
Phoenix,Tonight,2022,"More than 25 years into their career, Phoenix are still finding new ways to sound brilliantly, effortlessly cool. Case in point: “Tonight,” a smooth collaboration with Vampire Weekend’s Ezra Koenig. Drunk on the promise of a great night out, frontman Thomas Mars charms his way through dinner and the course of an entire relationship in the span of one magical encounter. A sobering, early-morning apology inspires a fleeting moment of self-reflection as the vocalists pause, muse existentially about their endless partying, and ultimately resolve to do it all again, just one verse later. It’s an endearing defense of the pleasure principle from two guys who have seen their share of debauchery—but goddamn if it doesn’t sound fun.",Rob Arcand,98,Pitchfork,The 100 Best Songs of 2022
Tomberlin,happy accident,2022,"Tomberlin got to know her new home of New Yorkby walking it. “happy accident,” from her sophomore albumI Don’t Know Who Needs to Hear This…,unravels like an aimless meander through the city with unruly thoughts spiraling out along the path. Set to Cass McCombs’ elliptical guitar loop and thumps of percussion that land like leaden footsteps, the singer-songwriter interrogates a relationship that has been ambiguous for too long, her voice seething and weary. A relationship, just like a walk, isn’t always in need of a destination, and “happy accident” lingers brutally in the uncertainty of what might come next.",Carrie Courogen,97,Pitchfork,The 100 Best Songs of 2022
Ela Minus / DJ Python,Pájaros en Verano,2022,"What’s there to be grateful for in a hopeless world? According to Ela Minus, clouds, crickets, and sleep, to name a few. “Pájaros en Verano” is an ode to the quotidian pleasures we often ignore. Her praise for the small stuff pairs perfectly with DJ Python’s bubbly production, led by a bright, sweet mallet-like synth that meanders through minimal percussion. It’s a subtle anthem that invites you to slow down and linger on life’s simple delights.",Arjun Srivatsa,96,Pitchfork,The 100 Best Songs of 2022
Horse Lords,May Brigade,2022,"Horse Lords has spent the past 12 years on a quest for utopia, seeking freedom and euphoria within the structures of their experimental rock music. On “May Brigade,” a clashing, raucous pattern born out of microtonal crunch and minimalist repetition morphs into free jazz freneticism, and distant saxophone trills get swallowed by drones and shimmering static. The song’s effortless abandon shows us the bliss that lies beneath Horse Lords’ heady ideas; within its sharp twists and turns there lies a motivating joy—a reminder to always keep on keeping on.",Vanessa Ague,95,Pitchfork,The 100 Best Songs of 2022
Julia Jacklin,Lydia Wears a Cross,2022,"“Lydia Wears a Cross” is like driving rain, slapping you in the face, reminding you that you are both awake and alive. Julia Jacklin sings about religion and what it’s like to be a girl, sitting in the pews, whispering holy words without knowing what any of it means. She prays for Princess Diana; she listens to theJesus Christ Superstarsoundtrack. “I’d be a believer,” she sings, “If it was all just song and dance.” Around her, a fuzzed-out guitar crashes into a kick drum. It’s a look back at childhood, where real sorrow and brutal honesty outweigh nostalgia.",Sophie Kemp,94,Pitchfork,The 100 Best Songs of 2022
4s4ki,Punish,2022,"“Punish” explores nihilistic self-loathing through a multi-genre electronic fantasia. The Saitama-based hyperpop artist 4s4ki alternates between clear and Auto-Tuned singing across the song’s quickly shifting sonics, which incorporate sounds from digicore and Japanese hip-hop. Her scream of the titular “punish!” flashes like a brief, electric glitch against the serrated drum‘n’bass chorus—a cry for help enmeshed in a suffocating, cybernetic pop landscape.",Zhenzhen Yu,93,Pitchfork,The 100 Best Songs of 2022
Wednesday,Bull Believer,2022,"Wednesday’s “Bull Believer” is a two-act grunge odyssey in which lead vocalist Karly Hartzman jumps from chronicling Spanish bullfighting to describing being ignored by the guy she loves at a party. The dizzying song alternates between abrasion and solace, cranking back up just as it reaches a point of melancholic calm; monstrously heavy guitars and lap steel squelch beneath Hartzman’s guttural screams. As her paramour is distracted playing Mortal Kombat, she echoes the video game’s calls to “finish him!,” crying torturously before coming back for one final whisper—a satisfying end to an emotional nine-minute-long journey.",Margeaux Labat,92,Pitchfork,The 100 Best Songs of 2022
Two Shell,Pods,2022,"Anonymous UK bass and hyperpop pranksters Two Shell insist that they aren’t trolls, which rings true. What kind of troll only spreads joy? The opening tremolo of “Pods” flies like a shuttle over a laser-weaving loom, and its 15-second breakdown feels more like being in a video game than any point ofReady Player One. There’s a Sunset Strip guitar solo with baroque overtones; an opera-cloaked organ tone is stuffed with hyphy vocals and capped with an EDM riser. Too good to be untrue, Two Shell filigree the line between mystery and mischief. They’ll probably turn out to be AI.",Brian Howe,91,Pitchfork,The 100 Best Songs of 2022
Joe Rainey,bezhigo,2022,"Joe Rainey’s music attests to the importance of community. A member of the Red Lake Nation of Ojibwe people, Rainey knows the value of surrounding yourself with others who inspire you, and this belief underlines every track on his debutNiineta, a deep collaboration with producer Andrew Broder that remembers loved ones who’ve passed and samples decades’ worth of pow wow recordings. Standout “bezhigo” weaves together three separate recordings of Indigenous vocalizing, and as the string arrangements surge, a steady beat arrives in the form of industrial clang, sounding like the repeated strikes of a blacksmith’s hammer. There’s beauty, “bezhigo” suggests, in forging one’s identity, purpose, and dreams alongside those who share your vision.",Joshua Minsoo Kim,90,Pitchfork,The 100 Best Songs of 2022
Pusha T,Diet Coke,2022,"You gotta hand it to Pusha T—it takes dedication to still strive toward drug-rap perfection 20 years after making a song as good as “Grindin.” On “Diet Coke,” he raps over an 88-Keys beat that’sold enoughto be called up for jury duty—all vacuum-packed drums and scratched-in vocal samples—but King Push has always made his music outside of linear time, peddling rhymes as eternal as the drug trade itself. “Master recipes under stove lights” he explains on the hook, ostensibly a reference to crack, but he could also be talking about how he manages to pull off this one kind of track again and again.",Dean Van Nguyen,89,Pitchfork,The 100 Best Songs of 2022
Panda Bear / Sonic Boom,Edge of the Edge,2022,"Panda Bear and Sonic Boom began their joint albumResetwith a simple premise: take the opening moments from great songs of the 1950s and ’60s, loop them, and shape their compositions out from there. “Edge of the Edge” uses Randy & the Rainbows’ “Denise” as its melodic germ, augmenting the 1963 doo-wop hit’s sweet and simple melody with sleigh bells, hand claps, and Panda Bear’s bittersweet croon before beaming in transmissions of dial tones and modem sounds from a less distant past. It’s an infectiously catchy tune that transcends time as it embodies these trusted collaborators’ experimental spirit.",Shy Thompson,88,Pitchfork,The 100 Best Songs of 2022
MUNA,What I Want,2022,"Not since Jonathan Richman’s “I Was Dancing in the Lesbian Bar” has a pop song so perfectly captured the bubbly joy of taking sips, shaking hips, and regarding leather dykes with love. But “What I Want” is about self-love too. MUNA singer Katie Gavin doesn’t want to just date a girl, she wants a girl towantto date her. The song hits hard on a dancefloor and even harder in a graffiti-spattered bathroom; face the mirror, freshen your lipstick, and mouth the hook: “There’s nothing wrong with what I want.”",Peyton Thomas,87,Pitchfork,The 100 Best Songs of 2022
Burial,Strange Neighbourhood,2022,"You could say that “Strange Neighbourhood” and the almost-album it comes from,Antidawn, are formulaic—but it’s a formula Burial patented. Heownsthis sound: the shivery shards of imploring vocals that flare up like embers aloft on the wind, the funeral-parlor organ swells, the moist reverberance and muffled found sounds, the disconcerting pauses and glitchy lapses where it feels like the track is giving up the ghost. Rather than seeming like déjà vu, this 11-minute audio-movie evocation of the hauntedness of urban space feels as fresh and original as the first time you heard Burial. You start to think he could carry on like this forever.",Simon Reynolds,86,Pitchfork,The 100 Best Songs of 2022
Ka,Ascension,2022,"In the first verse of “Ascension,” Ka describes his style as “measured efficiency.” Indeed, the veteran rapper and producer has cut away all excess from his music, be it programmed drums or nonessential syllables and details. And on this highlight fromLanguish Arts, one of two albums he dropped in September, the Brownsville, Brooklyn native pries into his childhood—a topic that has grown more central to his writing in recent years—to explain why he believes this cool remove is not only an aesthetic choice but a moral good. Sampled reminiscences about family bookend the song, while Ka bounces, as ever, between the material and metaphysical, the days “long as the solstice” and the uncles’ lives cut short.",Paul A. Thompson,85,Pitchfork,The 100 Best Songs of 2022
Sharon Van Etten,Anything,2022,"“Anything” is about an undefined anxiety so persistent, it numbs everything else, and keeps you up until dawn. At first, Sharon Van Etten’s admission of ambivalence in the face of war and climate collapse—“I didn’t feel anything”—seems like a self-soothing mantra. But this booming standout from her albumWe’ve Been Going About This All Wrongpivots at the bridge, when her lover comforts her, providing a moment of connection that nudges her away from the emptiness. As the song builds from spare, haunted strums to a surging crescendo, Van Etten’s tone flips, and by the end she’s belting out her unfeeling thoughts with palpable desperation.",Stephen Thomas Erlewine,84,Pitchfork,The 100 Best Songs of 2022
"Cole Pulice,",City in a City”,2022,"Normally, Oakland saxophonist Cole Pulice uses live-signal processing to stretch their loosely winding jazz into sinuous, squishy shapes. But “City in a City,” the centerpiece of their wonderfully amorphous albumScry, features no such electronic manipulation. The song glides around two tumbling piano chords, as Pulice lets their unadorned saxophone lead the way, dancing up and down its range with autumnal grace. As transporting as Pulice’s more overtly experimental work can be, they’ve never made anything quite so simple and stunning.",Sam Goldner,83,Pitchfork,The 100 Best Songs of 2022
Bandmanrill,Real Hips,2022,"Bandmanrill never wastes a good sample. On “Real Hips” the kinetic Newark rapper comes through with the zeal of a personal trainer, transforming aJersey club classicinto a HIIT workout aimed at your abductors. DJ Bake and KilSoSouth ensure the beat is both vigorous and elastic—the right balance for Bandmanrill to rifle through talk of parents, success, and paranoia. He always comes back to that instructional, hands-on-hips hook, though, because this is a reminder that, for how frenzied life can be, having a good time should reign supreme.",Joshua Minsoo Kim,82,Pitchfork,The 100 Best Songs of 2022
Animal Collective,Royal and Desire,2022,"Animal Collective have done all the woodsy jamborees and primeval oozing and childlike explorations one could ever ask for, but “Royal and Desire” is above allbeautiful—hardly one of the first words used to describe most Animal Collective songs. Deakin takes a commanding lead on the closer ofTime Skiffs, their best album in more than a decade, with the rest of the band rising behind him in gaseous harmony. The music is sweet and legato, the sound is psychedelic rock falling from a soft-serve machine. This is AnCo at their most imperial, slowly stepping down the aisle, climbing atop the dais, and solemnly placing a lava lamp on the altar.",Jeremy D. Larson,81,Pitchfork,The 100 Best Songs of 2022
Kelela,Washed Away,2022,"Over the course of three fully realized projects in the mid-2010s, Kelela wove together R&B’s tenderness with the ruggedness of club music, showing us that in allowing pain and pleasure to coexist, we might succeed in forging a path from the former to the latter. And then she disappeared. “Washed Away,” her first new song in five years, explores the aftermath of reconciliation and the eternal question of what happens next. While some might succumb to neurosis and anguish, Kelela chooses peaceful meditation. Devoid of both kick drums and confessional lyrics, the ambient track embraces the vast unknown of the future with a grace akin to ocean mist landing gently on bare skin.",Jessica Kariisa,80,Pitchfork,The 100 Best Songs of 2022
Gilla Band,Backwash,2022,"Gilla Band wisely recognize that nearly all of the best ideas about how guitar bands can move on from punk come from hip-hop and electronic music. “Backwash” is the Irish band’s culminating proof-of-concept: As abrasive as it is propulsive, as direct as it is diffuse, the song runs post-punk’s basics through production tricks you can learn from modern-rap masterpieces like Playboi Carti’sWhole Lotta Redor Earl Sweatshirt’sSome Rap Songs.The guitars are subjected to blown-out digital processing with no regard for how the sound might be replicated onstage; lyrics about the horror of binge-watchingBig Brothercumulate into a deluge of consciousness. Even the title is an inversion of punk-rock cliché: “Backwash” isn’t an image of spitting into someone’s face, but choking on your own disgust.",Ian Cohen,79,Pitchfork,The 100 Best Songs of 2022
Yung Kayo / Eartheater,hear you,2022,"Yung Kayo’s glitchy warble makes for a natural fit within Young Thug’s YSL roster, but the Washington, D.C. native’s music feels closer in spirit to the glittery rave-pop of Drain Gang than to Atlanta trap. On “hear you,” Kayo leaves the material realm, ascending to a dimension of pure light and sound. The presence of Queens-based experimentalist Eartheater might seem leftfield for an album that also features Gunna and Yeat, but her almost-inhuman vocal range makes for a symbiotic duet with Kayo’s unpredictable crooning.",Nadine Smith,78,Pitchfork,The 100 Best Songs of 2022
Porridge Radio,Back to the Radio,2022,"“Back to the Radio,” the momentous opener that sets the table for Porridge Radio’s third album of vein-bulging post-punk, is essentially one big crescendo. Spartan melodies cut through drums that jitter with nervous energy, as the British band approximates the feeling of walls closing in. Meanwhile, frontwoman Dana Margolin fills in the scenes of a hollow relationship: a house on lockdown, mutters in a slow-moving car. Porridge Radio render this quotidian prison so evocatively, it’s hard to not want to stay a while.",Mehan Jayasuriya,77,Pitchfork,The 100 Best Songs of 2022
Mabe Fratti,Cada Músculo,2022,"At first, “Cada Músculo” is a thicket of riddles and warnings—a brawny cello rises and lunges, a sibilant violin snarls and lashes, an inquisitive synth taunts and vanishes. This is how the Mexico City-based composer and singer Mabe Fratti renders our vexing world. Her voice glides through the mess, disarming it through self-sovereignty: “Cada músculo tiene una voz,” or “Every muscle has a voice.” Those rough sounds soften when she opens her mouth, sorted into something like breezy chamber pop, the mysteries of this moment temporarily banished. The end’s howling strings are a stark reminder of the iterative effort that existence demands.",Grayson Haver Currin,76,Pitchfork,The 100 Best Songs of 2022
Earl Sweatshirt,Tabula Rasa,2022,"After a pair oflaconicrecordswhose goal seemed, at times, to obfuscate, Earl Sweatshirt returned this year withSICK!, an album dominated by songs that cut through the noise. Its centerpiece is “Tabula Rasa,” a patient piano number that pairs him with the unvarnished New York duo Armand Hammer. While Elucid and billy woods rap—vividly—about human connections made, broken, and fraying, Earl details the way a similar disintegration forced him to remake himself. “This game of telephone massive,” he raps during his loping verse. “I do what I have to with the fragments.”",Paul A. Thompson,75,Pitchfork,The 100 Best Songs of 2022
Ibibio Sound Machine,Protection From Evil,2022,"Like a fog machine dosed with sage oil, the opening track of Ibibio Sound Machine’sElectricitybrings a heady rush to the disco. Over a cauldron of stomp and shimmer, British-Nigerian frontwoman Eno Williams repeats her incantation: “Spiritual/Invisible/Protection/From evil.” Produced by Hot Chip, the song hovers at the crossroads of Afrobeat and electronic pop, mixing horns, synths, and robotic vocalizations. Each element amplifies Williams’ impassioned chant, a benediction delivered with the haunted force of an exorcism.",Judy Berman,74,Pitchfork,The 100 Best Songs of 2022
Babyface Ray,Sincerely Face,2022,"Plenty of local scenes around the country tried to recapture the magic of Michigan rap this year, but none of them boasted a one-of-a-kind character like Detroit’s own Babyface Ray. “Sincerely Face” lays out what has made Ray such a pillar: Through his icy delivery, basic rap flexes about Rolexes, courtside seats, and steakhouse dinners sound revelatory. Over a chilly beat, he shrugs his way through a mix of life lessons with inimitable cool. It’s the type of song where the fly aura rubs off on you every time you play it. They only make ’em like this in Michigan.",Alphonse Pierre,73,Pitchfork,The 100 Best Songs of 2022
Eliza Rose / Interplanetary Criminal,B.O.T.A. (Baddest of Them All),2022,"Taking inspiration from animmaculate posterfor the 1973 Pam Grier blaxploitation filmCoffy, every flirty bar and bubbly riff of “B.O.T.A.” oozes cool. Sassy organ house has long lit up British dancefloors, buttopping the chartswas hardly a forgone conclusion for underground UK Garage producer-DJs Eliza Rose and Interplanetary Criminal. After meeting the accelerant of TikTok, though, the tune’s explosion felt inevitable; it began festival season as a limited pressing and ended it as the hottest record in the UK and Ireland. In a year that resurfaced important debates about the ownership and authenticity of dance music, two things about “B.O.T.A.” ring true: It belongs to the people, and it’s real as fuck.",Gabriel Szatan,72,Pitchfork,The 100 Best Songs of 2022
Shygirl,Coochie (a bedtime story),2022,"“Coochie (a bedtime story)” is the sweetest X-rated lullaby imaginable. Shygirl starts things off on a direct line with, well, pussy, sounding like she’s cooing into an old Nokia phone: “Hello? Is anyone there? It’s the coochie calling.” What follows is a soft, funny testament to the UK artist’s unapologetic sexuality, its liquid beat gliding, stuttering, and zipping under her airy vocals. That Shygirl can proclaim her own horniness with such cuteness and levity is a coochie-attracting combination in and of itself.",Margeaux Labat,71,Pitchfork,The 100 Best Songs of 2022
Oso Oso,Computer Exploder,2022,"Like a drunk staggering across the beach, “Computer Exploder” lurches toward its chorus in fits and starts. The sunny skies of the opening verse are soon clouded with references to heartbreak and addiction, collapsing in a screeching rush. The hook, when it finally arrives, flashes Oso Oso’s signature blend of surf-rock guitars and emo harmonies, the love and drugs complicated by frontman Jade Lilitri’s self-referential songwriting. “When nothing goes quite like you planned it/Write 12 songs, swing like you can’t miss,” he sings in a nod tohis latest album’s tracklist. The go-for-broke candor captures Lilitri’s ambition, casting him as a heavy-hitting rocker in an era that’s all but dispensed with them.",Pete Tosiello,70,Pitchfork,The 100 Best Songs of 2022
Mavi,Baking Soda,2022,"On the sun-kissed “Baking Soda,” producers Monte Booker and Amarah break down the beat so radically that its melodic tendons barely attach to the rhythmic spine—when Mavi murmurs, “I been gave my soul away to the drum, I’mma live forever” on the chorus, the drum itself feels a hair’s breadth away from oblivion. It’s a complementary backdrop for the heady North Carolina rapper’s elusive insights; what does it mean, exactly, when he says, “And your tears is now trees”? The meaning blooms in the line’s lovely, lingering after-image, as the beat crumbles and rebuilds itself like the last dregs of a dream.",Jayson Greene,69,Pitchfork,The 100 Best Songs of 2022
Dehd,Bad Love,2022,"Dehd’s Emily Kempf is howling with her chest, sprinting at top speed towards a new dawn. The beatific “Bad Love” is more than a boldmea culpafor hurting people in the past, it’s a rapturous embrace of the dangerous task of loving again. Kempf stutters syllables in her quest for “re-re-redemption,” her hopscotching vocal rhythms echoed by machine-gun bursts of snare and sparse guitar licks. With the wind in her sails, her roars swell in size, pushing past the timidity of heartbreak to arrive at one of the most invigorating indie rock anthems of the year.",Jesse Locke,68,Pitchfork,The 100 Best Songs of 2022
Koffee,Pull Up,2022,"Koffee boasts about her new luxury lifestyle on “Pull Up,” but it’s never arrogant or sanctimonious. Over an aquatic beat from British-Ghanaian producer Jae5, the Jamaican singer’s orotund voice feels celebratory, a match for a track that bridges the sunny textures of dancehall and Afrobeats. If anyone else leaned out of the window of a drifting car and sang about pulling up to the party in an Audi, it’d probably feel boring and out-of-touch. But when Koffee does just that in the video, her mouth full of braces, you can’t help but grin along with her.",Isabelia Herrera,67,Pitchfork,The 100 Best Songs of 2022
Hagop Tchaparian,Right to Riot,2022,"The most immediate cut on British-Armenian producer Hagop Tchaparian’s startling debut albumBolts, “Right to Riot” merges worlds. Droning zurna melodies and tumbling dhol drums vie clamorously for our attention, but Tchaparian’s mastery of more traditional tactics—rising bass, cleansing releases, and a sample looped to sound like an alarm—make the track a gem of contemporary techno, whittling down the Four Tet collaborator’s sweeping vision into a sharp point.",Daniel Felsenthal,66,Pitchfork,The 100 Best Songs of 2022
Arctic Monkeys,Body Paint,2022,"Although the meta space-lounge of 2018’sTranquility Base Hotel & Casinofelt like a departure, this year’sThe Carreinforced how elusive Arctic Monkeys’ debonair art-rock has always been. “Body Paint,” the album’s cinematic centerpiece, belongs in the revered UK band’s pantheon of slippery slow burners, alongside enigmatic 2000s ballads “505” and “Cornerstone.” Swapping orchestral swoon for glam-rock crunch midway through—right after Alex Turner croons, “And if you’re thinking of me/I’m probably thinking of you”—the song is an emotive puzzle, obsessed with artifice and lingering smudges you can’t wash away.",Marc Hogan,65,Pitchfork,The 100 Best Songs of 2022
