Artist,Song,Year,Review,Reviewer,Ranking,Source,Source Title
Rema,Dumebi”,2019,"At the beginning of 2019, Rema was a teenager from Benin City, Nigeria, with a modestly viralfront-seat car freestyle. In the spring, he was at the top of the Nigerian charts. Released on the label of the powerful and enigmatic producer Don Jazzy, who also helped establish Afropop powerhouses like Tiwa Savage, Rema’s self-titled EP was composed of four tracks, each with a different sound—Juice WRLD-style trap, Young Thug-influenced melodies, and Afropop love ballads. But standing tall among them was “Dumebi.” “Dumebi” feels both traditional and new. The Ozedikus-produced rhythm is bouncy and fresh, while Rema injects the track with youthful energy and eccentric melodies. The times are changing in Nigeria, both politically and culturally, and the next generation of Afropop sounds like Rema.",Alphonse Pierre,72,Pitchfork,The 100 Best Songs of 2019
Lil Tecca,Ransom”,2019,"In his instantly famous Genius “Verified” video for “Ransom,” teenage rapper Lil Tecca detailed what he made up while writing his not-so-humblebrag of a breakout hit: He has never gone to Europe, he doesn’t wear designer clothes, and he can’t mentally handle being a player. The Long Island MC may haveverifiedthese fabrications, but his playfulness was obvious enough from the sound of things. Buoyed by an infectious hook, a sugar-cereal beat, and Tecca’s Auto-Tuned verses, “Ransom” is two glorious minutes of playing pretend.",Matthew Strauss,71,Pitchfork,The 100 Best Songs of 2019
Sleater-Kinney,Hurry on Home”,2019,"Sleater-Kinney’s Carrie Brownsteinhas likenedthe romantic disjointment in “Hurry on Home” to the breakdown of trust between government and citizens in our Trumpian epoch. It is, quite certainly, the horniest song of said epoch. The lead single fromThe Center Won’t Holdis a raw-throated howl of queer desire, shot through with angry, annihilative hunger. It is the sort of music about fucking that you make when your very right to fuck isunder attack: Brownstein and bandmate Corin Tucker sing about sex as a desperate leap into disembodiment. The fevered pulse of St. Vincent’s production blurs the jagged edges of Brownstein and Tucker’s twin guitars, making for an urgent undercurrent capable of driving listeners into each other’s arms. So long as Sleater-Kinney survives, no force on earth will stand between a woman, another woman, and their primal urge toU-Haul.",Peyton Thomas,70,Pitchfork,The 100 Best Songs of 2019
Caribou,Home”,2019,"Home is an ambiguous concept for Dan Snaith: In his nearly two decades of music-making, the producer has dramatically reinvented himself on an album-by-album basis, veering from glitchy electronica to blown-out shoegaze to kaleidoscopic pop to subaquatic house without ever retracing his steps. So there’s a delightful sense of frisson when, on his first Caribou single in five years, we hear the sampled voice of ’70s soul singer Gloria Barnes declare, “Baby, I’m home.” It’s a statement that suggests a return to one’s roots, but “Home” doesn’t so much sound like Snaith’s earliest music as it does an alternate 2001 where he embraced the crowd-pleasing collagist aesthetic of the Avalanches and DJ Shadow instead of the cerebral beats of Four Tet and Boards of Canada. By conjuring a past he never experienced, “Home” once again takes Snaith somewhere he’s never been before.",Stuart Berman,69,Pitchfork,The 100 Best Songs of 2019
Georgia,About Work the Dancefloor”,2019,"Don’t get caught up on the seemingly faulty grammar of Georgia Barnes’ “About Work the Dancefloor,” a quirky electro-pop banger inspired by a weekend of club-hopping in Berlin. The unassuming lilt in the British percussionist/producer’s voice is enough to make the opaque title feel natural, as if she were interrupting her own train of thought. The single edit trims the song a bit; the best version appears on Georgia’s forthcoming albumSeeking Thrills, out in January, and gives room for her staggering intro to poke through the gleaming synths and stereo laser sprays. “I don’t have much in terms of money now,” Georgia admits as a thick, clubby bass drops, but on “About Work the Dancefloor,” she just wants to set us free.",Anna Gaca,68,Pitchfork,The 100 Best Songs of 2019
FKA twigs,sad day”,2019,"On the slow-burning “sad day,” FKA twigs alternates between a pining falsetto and a clenched, scratchy voice, full of regret. “Would you make a wish of my love?” she asks in the high voice, before dropping down and remembering the pain she caused in the past. The track, a jagged instrumental courtesy of twigs alongside producers Skrillex, Nicolas Jaar, Benny Blanco, and Noah Goldstein, fills in the space between these two modes of address—sweet entreaty, throaty self-recrimination. The refrain samples the British classic “It’s a Fine Day,” made famous in its 1992 rave rendition by Opus III, providing a moment of release from all the romantic tension and misguided hope.",Thea Ballard,67,Pitchfork,The 100 Best Songs of 2019
Koffee,Throne”,2019,"Over the past two years, the young Jamaican artist Koffee has steadily risen through the ranks of the reggae-dancehall world thanks to the success of her pop-leaning single “Toast,” a track so massive it was recentlyperformed by a Chinese military bandto welcome the Prime Minister of Jamaica to Beijing. But “Throne” is Koffee’s true coronation song. Atop laidback horns, the 19-year-old delivers a performance steeped in the lineage of imaginative reggae-dancehall, particularly that of her mentor, Chronixx. She is a clever, urgent lyricist, constantly finding new pockets to play in. “A born storm, fire cyah calm,” she declares over a soundsystem-perfected bassline that will suit American festivals just fine.",Anupa Mistry,66,Pitchfork,The 100 Best Songs of 2019
Octo Octa,I Need You”,2019,"The first half of this 10-minute track from DJ/producer Maya Bouldry-Morrison, aka Octo Octa, is rooted in gritted, lo-fi breaks, with vocals that drift on a reverbed vapor trail. They give ""I Need You"" the feeling of being suspended between two planes, its knees planted on the ground as its spirit drifts to the sky like a prayer. Then, six minutes in, the song finds its emotional anchor, as Bouldry-Morrison reads a buoyant note to her friends, her family, her listeners: “I love you! Thank you for being there. You mean so much to me.” It’s a deeply joyous moment.",Ian Cohen,65,Pitchfork,The 100 Best Songs of 2019
Charly Bliss,Capacity”,2019,"Brooklyn synth-pop band Charly Bliss introduced their second album,Young Enough,with a glimmering, radioactive song that delights in blowing everything up. On “Capacity,” singer Eva Hendricks questions her tendency to put other people’s needs before her own while remaining empathetic towards her anxious, overachieving younger self. Rather than using boyfriends, endless work, or other people’s desires as a distraction, Hendricks decides to finally celebrate herself. The sound of this emotional resurrection is enormous: an explosion of buzzing synth, commanding drums, and gnashing guitar buoy Hendricks’ effervescent vocals. The ultimate irony of this song about a commitment to do less? The band’s ambition clearly shines through.",Vrinda Jagota,64,Pitchfork,The 100 Best Songs of 2019
Polo G,Pop Out” [ft. Lil Tjay],2019,"Chicago rapper Polo G came up listening to local greats like Lil Durk and G Herbo, whose storytelling balanced titillation and tragedy. His own music is a logical evolution of their writing, even more vulnerable and irrepressibly sad. “Pop Out” was his breakout, the track that introduced his sorrow-stricken voice to the masses. Although it’s set against a backdrop of action—the robbery in the chorus is detailed with the kinetic precision of a Brian De Palma film—its real drama is internal, as Polo G processes the toll that playing the villain takes on your psyche. He may be the shooter, but in Polo G’s world, everybody’s a casualty. Telling his story, Polo G makes every word matter. It takes a special talent to rhyme “poverty” with “animosity,” and an even more special one to do it so casually that you don’t even really notice. That’s Polo’s great gift: His prose is intricate and purposeful, but it’s the emotion that lingers.",Evan Rytlewski,63,Pitchfork,The 100 Best Songs of 2019
Jessica Pratt,Aeroplane”,2019,"An airplane is a breeding ground for epiphanies—you’re floating above Earth and awed by the expanse, but you also feel distant and isolated and ultimately alone. It’s a place for remembering, for both running down regrets and allowing yourself to feel a bit of gratitude. That’s where Jessica Pratt finds herself here. “Aeroplane” is another entry in a long line of great songs set in the sky (think Joni Mitchell’s “This Flight Tonight” or Bill Callahan’s “Small Plane”), this one spurred by a reflection in the cabin window and an image of someone from her past, whose head she imagines wreathed in city lights. “I don’t wanna touch down,” she sings, musing over “treasures luminous and divine.” For three-and-a-half minutes, we’re up there with her.",Mark Richardson,62,Pitchfork,The 100 Best Songs of 2019
100 gecs,money machine”,2019,"Hearing “money machine”—the raucous, euphoric peak of trash-pop duo 100 gecs’ debut album—is like getting blasted in the face with a million Swarovski crystals and leaky glowsticks. It hurts and it's fabulous, this humiliation fantasy that begins with vocalist Laura Les calling you a “piss baby,” spitting and scream-singing through sheets of voice processing. Together with her fellow riot-starter Dylan Brady, Les crunches steel-wool bass and styrofoam guitars into something wonderful. 100 gecs seem to ask,What if you took everything you hated about yourself—all your insecurities about not being good enough or whole enough—and melted them down, jammed your boots in the sticky pit, and headbanged about it? Wouldn’t that feel like cash printed on demand?“money machine” is a purification ritual for the rotted-out brain, a seething, monstrous prayer to burn the slime away.",Sasha Geffen,61,Pitchfork,The 100 Best Songs of 2019
Mount Eerie,Love Without Possession”,2019,"Over the course of his last several albums, each a document of loss, Phil Elverum has become one of the most bracingly frank songwriters of our generation. On the first single from his sequel to the 2008 Mount Eerie albumLost Wisdom,he and collaborator Julie Doiron zoom out from the everyday minutiae of grief, excavating a broader-reaching poetics from blunt observation. “What glows beneath all the pain and anguish?” Elverum and Doiron ask in an asymmetrical call-and-response. The answer is love, of course. In this pair’s hands, love is an infinitely unruly concept, however concise their words and simple their musical arrangement, which doesn’t thicken much beyond the yawn of an organ and some distorted guitar. In his 2004 song “We Squirm,” Elverum characterized feelings as “captors” from which we’ll never be free. Here, love is rendered as a horizon, a void; it’s beautiful and it’s terrifying, and it goes on forever. And yet there’s comfort in hearing these two old friends return to one another to call this blazing thing forth.",Thea Ballard,60,Pitchfork,The 100 Best Songs of 2019
Chai,Fashionista”,2019,"From Kraftwerk’s “The Model” to David Bowie’s “Fashion” to Right Said Fred’s “I’m Too Sexy,” pop music has always looked to the runway with an arched eyebrow. These are songs that playfully skewer the fashion world for its vanity and vacuity while secretly desiring to be part of it. (Surely it’s no coincidence that all of the above also function as tailor-made catwalk soundtracks.) Chai’s “Fashionista” belongs in this tradition, though the Japanese pop maximalists are less focused on supermodels than on the cosmetics consumers buy in attempts to look more like them. The song’s punky disco bounce is less an invitation to pose for the paparazzi than the soundtrack to a daily drill of skincare routines and make-up applications. But lead singer Mana isn’t about to accept her fate as a prisoner to the beauty industry: “Someone’s trend, it’s a shame!/Someone’s rules, it’s a shame!” she shouts in Japanese, transforming “Fashionista” from a lip-glossed pop jam into a revolutionary cry to stomp on your compacts in 4/4 time.",Stuart Berman,59,Pitchfork,The 100 Best Songs of 2019
Burna Boy,Anybody”,2019,"A crown jewel among many on Burna Boy’sAfrican Giant, “Anybody” offers up an unrelentingly smooth exercise in realizing your own potential. The track’s fleshed-out sound, filled with bright horns, rapid clave rhythms, and a melodicinterpolationof Angélique Kidjo’s “We We,” suits the Nigerian star’s specific strain of prosperity gospel: If you have wealth, share it with your friends, he seems to say; and if you see others flaunting theirs, know that their comeuppance is around the corner. Like the smooth-talking “Ye” before it, “Anybody” finds Burna Boy operating at peak power, with his deep rasp and haughty delivery locking into an indisputable swagger. “Respect is reciprocal,” he declares, encouraging and upbraiding us at once.",Eric Torres,58,Pitchfork,The 100 Best Songs of 2019
Haim,Summer Girl”,2019,"Haim released “Summer Girl,” their first single since 2017’sSomething to Tell You, on July 31, just in time to bottle the incandescent idea of late summer, when the season feels sweeter because its days are numbered. That sense of savoring small, perfect snatches of sun breezes through the song’s sax-flecked groove. It’s a minimal pop song with maximum levity, and if it feels like a balm, that’s because Danielle Haim wrote it for her partner (and Haim producer) Ariel Rechtshaid, who was battling testicular cancer at the time. Interpolating the “doo doo doo”s of Lou Reed’s “Walk on the Wild Side,” “Summer Girl” never builds to one solid chorus or drop, instead swaying into a sketch of a season’s magic hour, rolling on and on into the sunset.",Jenn Pelly,57,Pitchfork,The 100 Best Songs of 2019
Joy Overmono,Bromley”,2019,"When it comes to peak-hour dance tracks, there are crowd-pleasers that give the audience a perfect loop or breakbeat to sink their teeth into, and pivot tunes that give the DJ space to steer the night in new directions. “Bromley,” the first joint single by UK rave powerhouses Joy Orbison and Overmono, somehow manages to be both: a raw techno tool built atop relentless drum loops and a collage of intriguing sounds. Its mysterious, sampled vocal feels like a prism for a dancefloor’s energy, while moody ambience and electronic noise creeps through the cracks between drum hits. “Bromley” is a perfect fusion of Joy Orbison’s atmosphere and the thudding, percussive style of Overmono, and the results are delirious.",Noah Yoo,56,Pitchfork,The 100 Best Songs of 2019
Toro y Moi,Freelance”,2019,"“Freelance,” the spiritual centerpiece of Chaz Bear’s sixth album as Toro y Moi, is the sort of catchy song that follows you—onto the subway, into the bathroom, into your dreams. Elsewhere on the well-namedOuter Peace, Bear says he’s “bad with the words,” but the lyrics here are worth chewing over. There’s the darkly ironic (“Freelance now, yeah I guess you earned it”), the adorably resigned (“No more shoes and socks, I only rock sandals/I can’t tell if I’m hip or getting old”), and the strangely evocative (“You don’t know that you’re rust”). On the surface, “Freelance” may seem nonchalant, maybe even absurd, but there’s plenty going on here—and, given how much it burrows into your brain, it’s ultimately impossible not to notice.",Jonah Bromwich,55,Pitchfork,The 100 Best Songs of 2019
Stormzy,Vossi Bop”,2019,"Two years after Stormzy’s debut record lifted him from emergent grime talent to the all-around pride of London, the first single from his forthcoming second album took it back to the basics he built his name on. Best when he’s blustery, he took the raring energy of his early singles and channeled it into an extended brag concurrent with the vibe ofthe dance that inspired him. In it, he celebrates his success as a musician and activist while hearkening to the long tradition of dance-instructive tracks in the UK funky club scene that he’s drawn from. Stormzy's delivery is as stealth and cool as a Lamborghini in a foggy alley at night, further codifying his versatility as an MC and expressing the sweatless confidence of a newly crowned king.",Julianne Escobedo Shepherd,54,Pitchfork,The 100 Best Songs of 2019
Lizzo,Juice”,2019,"Lizzo began 2019 as a cult favorite and ended it as a full-on industry darling. “Juice” wasn’t the hit that landed her at No. 1 for much of the fall, but the song’s irresistible throwback funk brought the singer-rapper into pop radio territory early on in the year, setting some groundwork for the big break to come. It’s an unapologetic introduction to Lizzo’s empowering strain of pop: If you don’t like the fabulosity before you, the song seems to say, then that’syourproblem. Pulling double duty as both a body-positive banger and a party bop, “Juice” obliterates inhibitions to the point that listeners’ insecurities become as insignificant as the not-so-single men sliding into Lizzo’s DMs.",Abby Jones,53,Pitchfork,The 100 Best Songs of 2019
Jenny Lewis,Wasted Youth”,2019,"In the deceptively chipper “Wasted Youth,” Jenny Lewis lets us in on two sisters’ blacked-out, rock-bottom conversation about the recent death of their estranged mother, who was a drug addict during their childhoods. But if you ask Lewis about it, there’s a more innocent dependency at its core: “I feel like that song is more about Candy Crush than heroin,” sheexplained, “if that’s even fucking possible.” And indeed, during the breezy pinwheel of a hook, Lewis sings the name of the time-sucking iPhone game, letting those two words sum up the helplessness that haunts the song. As the folksy pop melody swirls, her words descend like so many colorful blocks on a screen. It’s a distraction—something to keep us entertained while everything falls apart—but that doesn’t mean it’s not real.",Sam Sodomsky,52,Pitchfork,The 100 Best Songs of 2019
Peggy Gou,Starry Night”,2019,"Whatever accounts for it—club culture’s ongoing fragmentation, some creeping suspicion that levity is bankrupt—dance music has been short on anthems in recent years. The South Korean producer Peggy Gou’s “Starry Night” summons revellers around a familiar gathering point: bright, bold piano chords, the tentpoles of summertime house classics ever since the music migrated from Chicago basements to Balearic terraces. To drive her point home, she offers up a chant that’s practically subliminal—one-word invocations of the ocean, starlight, pleasure, freedom,us. It’s a song about communion, an invocation of the very act of coming together, and an irresistible reminder of why we do.",Philip Sherburne,51,Pitchfork,The 100 Best Songs of 2019
Neon Indian,Toyota Man”,2019,"Alan Palomo floated onto the indie scene a decade ago as the avatar of a sun-baked, synth-based movement that everyone soon begrudgingly agreed to call “chillwave.” Over the next several years, his Neon Indian project grew from warped-cassette daydream to wide-screen dance party. “Toyota Man,” Palomo’s first new song in three years, casts his music in fresh light by drawing out elements that were integral to his sound all along. Politics, humor, and Palomo’s Mexican-American identity were already latent in Neon Indian’s discography, but this warped Spanish-language protest anthem finally brought them all brilliantly to the front. The results feel more joyful than anyone in a time ofborder wallsandinternment campscould have expected. “Toyota Man” mixes endearing details (learning English fromThe Larry Sanders Show) with broad truths (“Todos somos Americanos,”or, as translated, “We are all American”) concoct a perfect celebration of his own immigrant experience—and, by extension, the American experience writ large.",Marc Hogan,50,Pitchfork,The 100 Best Songs of 2019
Teejayx6,Dark Web”,2019,"If you’ve ever woken up to see that Saks Fifth Avenue has charged thousands of dollars to your credit card, you probably won’t love Teejayx6’s brand of Detroit scam rap. On “Dark Web,” after the government bans Teejayx6 from using those sites, he responds by downloading a Tor Browser so he can get back in, obtains a VPN so he’s untraceable, and purchases aBINso he can once again go about his scams freely. The hyper-specific details—he makes it sound so easy that credit scams probably quintupled in the wake of this song—are what makes his music both seedy and improbably exciting. It’s the story of an underdog who just wants to scam a couple of unaware citizens and department stores so he can acquire some drip he can flex on IG: “I paid five thousand for my fit/ I’m not fitting in,” as he puts it. If you’re going to scam, at least make a catchy song about it.",Alphonse Pierre,49,Pitchfork,The 100 Best Songs of 2019
Jamila Woods,ZORA”,2019,"“I do not weep at the world, I am too busy sharpening my oyster knife,” Zora Neale Hurston wrote in 1928. Her words, spiked with equal parts apathy, opulence, and menace, echoed in Jamila Woods’ mind as she worked on her second album,LEGACY! LEGACY!, a monument to black excellence. Like Hurston, the namesake of the album’s first single, Woods is something of a polymath: a singer-songwriter, poet, teacher, and activist. But on “ZORA,” she asserts that her selfhood is far more expansive than these labels, or any others thrust upon her, would suggest. “Little boxes you can’t stick unto me,” she sings, her vocals melting over a commanding backbeat. As if with a finger wag, she adds, “You will never know everything.” But there’s sweetness even in Woods’ venom, as when she taunts her foes by threatening to “tenderly fill [them] with white light.” It’s another nod to her multitudes: White light contains every color of the rainbow.",Olivia Horn,48,Pitchfork,The 100 Best Songs of 2019
Caroline Polachek,Door”,2019,"Sometimes the difference between a good pop song and a great one lies in the sticky details:a borrowed bassline,a baby coo,the loop of a tumbi melody. Chairlift singer-songwriter Caroline Polachek, one of the first ’00s indie rock musicians to move intomainstream pop songwriting, surely knows this. On “Door,” her first single released under her own name, Polachek turns her malleable voice into a sing-song hook—“Back in the city/I’m just another/Girl in a sweater”—that scales up and down infectiously. Inspired by the slow-burning funk of Chic’s “At Last I Am Free” cover, Polachek takes her time unfolding the details surrounding that small realization. Atop sparse beats and a hazy guitar, she sings poetically about the wave of self-actualization that hits after the end of a long-term relationship, noting that “the door slams hard behind you when you leave the house of judgement.”",Jillian Mapes,47,Pitchfork,The 100 Best Songs of 2019
Perfume Genius,Eye in the Wall”,2019,"To hear him tell it, Mike Hadreas has a terrible relationship with his body. He has Crohn’s disease, and he’s repeatedly expressed the desire to transcend his own fleshy form. Yet over four fearless albums, his physicality has occupied an ever-greater part of his work. InThe Sun Still Burns Here, a dance piece from Hadreas and Seattle-based dancer Kate Wallich, it becomes the totality: One preview described part of the performance as “essentially a fully clothed orgy,” for which Hadreas both composed the score and performs as a dancer. On “Eye in the Wall,” the first song released from the project, he commands fragmented images of a body to become whole, “wild and free,” leaving him “full of feeling…full of nothing but love.” He issues these instructions in a louche warble, his twang and metallic shimmer gathering into a nine-minute reverie of Afro-Latin percussion and searing, silvery brightness that captures the incandescent feeling of physical abandon.",Laura Snapes,46,Pitchfork,The 100 Best Songs of 2019
Ariana Grande,NASA”,2019,"NASA, probably the only popular U.S. government agency left, was everywhere this year: T-shirts and patches bearing its charmingly retro insignia became abona fide trend, and Ariana Grande pulled its name for a sneaky sleeper hit fromthank u, next.On an album largely about the joys of being unattached, “NASA” offers a nuance: the freedom to be attached, just not right now. “I can’t really miss you if I’m with you,” Grande offers, gently reminding a lover that intimacy doesn’t mean constant proximity. While Grande’s refrain of “I’m a star, I’ma need space” verges on cutesy, the delicate harmonies and airy production of “NASA” make its blown-out bass and trap drums feel weightless.",Anna Gaca,45,Pitchfork,The 100 Best Songs of 2019
