Artist,Song,Year,Review,Reviewer,Ranking,Source,Source Title
 Girls,Hellhole Ratrace,2008,"I wanted to pull rank and sneak that Chunklet David Lee Roth vocal track or the Andrew W.K. ""McLaughlin Group"" song in here, but fair is fair. Plus, hell, it already feels like I pulled rank with this low-key release from San Francisco's Girls: almost nobody outside of our office voted for it, i.e. nobody other than the people forced to listen to me talk about and play this bit of casual bedsit glam-pop. Ideally that will change in the new year: With luck, Girls will get big enough for people to complain that female-centric band names (see also: Women, the Girls, Vivian Girls) are the new ""crystal"" or the new superfluous consonant (see: Wavves, Nodzzz, Lovvers). So long as people are listening. -",Scott Plagenhoef,100,Pitchfork,The 100 Best Tracks of 2008
Final Fantasy,The Butcher,2008,"Recorded with the members of Beirut during a series of faux field recordings in Quebec, ""The Butcher"" ripples with samples of bird calls and crickets. Lyrically, it's one of Owen Pallet's strongest songs, conveying a sense of urgency and doom that is pushed along by the gorgeous melodic layers that ride restlessly beneath. But Pallet's startling knack for string arrangements really gives ""The Butcher"" movement, the way the piercing violin line soars over the even disposition of the muscular brass. -",Mia Clarke,99,Pitchfork,The 100 Best Tracks of 2008
The Magnetic Fields,The Nun's Litany,2008,"A great song about longing to be perceived as a sexual being, and an even better joke, because Stephin Merritt knows how ludicrous that longing can be. The title is the omitted detail that makes the lyric's meaning fall into place; the melody is as severe and formal as a nun's cloth, but the arrangement is interested in an entirely different Jesus and Mary. The escalating fantasies of each verse have little circumstantial barbs built into them (""I want to be a brothel worker/ I've always been treated like one""), and the last one ends by abruptly stripping singer Shirley Simms' voice naked in front of her audience. Also worth finding: the solo ukulele-accompanied version Merritt sings himself, on which he hilariously phrases ""learn S and M and all those gay tricks"" as if M and S were unrelated concepts. -",Douglas Wolk,98,Pitchfork,The 100 Best Tracks of 2008
Buraka Som Sistema [ft. M.I.A. and DJ Znobia],Sound of Kuduro,2008,"Portuguese collective Buraka Som Sistema play kuduro, an Angolan dance music creole built out of baile funk beats and abandoned rave motifs: a junkyard sound that builds up such steam you fear it might shake itself to bits. On this calling-card track M.I.A. acts the carny, yelling ""All aboard!"" and setting the ride spinning as MCs Saborosa and Puto Prata spit boneshaking consonants over a spring-loaded beat. Around them hoots, horns, keyboards, and bird calls conjure a spirit of joyful mayhem. M.I.A.'s endorsement gives you a reference point for Buraka's guerrilla techno, but the track's breakneck appeal would easily survive her absence. -",Tom Ewing,97,Pitchfork,The 100 Best Tracks of 2008
Empire of the Sun,Walking on a Dream,2008,"In what your high school chemistry teacher calls a catalyzing reaction, Luke Steele and Nick Littlemore joined forces to create a disco-country rock sensation. ""Walking on a Dream"" marshals Steele's indulgent and ridiculously intertwining melodies from the Sleepy Jackson with the four-on-the-floor drive of Littlemore's Pnau, sounding like a thesis statement for the two projects. Steele's screeching falsetto often seemed a bit put-on in the past, like he was trying to match his ridiculously overwrought orchestration in a game of one-upsmanship. The catcall serves him better on ""Walking"", which draws from the same kaleidoscopic nostalgia that guides the likes of Scissor Sisters and the DFA but comes out tight and unfettered. -",Mike Orme,96,Pitchfork,The 100 Best Tracks of 2008
Friendly Fires [ft. Au Revoir Simone],Paris (Aeroplane Remix),2008,"Pop songs are full of promises, most propped up by little more than a few chords and a nice melody. UK phenoms Friendly Fires go one step further with ""Paris"": Their ""I promise"" gets a boost from the very contemporary go-getter mantra that immediately follows, ""I'm on it."" And this remix does them one better by involving an actual Aeroplane-- certainly one way to get to Paris-- and, well, pretty much eliminating the Friendly Fires guys from the equation all together by relinquishing their verse parts to the original track's chorus girls Au Revoir Simone (hey that's French!). Even if all this fails to convince you that Friendly Fires will one day live with you in Paris and command the stars to shine on your behalf, at least you got a sweet, beat-accented eight-minute ride out of the deal. -",Matthew Solarski,95,Pitchfork,The 100 Best Tracks of 2008
WHY?,Fatalist Palmistry,2008,"At first blush, ""Fatalist Palmistry"" feels like the perfect early spring jam. Its confident jangle and generous bounce guide it through warm harmonies and reassuring piano, the sound of a wide grin in a new car, the top down and the sun shining. As blissful as these four minutes feel, though, they're the torturous culmination of Yoni Wolf's cyclical neuroses. He sweats death even as he bemoans life even as he celebrates not being dead yet. He confesses maudlin feelings for a married woman even as he admits his devotion is a limited-time offer even as he proclaims admiration in the eternal: ""I'm lucky to be under/ The same sky that held/ The exhale from your first breath."" It's difficult hearing any writer toil through this sort of detailed torture on tape. Thanks to the song's survivalist glow, though, listening in is a joy. -",Grayson Currin,94,Pitchfork,The 100 Best Tracks of 2008
Atlas Sound,River Card,2008,"Inspired by a Puerto Rican fable about a boy who falls in love with his own reflection after gazing into a river and ends up drowning as a result, ""River Card"" was the hidden gem on Atlas Sound's debut album, Let the Blind Lead Those That See But Cannot Feel. Shimmering with longing and carried by a percussive pulse that feels like a heartbeat, it took a couple of listens before revealing itself as a high point in Bradford Cox's songwriting. The track gently swells with a rising tension that never dissipates, but expands with an ambient airiness that feels as deep and clear as the river Cox describes. -",Mia Clarke,93,Pitchfork,The 100 Best Tracks of 2008
Born Ruffians,I Need a Life (Four Tet Remix),2008,"Though Kieran Hebdan's reimagining of ""I Need a Life"" by Toronto's Born Ruffians abandoned that song's indie rock pedigree for vistas much more expansive, it still bottled the Red, Yellow & Blue single's grown-up-but-still-wild-haired vitality. Hebdan conjures serious vocal abracadabra from Born Ruffians' multi-tracked vocals, the shouting and jounce of the original all but lost in a featherbed of synths, keys, and kick drum. -",David Bevan,92,Pitchfork,The 100 Best Tracks of 2008
Jamie Lidell,All I Wanna Do,2008,"When Jamie Lidell rolled his Soul Man dice this time, out came ""Sam Cooke Ballad."" Like an idyllic 1950s prom date, the Warp throwback is ""swallowing the sky so there'd be nothing to fall on you"" as plucked bass gently bounces off swirling keyboards. But while the song may seem like an impressive ""Mad Men"" jingle at first, its sentiment is skewed a little to fit our modern world. Cooke's best slow jams-- ""You Send Me"", ""Cupid"", ""Nothing Can Change This Love""-- proposed a romantic love that's eternal, unwavering, and sublime; Lidell isn't as starry-eyed. ""There's really no such thing as an endless night,"" he admits. ""So let's make a little magic just to put things right."" All he wants is something more than a one-night stand, but less than a retirement home in Boca-- a cupid with his feet on the ground. -",Ryan Dombal,91,Pitchfork,The 100 Best Tracks of 2008
Sic Alps,Message From the Law,2008,"San Francisco duo Sic Alps made the leap from primitive noisemakers to semi-pro songwriters in the blink of an eye. Their 2006 debut album was a stumbling wreck of overmodulated, blues-damaged debris, but by last year they had become equally capable of Nuggets-style gems. ""Message From the Law"", a 12"" B-side compiled on A Long Way to a Shortcut, is their shiniest stone yet, a fuzzy garage ditty built around bouncy chords, a finger-snapping beat belted out on trashcan drums, and the faded croon of Mike Donovan. It also has a skewed, loose edge that only an ex-noise band could muster, and while Sic Alps are still given to moments of dodgy confusion, their newfound clarity could be their cleverest trick yet. -",Marc Masters,90,Pitchfork,The 100 Best Tracks of 2008
Ponytail,Celebrate the Body Electric (It Came From an Angel),2008,"At first glance, the smiley, casualwear-clad Ponytail seem mild-mannered, but when it comes time for their ever-more-impressive feats of derring-do, their transformation time's little more than a count-off. And ""Celebrate the Body Electric"" is bona fide geek-to-superhero music, the surefooted sound of bottled-up rage exploding into banshee squeals and echoing guitars. It's easy to picture it underpinning some Peter Parker type's refusal to hand over the milk-money; or, for more practical application, the blast-off point of their revelatory live shows. ""Away we go now,"" Molly Siegel seems to be chanting as the tune catapults itself into the stratosphere, and with that, they're fucking off. -",Paul Thompson,89,Pitchfork,The 100 Best Tracks of 2008
Low Motion Disco,Things Are Gonna Get Easier,2008,"The Five Stairsteps' ""O-o-h Child"" is an old song about future days. Low Motion Disco's red-cheeked edit, ""Things Are Gonna Get Easier"", is instead a perfect soundtrack for our idealized present, at a time when hope actually seems totally natural. Revisit your pre-election, bailout-weighted October headspace, however, and remind yourself how absolutely necessary this song was in 2008. It's such an easy high that you wonder if the sort of margarine-spread treatment that LMD employ couldn't be used on every classic soul song. Go ahead: spend winter 2009 dreaming on a 17-minute ambient version of ""I Call It Pretty Music But the Old People Call It the Blues"". -",Andrew Gaerig,88,Pitchfork,The 100 Best Tracks of 2008
The Veronicas,Untouched,2008,"From its opening, pathos-laden synthetic strings, ""Untouched"" wears its artificial heart on its sleeve. Teen-pop duo the Veronicas verge on replicant-status here, chanting at lightning speed through a tongue-twisting account of joylessly insatiable desire. Musically, too, there is no satisfaction: With its brisk, stiff beats, moody guitar, and pseudo-gothic seriousness, ""Untouched"" is pop at its most totalitarian, demanding submission but indifferent to your enjoyment. Best of all is the high-pitched, melodramatic chorus-- ABBA-like in its touching simplicity and grimly formal perfection. ""Untouched"" literalizes the put-down ""manufactured pop"": this is strictly party music by and for flawless, heartless robots. -",Tim Finney,87,Pitchfork,The 100 Best Tracks of 2008
Los Campesinos!,"Sweet Dreams, Sweet Cheeks",2008,"""Any idea..."" e-mailed an editor in the summer of 2007 after seeing Los Campesinos!, ""...what that 'one vote for yes, two votes for no' LC! song is?"" It's ""one blink for yes, two blinks for no,"" and the song was ""Sweet Dreams, Sweet Cheeks"", from a 2006 demo available on the Welsh septet's MySpace. Like last year's #41 track, ""You! Me! Dancing!"", ""Sweet Dreams, Sweet Cheeks"" was an unmistakable indie hit from first listen-- LC! closed shows with it long before all but the most LC!-like (read: obsessive) audience members would've recognized it. On 2008's Hold on Now, Youngster..., producer Dave Newfeld (Broken Social Scene) has its youthful desperation spilling over all the more, a superabundance of shouts and scraggly guitar. The lyrics are gloriously elliptical-- Malkmus-gone-emo. As online music gets increasingly corporatized, indie rock appears to be reassuming the marginal place it held in the old brick-and-mortar economy; if so, a subculture crashes and burns magnificently here. -",Marc Hogan,86,Pitchfork,The 100 Best Tracks of 2008
Osborne,16th Stage,2008,"In his review of Todd Osborn's almost self-titled romp down electronic music's memory lane, Andy Battaglia correctly observes that the synth riff that drives opener ""16th Stage"" sounds a whole lot like the ""Doogie Howser"" theme. This is the kind of celebration Osborn likely envisioned when he came up with the idea of a record that meditates on the history of house music. The keyboard first comes off as cold and distant, but the song's weary hook persists over a beat and murmured vocals, warming into a fondly remembered moment of nostalgia. -",Mike Orme,85,Pitchfork,The 100 Best Tracks of 2008
Beach House,Gila,2008,"If you've never experienced a narco-haze, here's your chance to do it by proxy. In Victoria Legrand's sleepy world, the word ""Gila"" has about 17 syllables, and she spends the almost whole second half of the song finding different ways to draw it out into melodic ribbons. Alex Scally's guitar, meanwhile, winds like a sepia-toned serpent through the dry lakebed of organ and muffled drums that provides the song's foundation. This is Beach House during the off-season, boarded up and empty, but ringing with memories of warmth and activity. -",Joe Tangari,84,Pitchfork,The 100 Best Tracks of 2008
Titus Andronicus,Upon Viewing Brueghel's 'Landscape With the Fall of Icarus',2008,"Patrick Stickles is proving himself one of rock's great unreliable narrators, steering his alternately confident and weary Titus Andronicus through all of the existential dread at the heart of the sprawling The Airing of Grievances. ""Brueghel's"" is the record's literal centerpiece and arguably the tune from which all the others' lyrical threads unfurl. More than that, though, it's the one track on the album that sounds like it could break loose and go on forever, careening off the back of the spiny guitar line that runs through its second half and Stickles' tale of life unrequited. ""I was born into self-actualization,"" he imparts at the song's beginning with what sounds like a smirk, and when the tune's beery ballast crashes into his words about god and death and a Saturday night, you realize he almost means it. These young punks seem to be steering through the days with just as much of a clue as the rest of us, but on ""Brueghel's"", they've set quite a backdrop for getting derailed. -",Paul Thompson,83,Pitchfork,The 100 Best Tracks of 2008
Solange,Sandcastle Disco,2008,"Solange wants badly to convince us of her disco hipness, but ""Sandcastle Disco""'s video looks like a cross between Michel Gondry and those Hewlett Packard ""hands"" commercials, both of which seem like more fitting cultural touchstones for Solange than late-period Diana Ross anyway. For an artist (still) looking for a big-moment star turn, Solange works within herself on ""Sandcastle Disco"", and her honey-lipped restraint is the strongest evidence yet that Solange is more permanent than her titular featherweight palaces. There's nothing wrong with big sis' rapturous declaration, ""If you like it you should've put a ring on it,"" but Solange seems to understand that our relationship with her is still in the ""if you like it"" phase. So she sings soft and avoids uncouth innuendo, you know, keeps things ladylike. It's all very sweet. -",Andrew Gaerig,82,Pitchfork,The 100 Best Tracks of 2008
Love Is All,Wishing Well,2008,"Witchcraft, tarot cards, wishing wells-- what will it take to help Josephine Olausson find that one thing that's in her band's name?? ""Wishing Well"" doesn't provide any explicit answers, but it does turn the search into an exhilaratingly fizzy lo-fi pop shout-along that ranks as A Hundred Things Keep Me Up at Night's high point. That most Love Is All songs sound like they were recorded in a tin can is part of the act's charm; this one, however, could have been laid to tape inside a confetti-loaded firecracker about to go BOOM. And if the lyrics are all desperation, the music is all hope and excitement; we straight up dare you to get that main melody out of your head. -",Matthew Solarksi,81,Pitchfork,The 100 Best Tracks of 2008
The Bug [ft. Warrior Queen],Poison Dart,2008,"Like all of the best productions by the Bug, aka Kevin Martin, ""Poison Dart"" seems broadcast from some post-apocalyptic future where little of the urban landscape remains intact but somehow dancehall culture has managed to survive and flourish. Admittedly, this impression is fuelled in part by the ""Poison Dart"" video, which envisions a Mad Max-style nomadic soundsystem unit, with Warrior Queen's ferocious vocals delivered via the mouthpiece of a strange hovering droid. Even without these visuals, however, Martin summons a dystopian shitstorm with his blown-out beats, shuddering bass, and distorted electronic squeals. Over the commotion Warrior Queen takes aim at those woebegotten fools who have been inexplicably deluded into believing her to be soft, sounding for all the world like a woman ready to withstand anything that Armageddon might throw at her.. -",Matthew Murphy,80,Pitchfork,The 100 Best Tracks of 2008
Ida Maria,Oh My God,2008,"In demo form, ""Oh My God"" has been kicking around Norwegian radio and Ida Maria's MySpace page since 2007, but that doesn't mean the song can't kick ass in '08. Rolling through the year collecting new converts, the retooled album version-- from her debut Fortress Round My Heart -- loses the rawness of the original as well as the boy-girl vocals with guitarist Stefan Törnby, but it gains a new and almost impossible sense of urgency from the shakier guitars, taunting bass, bashing drums, and Ida Maria Sivertsen's world-swallowing vocals and self-destructive lyrics. ""You think I'm in control,"" she sneers, hardly asking a question but assuming your doubt. ""You think it's all for fun."" She convinces us otherwise. Good god. -",Stephen M. Deusner,79,Pitchfork,The 100 Best Tracks of 2008
Frightened Rabbit,The Modern Leper,2008,"Driving chords propelling ever forward towards cathartic crescendo. A sprightly, fiddle-like counter-melody. Yearning vocals that aim heavenward: Most of the time, these are the ingredients for an uplifting anthem, the kind of thing fans pack stadiums to sing along to with their arms around each other. With different lyrics, ""The Modern Leper"" could have the potential to turn the Scots in Frightened Rabbit into Coldplay, or at least Snow Patrol. But this is not a happy tune. Oh no. It's wretched. Lead Rabbit Scott Hutchison compares emotional debilitation (possibly alcohol-induced) with physical handicap, wondering how the hell anyone could ever love him: ""Is that you in front of me/ Coming back for even more of exactly the same/ You must be a masochist/ To love a modern leper on his last leg."" No, Scott, we aren't masochists. We're just seduced by the song. -",Amy Phillips,78,Pitchfork,The 100 Best Tracks of 2008
Telepathe,I Can't Stand It,2008,"Telepathe's contribution to Living Bridge, the inaugural release from the in-house label of Brooklyn's Rare Book Room studios, is typical of that stellar 2xCD compilation-- subtle, restrained, and sneakily hypnotic. Marching to a slow, rolling beat, ""I Can't Stand It"" builds momentum through quiet persistence, floating and humming until it gathers into a dense cloud of shimmering guitar and purring vocals. It's tempting to call the song ethereal-- it wouldn't sound out of place on an old 4AD collection-- but Telepathe inject it with too much blood and guts. ""I Can't Stand It"" may drift, but it's not made of air-- inside its entrancing haze lies thick, thoughtful sound. -",Marc Masters,77,Pitchfork,The 100 Best Tracks of 2008
Justice,DVNO (Radio Edit),2008,"This song started as a fairly inert cut on last year's † : its foot-dragging half-strut came close to fulfilling some kind of funk-pop promise, but it lacked one important thing-- energy. A solution came in the radio edit of ""DVNO"", which tweaked the song's tempo and pitch, restructured the backing track to heighten the arrogant thrill of Mehdi Pinson's preening vocals, and turned a lurching also-ran into manic, twitchy disco that sounded like the ideal haughty counterpoint to the adolescent glee of ""D.A.N.C.E."". The lyrics needle the exclusivity of certain dance clubs-- Xavier de Rosnay derived the title from El Divino-- so it's fitting the chorus plays out against a muffled bassline that sounds like the top-notch soundsystem of a ""enforced and fashionable"" dress-code club you're standing outside because you weren't invited. How else to react but to protest your exclusion from the list: ""Don't need to ask my name to figure out how cool I am."" -",Nate Patrin,76,Pitchfork,The 100 Best Tracks of 2008
Little Boots,Stuck on Repeat,2008,"Following in the tradition of the finest meta-pop, ""Stuck on Repeat"" is an addictive groove about being addicted to the groove...and addicted to love. Romantic obsession is a broken record in the sleek disco world populated by Victoria Hesketh (aka Little Boots) and producer Joe Goddard of Hot Chip-- a sentiment that can surely be understood by anybody who ever spent way too much time refreshing a crush's Facebook page over and over again. But real-life codependence isn't anywhere near as sexy as the blood-pumping throb (with sleighbell accents!) that anchors this immaculately constructed song, or the way that Hesketh's light-headed vocals swim around in the heavenly, beat-free middle section before being sucked back into the vortex. If it was, we'd all be doomed. -",Amy Phillips,75,Pitchfork,The 100 Best Tracks of 2008
Wale,The Kramer,2008,"If the real problem in America is class rather than race, why I am I wondering if my editor will censor the word ""nigger""? If it's class, why did people laugh when Michael Richards shouted, ""Fifty years ago they'd have you upside down with a fucking fork up your ass"" at a black audience member during a stand-up routine, but whisper ""oh my god"" when, seconds later, he shouted, ""He's a nigger. A nigger. Look at the nigger ""?""I'm not tryna be conscious,"" Wale raps, after Richards's rant fades. No, he's too self-aware and market-savvy to abort his career by being conscious. ""Conscious"" is code for ""uppity."" Tone it down or leave it to Bono. ""Nigger"" used to mean one thing. Now it means too much. ""P say that I should stop saying nigga, but if I did, what would be the difference?/ I'd still be a nigga."" This is the trap. ""The Kramer"" doesn't attempt healing; documenting the damage is hard enough. -",Mike Powell,74,Pitchfork,The 100 Best Tracks of 2008
Goldfrapp,A&E,2008,"Having recently conquered the world, Alison Goldfrapp decided to grow a heart. While I'm sure hawking soda and cellphones must have had its fleeting appeal, Goldfrapp and her partner Will Gregory changed gears after the overcharged, Grammy-nominated million-seller Supernature by releasing this year's introspective Seventh Tree. On ""A&E"", the album's best ballad, electronic treatments only threaten the dark edges of the song, building an increasing pulse to the crescendo of the bridge. Unlike previous Goldfrapp hits, which gussy up the vampy singer in an aggressive sexuality, ""A&E"" focuses on vulnerability: longing for someone gone, wondering whether they're thinking of her, taking pills, feeling surrounded by her own oppressive presence, lamenting the duality of an artist/entertainer. When Goldfrapp sings ""It's a blue, bright blue Saturday,"" she's not just chatting about the weather, she's sharing feelings once kept hidden behind her hypersexuality. -",Mike Orme,73,Pitchfork,The 100 Best Tracks of 2008
Fleet Foxes,Blue Ridge Mountains,2008,"Maybe more than any other band in operation, Seattle's Fleet Foxes are uncannily predisposed to singing about mountains: With its ghostly opening and perfect little Fender Rhodes riff, ""Blue Ridge Mountains"" feels ancient and huge, like it tumbled down from the top of the range and rolled straight into Sub Pop's front office. The atmospherics are so convincing-- and frontman Robin Pecknold's high, wearied vocals so effortless-- that when Pecknold mews the phrase ""I heard that you missed your connecting flight"" it feels genuinely anomalous: It's hard to imagine that Fleet Foxes and commercial airlines even exist in the same dimension. -",Amanda Petrusich,72,Pitchfork,The 100 Best Tracks of 2008
Sigur Rós,Gobbledigook,2008,"Since the late 1990s, Sigur Rós have dutifully fielded inquiries about Hopelandic, the googly, wheezing non-language favored by frontman Jonsi Por Birgisson; ""Gobbledigook"" feels like a tongue-in-cheek refutation-- in both spirit and name-- of the band's longstanding reputation for obtuseness. Built around an acoustic guitar riff (which, incidentally, could have been snatched from the Dave Matthews Band's ""Grey Street"") and nervous, foot-stomping percussion, ""Gobbledigook"" is the band's most blithe, frolicsome cut to date, an invitation to bounce around the room instead of huddling in front of the stereo. Sigur Rós haven't sacrificed any of their trademark grandeur-- even ""Gobbledigook"" feels epic in its own way-- but they have become a little more playful. -",Amanda Petrusich,71,Pitchfork,The 100 Best Tracks of 2008
