Artist,Song,Year,Review,Reviewer,Ranking,Source,Source Title
Mary Jane Dunphe,Stage of Love,2023,"On her first solo single, former CCFX crooner Mary Jane Dunphe describes a solitary, disorienting view of longing. The boiling point of her sensory confusion is right on the surface, bubbling out of the blown-out bass, tactile beats, and feral, distorted guitar riff. Dunphe’s deep voice seems to move in slow motion as she surveys the chaos. “Love is giving something you don’t have to someone who doesn’t want it,” wrote the French psychoanalyst Jacques Lacan, a scary thought at the heart of Dunphe’s battle cry. It’s reason enough to stay single.",Jill Mapes,100,Pitchfork,The 100 Best Songs of 2023
Marina Herlop,La Alhambra,2023,"Catalan experimental artist Marina Herlop once likened her music to a huffing monster that expands and deflates like an accordion. That sense of tension and release underlies this year’s Nekkuja, but with her contrasts manifesting as spiky peaks and plunging depths. The prismatic single “La Alhambra” is among the album’s most striking pieces: Between plucked guitar and blasts of bass drum, Herlop’s sweet, glitchy harmonies shoot out like shafts of light penetrating a cracked cave ceiling. She ramps up the drama with moments of near silence; skittering electronics rustle before Herlop stacks her vocal layers like a pyramid of glinting gold bars. The higher she piles them, the more they sparkle.",Madison Bloom,99,Pitchfork,The 100 Best Songs of 2023
Peso Pluma / Gabito Ballesteros / Junior H,LADY GAGA,2023,"Génesis, the breakout album from the Guadalajara-based vocalist Peso Pluma, effortlessly combines the material hustle and hypebeast style of American rap with the traditional acoustic sound and storytelling form of Mexican corridos. Over the percussive thump of a guitarrón and the nostalgic stirring of a 12-string bajo sexto, the unexpected superstar opines upon the numbing effects of his newfound fame, his throaty rasp like a high-pitched trumpet next to the smoother voices of Rancho Humilde signee Junior H and singer-songwriter Gabito Ballestros. Pluma takes the name for this single from a Lady Gaga-licensed line of Dom Pérignon rosé, a celebratory reference point for an artist who has transcended the assumed borders of so-called ""regional Mexican"" music.",Nadine Smith,98,Pitchfork,The 100 Best Songs of 2023
MSPAINT,Delete It,2023,"The first time MSPAINT played a hardcore festival outside their native Mississippi, vocalist Deedee had a chance encounter: finding Militarie Gun frontman Ian Shelton navigating a pre-show panic attack. The two connected and developed a lasting bond as weirdo outsiders adjacent to the scene. Eventually, Shelton helped guide MSPAINT as the co-producer of their debut album, and guest vocalist on its standout, “Delete It.” With lyrics about struggling to live in the moment, their collaboration plays like a long-lost ’90s alt-rock anthem, plunged through these artists’ idiosyncratic filters.",Ryan Leas,97,Pitchfork,The 100 Best Songs of 2023
RXK Nephew,Yeezy Boots,2023,"In all of the debate over Kanye West’s place in our current cultural climate, no one has gotten to the point as quickly as RXK Nephew: “Jay-Z don’t even like you,” “the whole G.O.O.D. Music made bad music,” and most damningly, “you signed Big Sean.” The latest in the Rochester rapper’s ongoing series of appointment-listening diss tracks, “Yeezy Boots” works well enough as a litany of opinions about Kanye’s rapping (mediocre), street credibility (non-existent), haircut (dumbass) and shoes (same). But it’s also a meditation on an important concern for RXK Nephew, whose utter disregard for social propriety puts his career at risk nearly every time he drops a track: just how much out-of-pocket shit can someone say before they suffer actual consequences? “They doing Kanye like R. Kelly/I don’t care, I don’t wanna hear his music,” Neph mutters, knowing damn well that most of Ye’s sins would be absolved if he was still making hits.",Ian Cohen,96,Pitchfork,The 100 Best Songs of 2023
Lankum,Go Dig My Grave,2023,"A boy courts and then rejects a young woman. She returns home and hangs herself. Under various titles, this story has been sung countless times over the centuries. Dublin band Lankum recast it in light of the recent folk horror film revival; their version conveys an ambient dread akin to The Witch and A Dark Song. The spare arrangement opens with Radie Peat’s keening vocals and builds to a climax of queasy strings and death march percussion that’s more Bauhaus than “Barbara Allen.” The horror lies in the steadiness of it all, in its terribly unrelenting pulse and drone: Every thrum is a shovelful of dirt on your casket.",Stephen M. Deusner,95,Pitchfork,The 100 Best Songs of 2023
Bad Bunny,WHERE SHE GOES,2023,"For months after its release in May, Benito stans filled Reddit threads arguing over the creative merits of “WHERE SHE GOES,” and whether it went anywhere worthwhile at all. But the moody, New Jersey club-fueled banger offers just enough starts, stops, and beat drops to mirror his musings about infidelity. (A star-studded video featuring Lil Uzi Vert, Frank Ocean, and Ronaldinho simply adds to the fun foray into Bad Bunny’s relationship fuckery.) The song’s sprawling synths, brawny bass, and huge, soaring chorus meant “WHERE SHE GOES” only gained momentum through the year, becoming a ubiquitous song of the summer.",Erin Macleod,94,Pitchfork,The 100 Best Songs of 2023
Corinne Bailey Rae,New York Transit Queen,2023,"“New York Transit Queen” transforms a 1954 archival photo of a Black pageant winner riding a fire engine into a riot grrrl anthem. Corinne Bailey Rae, first known for bashful and yearning mid-2000s pop, debuts her shriek while narrating her subject’s joyous commute. The queen swells with potential as Rae and co-producer S.J. Brown soundtrack the raucous ride with clamoring drums, roaring guitar chords, and schoolyard handclaps that build into a wall of rhythm. Rae doesn’t give her a destination, but she’s obviously going places.",Stephen Kearse,93,Pitchfork,The 100 Best Songs of 2023
Everything But the Girl,Nothing Left to Lose,2023,"While married couple Tracey Thorn and Ben Watt have had their hands full with creative projects over the past two decades, it was a welcome surprise when their beloved group Everything But the Girl released Fuse early this year. The album highlight “Nothing Left to Lose” picks up where 1999’s Temperamental left off. Watt’s icy, slinky, and carefully structured production hides outsized emotions beneath garage’s lithe profile. Thorn’s exquisite, melancholic alto sings of the unbreakable bond between love and pain. “Kiss me while the world decays,” she pleads with the kind of passion that explains the duo’s reputation as dance music’s dreamiest couple.",Cameron Cook,92,Pitchfork,The 100 Best Songs of 2023
Ragana,Desolation’s Flower,2023,"Ragana specialize in slow-moving, starkly arranged epics that gain power from how little is happening: a repeated phrase that gets under your skin as the volume increases, a sinister guitar riff that gathers momentum the more familiar it becomes, a pounding kickdrum that reverberates deep in your chest. “Desolation’s Flower,” the blown-out title track to the Pacific Northwest duo’s debut album for The Flenser, tethers this minimalist philosophy to a righteous rally cry. “Holy are the names,” they sing in remembrance of their queer and trans ancestors guiding them toward this moment. Together, they hold tight to their enduring values in a complicated world.",Sam Sodomsky,91,Pitchfork,The 100 Best Songs of 2023
Kieran Hebden / William Tyler,"Darkness, Darkness",2023,"As Four Tet, Kieran Hebden has been blueprinting new possibilities for mixing beats and samples of acoustic instruments for more than two decades. Unsurprisingly, this union with William Tyler, the virtuoso finger-picking journeyman, is a perfect match. Centered on a thick chunk of “Darkness, Darkness,” a 1969 obscurity from soul-pop singer turned Days of Our Lives actress Gloria Loring, the song is a 10-plus-minute slow-burner that builds from psych-folk meditation to mid-’70s Miles Davis-style supernova, with Tyler channeling forefathers like Sonny Sharrock and Pete Cosey as Hebden shell-games the rhythms. The producer says a full album is on the way; it should be a mindbender.",Will Hermes,90,Pitchfork,The 100 Best Songs of 2023
Kiko el Crazy,Pa Que Baile,2023,"Saturated in Willy Wonka theatrics and slippery wordplay, Kiko el Crazy’s album Pila’e Teteo saved 2023 from a dembow drought. Opener “Pa Que Baile” hits with the force of a defibrillator to the eardrums, with an irresistible dancehall vocal loop that sucks you into the Dominican Republic’s neon underbelly like molly-water through a silly straw. In Kiko’s street utopia, ass-shaking is the highest currency, gangsters empty their clips toward the skies, and familiar pop references are reimagined as bachata remixes. He also bites back on Rosalía’s Dominican phase—when she pickpocketed his signature phrase “la pampara,” tried bachata, and befriended Tokischa—by recycling her own flamenco hand claps and “Linda” melody for a playful Caribbean repossession. He even channels his inner “Rich Girl” in the chorus, subverting yet another famed pop culture vulture. But here, everyone has all the money in the world.",Tatiana Lee Rodriguez,89,Pitchfork,The 100 Best Songs of 2023
Asake,Amapiano,2023,"Underpinning Asake’s freewheeling cool is an epic striving for greatness. “Amapiano” is a concentrated blast of the Nigerian artist at his most charismatic and braggadocious, both a salute to the titular South African genre and his own swaggering stamp on it. Between trading boasts with rapper Olamide, Asake builds out the track’s skeletal house pulse and snaking log drum bass with sauntering Afrobeat melodies and a rousing chorus. In his attention to detail and sense of purpose, Asake elevates the song’s everyday hedonism into a hard-partying hero’s quest.",Harry Tafoya,88,Pitchfork,The 100 Best Songs of 2023
City Girls,Face Down,2023,"“Face Down” is a welcome reminder of City Girls’ propensity for churning out X-rated bangers. Flipping one of 2 Live Crew’s most notoriously obscene hooks, the duo dishes out trademark manifestos on scheming men over a riotous bounce beat. Even as Yung Miami and JT have spent more time as moguls and models than as rappers in recent years, “Face Down” proves that their raucous formula can still clock out hits.",Claire Shaffer,87,Pitchfork,The 100 Best Songs of 2023
Rosalía / Rauw Alejandro,VAMPIROS,2023,"Darker than Depeche Mode, weirder than Wednesday Addams, Rosalía and Rauw Alejandro’s “Vampiros” is 2023’s most tenderly terrifying work of gothic storytelling. Over a grotesque bass lurch, a warped choral effect, and a gravelly dembow beat that hits like clumped earth on a coffin lid, the (one-time) lovers trace a bedeviled fairy tale of late-night misadventure. The song’s wildly addictive chorus and air of doomed romance cements the duo’s place as the Serge Gainsbourg and Jane Birkin of the Rue Morgue.",Ben Cardew,86,Pitchfork,The 100 Best Songs of 2023
Skrillex / Fred again.. / Flowdan,Rumble,2023,"Skrillex is back; Skrillex never really left. Instead, he simply morphed along with each mutation of sweaty, bro-beloved electronic music—after cementing his stamp on dubstep, he pumped out tingling, EDM-infected Top 40 hits, and now he pops up at Coachella as a mediating force between Four Tet’s airy thumps and Fred again..’s sentimental bangers. After a quiet few years, Skrillex came through with two albums this year, and “Rumble” is a pyrotechnic highlight from those records—an enthusiastic return to ruckus. Veteran grime rapper Flowdan snarls between strobing bass hits. Fred again.. helps slam home effect after effect: lion roars, water plops. The beat whirrs and whirls, sounding like wind buffeting through a helicopter’s rotors. No one ever accused Skrillex of subtlety, and this is prime in-your-face fun.",Dani Blum,85,Pitchfork,The 100 Best Songs of 2023
Flo Milli,Fruit Loop,2023,"Flo Milli knows how to take the high of a sugar rush and knock a listener in the chest with it. “Fruit Loop” ramps that energy up until it snaps. She delivers simple, cutting bars like “You bitches really weak and you just talk online” and the laugh-out-loud diss “Tryna talk big but he got a lil pee-pee” with a peppy vindictiveness, like Harley Quinn faking a conversation with someone while holding a candy-coated mallet behind her back.",Dylan Green,84,Pitchfork,The 100 Best Songs of 2023
Yves Tumor,Ebony Eye,2023,"Yves Tumor’s latest album goes out ascending. Backed by triumphant strings, a propulsive “Umbrella”-esque beat, and a choir, Tumor trains their eyes to the heavens on “Ebony Eye,” the transcendent closer of Praise a Lord Who Chews… This is one of 2023’s premier shoulda-been singles—and, with good reason, Tumor’s personal favorite track on the album. Few could complain if such a grand finale suggested where this constantly shapeshifting artist is headed next.",Rich Juzwiak,83,Pitchfork,The 100 Best Songs of 2023
That Mexican OT:,Johnny Dang” [ft. Paul Wall and DRODi],2023,"That Mexican OT, a newcomer from Bay City, Texas with enough charisma to pull Houston rap-and-grill royalty Paul Wall for a guest verse, beams like a movie star in the exuberant video for “Johnny Dang,” clutching the song’s namesake jeweler like they’re brothers. What’s more, OT tells us how his Cadillac is doing jumping jacks and his semi-automatic sounds like bubble wrap. Even an eliminated opp gets a “bubble bath.” It’s all fun and games. “I’m just rhyming words, I don’t even know how to rap,” he titters, showing off his masterful, hilarious approach on the hook of this year's sunniest Southern rap confection.",Adlan Jackson,82,Pitchfork,The 100 Best Songs of 2023
Janelle Monáe,Float,2023,"“Float” embodies the kind of lightness experienced only by babies and spiritual gurus. Over a casually sublime brass backdrop that sounds like an HBCU marching band invading a luxe spa, a flirty, peacocking Janelle Monáe relishes shedding baggage and choosing a more unburdened life. If stress is a lifelong affliction, this song suggests the best recourse is to exhale, perhaps strip naked, and let those troubles roll off your bare back.",Clover Hope,81,Pitchfork,The 100 Best Songs of 2023
Overmono,Good Lies,2023,"On the title track of their debut album as Overmono, dance producers (and brothers) Tom and Ed Russell dissect and rearrange Smerz’s hallucinatory “No harm” like plastic surgeons for hire, facelifting the Norwegian duo’s murky R&B into an ecstatic festival anthem. Every inch of enigmatic unease lurking around the original vocals is shaved off, resulting in something like the soundtrack to meeting the love of your life while walking across the Williamsburg Bridge at golden hour. A clever stroke of emotional alchemy, “Good Lies” flips its source material’s defensive crouch into an airbrushed head-rush of sweet possibility.",Kieran Press-Reynolds,80,Pitchfork,The 100 Best Songs of 2023
TisaKorean,uHhH HuH.Mp3,2023,"If TisaKorean is primarily known for firing out dance rap tracks as chaotically as a toddler banging on their toy xylophone, “uHhH HuH.Mp3” stands apart for how much he actually lets the track breathe. Not that the Houston rapper is any less manic. Bouncing off a beat with all the head-knocking lurch of vintage Neptunes, he happily flaunts his influences, mixing up snap and crunk into a slurry of adlibs alongside his girlfriend Sunny Galactic. Pumping up its addictive synth hook as if he were inflating a giant balloon, “uHhH HuH.Mp3” is proof that TisaKorean doesn’t always need to disorient us into dancing—when duty calls, he can also lay down the muscle.",Sam Goldner,79,Pitchfork,The 100 Best Songs of 2023
Christine and the Queens,To be honest,2023,"On “To be honest,” Christine and the Queens scales a mountain of self-actualization, shedding earthly anxieties—heartbreak, gender dysphoria—as he ascends toward the pearly gates of enlightenment. Uplifted by swirling synths and angelic coos, he heralds a Franglais party in the clouds where vulnerabilities can be belted out and no shadow self goes without a toast. Lofty as it all sounds, “To be honest” is Chris’ easiest-to-love song in years; at its beatific apex, it practically glows from within.",Owen Myers,78,Pitchfork,The 100 Best Songs of 2023
Slowdive,kisses,2023,"Slowdive’s second post-comeback album, everything is alive, leans toward the more meditative and overcast end of the shoegaze pioneers’ aesthetic spectrum. But partway through, “kisses” punches a moon-sized hole through the haze to let all the feelings come gushing out. While this winsome indie-pop reverie may be a sonic outlier, it nonetheless complements the record’s thematic preoccupation with the passage of time. Neil Halstead and Rachel Goswell channel the rush of young romance via the music that soundtracked their youth, with crystalline Cure guitars and a chorus that would make New Order swoon in approval.",Stuart Berman,77,Pitchfork,The 100 Best Songs of 2023
Niontay,Thank Allah,2023,"The Boston Celtics, Niontay’s favorite basketball team, don’t need your approval. By the luck of the Irish and the grit of each possession, they’ll outwork and out-magic your team to victory. This is how listening to the Brooklyn-via-Kissimmee rapper’s muted opus “Thank Allah” feels: No drums, no frills, just bars and a prayer, his warm Florida flows snaking around swampy keyboard and squiggly bass. As Niontay’s dizzying verse unfurls across various plays, Irish goodbyes and trips across the map, he remains poised and cold-blooded, like a buzzer beater in slow-motion: “Get a bag and go home, nigga, it's the playoffs / Took a nigga shit, took his work, ain’t no days off.” When the drums finally kick in at the end, it’s like confetti raining down on TD Garden.",Mano Sundaresan,76,Pitchfork,The 100 Best Songs of 2023
Greg Mendez,Maria,2023,"How horrifying to realize—maybe at a party, talking to an acquaintance—that the story you’ve just decided to tell is utterly wrong for your current conversation. This is one way to understand Greg Mendez’s hauntingly beautiful “Maria,” which opens with Mendez admitting he’s afraid to “tell you about some dumb shit” before doing so anyway. As the anxious melody lurches forward against strummed guitar, Mendez gives a plainspoken revelation about the intertwined heartaches of addiction and love, and a reminder that the stories we choose to tell can say just as much about us as any particular narrative.",Marissa Lorusso,75,Pitchfork,The 100 Best Songs of 2023
Lonnie Holley,None of Us Have But a Little While,2023,"A Lonnie Holley performance, by nature, is ephemeral: The multi-disciplinary artist never plays something the same way twice, making every set a unique experience. So each of his albums is a privilege—the only way to put his moments of magic on repeat. This particular recording, from his latest LP, Oh Me Oh My, is a yearning riff on the impermanence of life itself. With a weathered voice, the 73-year-old sings of the struggles of existence and reminds us that it will be over all too soon. As Sharon Van Etten’s haunting croon harmonizes with the static of Holley’s synthesizer, they offer a gorgeous and melancholic plea to live in the moment.",Matthew Ismael Ruiz,74,Pitchfork,The 100 Best Songs of 2023
Jane Remover,Census Designated,2023,"Jane Remover has already pioneered (and moved on from) at least two digitally addled micro-genres in her short career, becoming a cult hero in certain corners of the internet while still in her teens. On “Census Designated,” the title track of her second album, the now-20-year-old gets a charge out of being young, successful, and having—or, more cynically, being—a product that everybody wants. Yet she’s also acutely aware of how dangerous show business can be for those who find early success, and the language she uses to describe herself (“barely legal,” “young blood,” “fresh meat”) is no less alarming than the hair-raising music behind it: a slow-mo explosion of glitching guitars, leading to an ending where the whole song crumples into ash.",Daniel Bromfield,73,Pitchfork,The 100 Best Songs of 2023
2HUMPY / 2RARE,2HUMPY Anthem,2023,"The Philly club rap crew 2Humpy debuted in early May with an animated On the Radar freestyle that showcased their watertight chemistry, belting punchlines and ad-libs in unison as they gathered shoulder-to-shoulder around a single mic; by Halloween, they had broken up. In between, they dropped one of the year’s most delirious party anthems. While 2023’s pop landscape was littered with half-assed rehashes of bygone hits, the group’s eponymous posse cut succeeds as an ouroboros of nostalgia, fusing flows swiped from Rob Base and DJ E-Z Rock’s “It Takes Two,” a flip of the iconic saxophone sample from Public Enemy’s “Rebel Without a Pause,” and hypnotic 808 kicks that thread two decades of Jersey and Philly club innovation together. Maybe we just didn’t deserve 2Humpy.",Jude Noel,72,Pitchfork,The 100 Best Songs of 2023
Ralphie Choo,MÁQUINA CULONA,2023,"Ralphie Choo didn’t grow up listening to pop music. The Spanish singer spent his youth surrounded by his mom’s flamenco faves, artists like Camarón de la Isla and Paco de Lucía, and these traditional influences only enhance Choo’s genre-defying style—a kaleidoscopic mix of reggaeton, hip-hop, and, yes, flamenco, which stands apart from almost everything else in Spanish-language pop right now. “MÁQUINA CULONA,” a highlight from his debut album Supernova, is a modern take on cumbia that fuses electric accordion with pulsing squelches. Choo flits between heavily Auto-Tuned vocals and softer crooning as he admires a woman’s particularly large culo. Some things never get old.",Maria Eberhart,71,Pitchfork,The 100 Best Songs of 2023
Mustafa,Name of God,2023,"The isolation of grief has a way of bringing us together in surprising ways. Toronto poet and musician Mustafa wrote “Name of God” after his brother was killed and, throughout the gentle guitar ballad, he questions his faith while finding comfort in the Sudanese-Canadian community he grew up around. The striking music video shows Mustafa riding a motorcycle in a traditional jalabiya, with the Sudanese flag flowing from his back like a cape, and the song ends with a scratchy recording of one of his cousins declaring, “I am a human and Muslim.” While this complicated ode to heritage is deeply personal, it has also moved listeners to use the video’s YouTube comments to share virtual hugs and mourn the lives lost recently in Palestine and Sudan. Its head is down, and its arms are open.",Vrinda Jagota,70,Pitchfork,The 100 Best Songs of 2023
Central Cee / Dave,Sprinter,2023,"The animating query at the center of this song is basically: How many women can you fit in a minibus? Both Dave and Central Cee have handled weightier topics, but “Sprinter” reminds us a good time doesn’t need to be deep. To a delicate strum of Spanish guitar, the silver-tongued London MCs riff on getting paid and getting girls; the lines are smart, the rizz impeccable. “Heard that girl is a gold digger,” deadpans Dave, “It can’t be true if she dated you.” “Sprinter” topped the UK charts for 10 weeks, making it the country’s longest-running No. 1 UK rap single ever. That it feels almost shrugged-off only makes its dominance that much more impressive.",Louis Pattison,69,Pitchfork,The 100 Best Songs of 2023
Blake Mills,Skeleton Is Walking,2023,"Though Blake Mills is known for his meticulousness as a songwriter, guitarist, and producer, “Skeleton Is Walking” ambles along like a spontaneous jam—and is better for it. Mills and jazz musician Chris Weisman’s textured guitar interplay casts an air of reflection throughout the slowly building track, as Mills ruminates on peacemaking, redemption, and the passage of time. It all culminates in a rare indulgence for Mills: a distorted guitar solo that would make Robert Fripp proud.",Margeaux Labat,68,Pitchfork,The 100 Best Songs of 2023
Actress,Push Power ( a 1 ),2023,"Best known for sparse, heady, and sometimes beatless compositions, vaunted English electronic producer Actress incites the dancefloor with a musical tug-of-war on “Push Power ( a 1 ).” Insistent four-on-the-floor bass hits pull at a searching piano line, while repetitive ad-libs offer enigmatic color commentary on the action. The terse vocals are hypnotic, but also lucid, crisp, and ready for the club, befitting a song that captures a cerebral standard-bearer as he gets kinetic.",Daniel Felsenthal,67,Pitchfork,The 100 Best Songs of 2023
