Artist,Song,Year,Review,Reviewer,Ranking,Source,Source Title
Rihanna,Don't Stop the Music,2008,"Thanks to its relentless build (this would be a bear to sing without overdubs-- there's barely space to take a breath) and expertly filtered scrapheap psy-trance amazingness, ""Don't Stop the Music"" probably would have been a hit in its own right, but its real masterstroke is its sneaky slipstreaming of the ""mammasaymammasaw"" bit from Michael Jackson's ""Wanna Be Starting Something"". Was there a more inspired and inexplicably happy-making sample in any other mainstream pop song this year? All in all, it helped make this one of Rihanna's finest singles-- high praise, even in her young career. -",Mark Pytlik,70,Pitchfork,The 100 Best Tracks of 2008
Portishead,The Rip,2008,"""The Rip"" seems to represent anything seductive and annihilating-- an ocean's undertow, psychological breakdown, destructive relationship, drugs, death (R.I.P. is, after all, the final rip). Recognizing a kinship in sound and sentiment, Radiohead covered the ominous dirge in concert this year. But ultimately, this is pure Portishead: Who better suited than the simultaneously cool and quavering Beth Gibbons to deliver these portentous opening lines ""She walks in the room/ Centered and tall/ Hesitates once more"" and still manage to avoid melodrama? Or carry on so elegantly after synthetic arpeggios, in a gutting seismic shift midway through the track, devour their guitar counterparts? In a(nother) year when many young bands thrifted decades-old material with déjà-vu results, the Bristol trip-hop vets were among the very few making music that sounded both right-now and 10-years-hence. -",Amy Granzin,69,Pitchfork,The 100 Best Tracks of 2008
Four Tet,Ribbons,2008,"Four Tet has always skirted the periphery of techno, but he finally jumped into the ring in 2008-- sort of. ""Ribbons"" feels more inspired by minimal techno than of a piece with it, and while I tend to remember good minimal techno tracks as evolving wholes, I think of exactly one thing when I think of ""Ribbons"". It's not the abbreviated loop slithering in the background. It's not the metastasizing percussion. It's not even the splashy theme that dominates the back half. It's that one perfect sound, a pearly trill that gives the song its mojo. Aware that he's locked onto a sublime moment, Kieran Hebdan rides it hard through enthusiastic variations-- loud and soft, fast and slow, blossoming fully and pulling up short-- and it's goosebumpy every time. -",Brian Howe,68,Pitchfork,The 100 Best Tracks of 2008
Young Jeezy [ft. Kanye West],Put On,2008,"If ""Put On"" was just a Young Jeezy track, it'd already be the best Jeezy track since at least ""Hypnotize"". Jeezy snarls hard but brings a newfound sense of style and wit to a monolithic synthetic boom from producer Drumma Boy: ""Inside fishsticks, outside tartar sauce/ Pocketful of celery, imagine what she telling me."" But then, at the 2:52 mark, Kanye shows up in full AutoTune robo-mode, moaning damaged, paranoid self-pity out of nowhere: ""You can ask Big Homey, man the top so lonely/ I'm so lonely."" It's a neck-snapping about-face, Jeezy's chest-thumping self-aggrandizement into Kanye's seething depression. But when ""Put On"" sinks in, they sound like opposite sides of the same coin: The conjoined feelings of exhilaration and doubt that come when you finally, against odds, make something of yourself. And in a car with decent speakers, this little meditation on duality sounds like the fucking apocalypse. -",Tom Breihan,67,Pitchfork,The 100 Best Tracks of 2008
Lykke Li,"Dance, Dance, Dance",2008,"Suggesting something can be so much more effective than coming right out and saying it. On this Youth Novels single Lykke Li uses movement to overcome her shyness and compensate for inability to explain herself. ""Having trouble telling how I feel,"" she sings, ""But I can dance, dance, dance."" The song's music is equally understated and demure: a sliding bassline on an acoustic guitar, some mumbling sax, eventually a few backing voices to fill in the spaces. It builds, but only a little, and even at its peak it's a long way from abandon. For a while this year I kept hoping that ""Dance, Dance, Dance"" would get a massive remix, something that gave the hypnotic repetition and Li's purring coo the surging beat they deserved. But eventually I realized that the low-key production is a virtue. Your mind fills in everything that's not there, which further reinforces the song's focus on subtle communication: ""When I'm shaking my hips, look for the swing/ The words are written in the air."" -",Mark Richardson,66,Pitchfork,The 100 Best Tracks of 2008
Max Tundra,Which Song,2008,"Normally I wouldn't gravitate towards a song that features a line like ""hopefully she'll be there when my U.S. tour is through,"" because usually it's a red flag that you're dealing with a narcissistic artist douche who can't understand why all women can't be at his beck and call. However, Max Tundra mastermind Ben Jacobs is far too neurotic and self-critical to be painted with that brush, and ""Which Song"" ends up being an affecting portrait of romantic malady. Jacobs' always-jittery music serves as an especially perfect complement to his lyrical ball of confusion, reflecting not only indecision but also his general charm in its brightly kinetic synth melodies. Max Tundra's sonics are sometimes unabashed in their cheesy cheerfulness, giving you the sense that a date with Jacobs would involve watching a lot of Saturday-morning cartoons. In which case, she ought to be waiting when he comes home from the road. -",Joshua Love,65,Pitchfork,The 100 Best Tracks of 2008
The Whitest Boy Alive,Golden Cage (Fred Falke Remix),2008,"The original 2006 version of ""Golden Cage"" was a nice, low-key piece of bummer disco, with Erlend Øye providing the wistful, murmuring vocals that dance-music enthusiasts have appreciated since his appearance on Röyksopp's ""Remind Me"". But just like that track's remix by Someone Else, where a sharp jolt of electro-house put that lonely voice into even sharper relief, Fred Falke's transformation of ""Golden Cage"" into gleaming, pristine synth-pop finds a way to make Øye's warmth even deeper. When he sings ""so of course I miss you and I miss you bad"" over Falke's production-- replete with a glowing Fender Rhodes, dubbed-out shards of Øye's minimalist-Nile Rodgers guitar line, and a melodic synth hook that circa-83 Jellybean Benitez would envy-- a lyric that originated as a resigned, moping sigh becomes one of the most affecting pleas of the year. -",Nate Patrin,64,Pitchfork,The 100 Best Tracks of 2008
The Very Best,Kamphopo,2008,"Architecture in Helsinki's ""Heart It Races"" was a song many of us enjoyed a good deal upon its release in 2007, but it's remarkable how much Esau Mwamwaya and Radioclit's ""Kamphopo""-- constructed atop that track's instrumental-- utterly shatters the original, rendering it almost child-like in comparison. But ""Heart"" provides the ideal canvas for this team to work with, and in between its clattering percussion, and buzzing, rapid-fire bass, it leaves plenty of blank space, so Radioclit's Johan Karlberg and Etienne Tron don't need to alter it much-- wisely they mostly step aside to allow Mwamwaya room to paint his stirring vocals. The singer rides the beat with ease, shifting tempo on a dime and arcing his cadence to match the timbre of the prevalent steel drum. -",Joe Colly,63,Pitchfork,The 100 Best Tracks of 2008
The Tough Alliance,Lucky,2008,"A B-Side on their ""Neo Violence"" single that began percolating back in April, ""Lucky"" saw Sweden's Tough Alliance finding traces of their own pop DNA in the deliciously obvious. Originally a European hit in 2006 by another-- though perhaps less provocative-- Swedish pop duo, Lucky Twice, the song in its first form is a carnival of synths and teen-pop. But Henning Fürst and Eric Berglund's take is surprisingly shattering, the two troublemakers slowing things down with matchlit finger-picking and love tunnel echo. Thanks to their love of bubblegum, however, all the longing and hormonal charges remain exactly where they should. Because even if the gum's a different flavor, they found a way to make its bubbles pop. -",David Bevan,62,Pitchfork,The 100 Best Tracks of 2008
Q-Tip,Gettin' Up,2008,"2008 saw little abatement of the tributes to (and resurrections of) the late James Yancey that started shortly after his 2006 passing, but this one was special: Nine years after he co-produced the last Q-Tip record, it only made sense for a Dilla beat to anchor the first single from Tip's long-awaited comeback. Q-Tip's clear-eyed enthusiasm and the pristine, pulsing soul of the beat make ""Gettin' Up"" bright and full of life, which would be encouraging enough even if it wasn't a welcome reintroduction of one of rap's most recognizable voices. And even if the romantic sentiments aren't the kinds of lyrics battle-rap aficionados might be looking for (""Move"", the other Dilla-produced track on The Renaissance, should fill that need plenty), the way Tip's flow bobs and weaves alongside those snap-tight drums and that liquid yet seismic bassline show that even in his lover-man moments the dude can still kill a beat. -",Nate Patrin,61,Pitchfork,The 100 Best Tracks of 2008
Crystal Castles,Courtship Dating,2008,"Any line about ""Courtship Dating""'s beat sounding like Timbaland on steroids seems less clever in light of…Timbaland looking like he actually is on steroids, but it still seems a more appropriate barometer for this song than another tired Atari reference. ""Courtship Dating"" swells and throbs like your thumb, post-hammer. Alice Glass's normally chirping, flighty voice roils and thwacks, wringing all of the decadence it can out of goth-y eyeliner and thrift-store leather. It'd make a better dance song if it wasn't nominally about self-mutilation in the name of l-u-v, but lusty, angry bedroom floors need rhythm too. Dance, mosh, screw, repeat. -",Andrew Gaerig,60,Pitchfork,The 100 Best Tracks of 2008
The Dodos,Fools,2008,"Sounding like they're auditioning for a spot in the Animal Collective, Dodos here build a swaying psychedelic house on a foundation of polyrhythmic West African ewe drumming. The arrangement swings back and forth between acoustic strumming and electric guitar outbursts, creating a constantly shifted backdrop for the even, melodious vocals. If all that wasn't plenty to keep you off balance, you also get sudden, rhythmic shouts to spike the rhythm in later verses, ghostly backing vocals, and an out-of-nowhere harmony vocal on the song's last note. It's enough to leave you as breathless as the drummer, and one of the most subtle and accomplished integrations of a global folk style in a year seemingly more indie bands than ever looked abroad for inspiration. -",Joe Tangari,59,Pitchfork,The 100 Best Tracks of 2008
Annie,I Know UR Girlfriend Hates Me,2008,"Yet another excellent single from the Scandinavian pop starlet with a difference (that difference being that she's never charted in America; no, whoops, it's that she's got dance and indie cred). It's an immaculately constructed bonbon of a song: Note the way the first line of the verse seems to complete the 10-bar chorus's progression, the ""ringy dingy ding"" nonsense syllables at the beginning returning for a bridge about a ringing phone (in a song with a txty ""ur"" in its title, no less), the cliché-inversion of ""life's too long for you to get it wrong"", the ingenious way every section of the song secretly harmonizes with every other section. The whole thing, in fact, is a lemon-peel twist on the I'm-hotter-than-your-girlfriend trope: What makes the girlfriend deserved to be dumped for Annie is that she's unreasonably jealous. -",Douglas Wolk,58,Pitchfork,The 100 Best Tracks of 2008
High Places,From Stardust to Sentience,2008,"Mary Pearson's vocals seem to emerge out of the ether of Rob Barber's clattering, clanking percussion. Their debut album's closing track, ""From Stardust to Sentience"", begins with some heavily phased bell tones and the distorted ticking of a cosmic clock-- yet the most striking thing about the High Places' heavily clipped and processed beats is how organic they manage to feel. ""Millions of forces of physics and providence teamed up and brought us all here,"" Pearson lilts, imbuing a spiritual sweetness to the Carl Sagan-esque thematic expansiveness of the song's title. High places indeed. -",Tyler Grisham,57,Pitchfork,The 100 Best Tracks of 2008
Vampire Weekend,Oxford Comma,2008,"""Oxford Comma"" is the pinnacle of Vampire Weekend frontman Ezra Koenig's casual vulgarities. For all of the song's idiosyncrasies-- Lil' Jon in the chorus, that line about the United Nations (building?), an implied debate about the merits of commas-in-a-series-- the song's real appeal lies in Koenig's conversational sing-song. Less about slang or pop culture references and more about meter and tone, ""Why would you lie about something dumb like that?"" is the year's best approximation of the chip that sits on every young, educated, sweatered shoulder. Kanye West may have declared himself the voice of this generation of this decade-- hell, maybe he is-- but few artists sound more like their Whole-Foods-shoppin', Red Bull-drinkin' peers than Koenig. -",Andrew Gaerig,56,Pitchfork,The 100 Best Tracks of 2008
Usher [ft. Young Jeezy],Love in This Club,2008,"As far as pick-up lines go, ""I want to make love in this club"" is about two drinks away from, ""Let's fuck in the bathroom."" But it's not about the line, it's about the delivery, and ""Love in This Club""'s delivery is impeccable. Just he like did on Ciara's ""Promise"", producer Polow da Don creates a musical backdrop that sounds like it's in slow motion, this time thanks to a stuttering synth figure that hangs behind the beat. Like the musical equivalent of a disco ball, the song is shimmering and seemingly suspended in mid-air. For four and a half minutes, Usher almost makes it seem not ridiculous to ""get undressed right here,"" and what higher goal is there for R&B than to make the ridiculous sublime? -",Dave Maher,55,Pitchfork,The 100 Best Tracks of 2008
Lykke Li,Little Bit,2008,"A shy-voiced Scandinavian pop songstress? Our hearts have been stolen before. With debut album Youth Novels and seamless live shows, Lykke Li showed she was for real, but it was ""Little Bit"" (originally from last year's Little Bit EP) that suggested she could be more than another stranger in the night. If you haven't had your ""I Think I Love You"" moment with this song yet-- if maybe Li's vulnerable/eccentric persona reads too much like shtick for stoking feverish blogger-boy fantasies-- listen again. Producer Björn Yttling, of Peter Bjorn and John, does a lot with a little (bit): steel pan-like percussion, mandolin, a gently distorted beat. Li's voice, like a meaningful whisper in a mostly vacant room, completes the seduction; she barely needs words to get from ""too proud for love"" to jumping off cliffs for it. Ooh, ooh, la-la-la-la: Let's forget about our tainted hearts. -",Marc Hogan,54,Pitchfork,The 100 Best Tracks of 2008
Be Your Own Pet,Becky,2008,"""Becky"" is a fun and infectious grrl-powered story of teenage jealousy and revenge that ends in ass-kicking and murder. As the boys in the band rev up the engine and run a comb through their pomade, Jemina Pearl belts out the sordid details of this best-friend breakup as only she can. However, when she hollers about her former friend making a friendship bracelet for Becky Facelift, or demands that borrowed clothes be returned (""no bullshit""), there's actually a hint of sadness behind her angry glee that humanizes her song-long fit. Unfortunately, this song's probably best-known for getting booted (along with two other tracks) from the U.S. version of Get Awkward because of ""violent"" content concerns. That the offending tracks were repackaged as a stand-alone EP not three months later isn't the worst part. The real tragedy is that the EP featuring ""Becky"" was the final Be Your Own Pet release. -",David Raposa,53,Pitchfork,The 100 Best Tracks of 2008
Ricardo Villalobos,Enfants (Chants),2008,"Having inaugurated his first label, the vinyl-only Sei Es Drum, with selections from his Fabric mix, Ricardo Villalobos chose one hell of a follow-up. ""Enfants"" was essentially an extended edit of the introduction to ""Baba Yaga La Sorciere"", Chrisitan Vander's 1995 recreation of his group Magma's Mekanïk Destruktïw Kommandöh, from 1973. But Villalobos' mildly accelerated loop-- a chugging piano line recalling Nina Simone's ""Sinnerman"" and a children's choir that sounds like the Langley Schools Project speaking in tongues-- somehow captured the Zeitgeist. Whether heard amidst the throng at DC-10 or accessed via YouTube while reading interminable blog posts about the future of dance music, the song's combination of innocence and melancholy was just the reality check needed. -",Philip Sherburne,52,Pitchfork,The 100 Best Tracks of 2008
TV on the Radio,Golden Age,2008,"No American band has captured the tension, fear, and defeatism of the Dubya era as vividly as TV on the Radio, so when ""Golden Age"" was first unveiled on the band's website this past summer, it provided an exhilarating reintroduction to a group for whom Election Day couldn't come fast enough. Never mind ""Yes We Can""; ""Golden Age"" was the true theme song for the season of Obama, the taut robo-funk groove and increasingly anxious vocal from Kyp Malone mirroring our collective pre-election jitters and anticipation, before the song's victorious, cloud-parting chorus-- complete with heaven-bound harmonies and brass fanfares-- gets the party started in earnest. And of course it helped that, for all of the band's previous experiments with texture and rhythm, this was the first TV on the Radio song you could actually dance to. -",Stuart Berman,51,Pitchfork,The 100 Best Tracks of 2008
Invisible Conga People,Cable Dazed,2008,"The music on Mike Simonetti's Italians Do It Better label has always had a spectral quality, but on their debut single Invisible Conga People may as well be conducting a séance. Their expansive kraut-disco grooves act as a medium for a host of eerie stylistic visitations: We hear bleached Chic guitar scratch and gently disintegrating synths weaving in and out of hushed, reverent close harmony vocals, like Low offering a tribute to Visage's ""Fade to Grey"". Halfway through, everything drops away other than a lugubrious keyboard loop and a distant train rattle, and for a moment you feel an icy hand on your shoulder. Then the ghosts move on, the fade-in of a sullen one-note bass pulse and hissing techno hi-hats signaling the arrival of yet more uninvited guests. It's dance music, but you don't dare move a muscle. -",Tim Finney,50,Pitchfork,The 100 Best Tracks of 2008
Jay Reatard,Always Wanting More,2008,"Having released and compiled two-dozen singles this year, much of the trouble wasn't in finding Reatard's jams, but picking a favorite. Motored by a typically Reatard-ian (read: zippy) running time of just two minutes and change, ""Always Wanting More"" felt more brawny and colossal than the rest of his pop-punk progeny. It arrives on the back of another mighty riff, but the monster chorus seems to explain the Memphis singer's recent sonic shift-- it sounds like he's gnashing his teeth at the punk scene he's left behind. -",David Bevan,49,Pitchfork,The 100 Best Tracks of 2008
Spiritualized,Soul on Fire,2008,"Whether coaxing drone rock from Spacemen 3 or combining all manner of strings, electronics, horns, and choirs in Spiritualized, Jason Pierce has long aimed for grandiosity. But, both to his bands' payoff and detriment, the restless experimenter's intentions often distract from the song itself, either by layering too many sounds in too small a space or distending the action into tedium. But ""Soul on Fire""-- the pop gem Pierce nearly cut from Spiritualized's sixth album, Songs in A&E, because it seemed too catchy-- makes good on magnitude with newfound concision. In four minutes, we get it all: strings that sweep, guitars that snarl, drums that swing, and a choir that drives yet another resplendent Pierce chorus straight into memory. And that the hook's plea for immortality (""I've got a hurricane inside my veins/ And I want to stay forever"") comes from the man who almost died while writing this album only reinforces its majesty. -",Grayson Currin,48,Pitchfork,The 100 Best Tracks of 2008
Alphabeat,Fascination,2008,"You'll hate this song: ""Fascination"" comes straight from Patrick Bateman's guidebook to great pop, its manicured and springloaded mid-1980s pop-rock groove falling somewhere between ""Footloose"" and Huey Lewis & the News, shot through with euphoric perkiness. ""Passion is our passion,"" the punchably sincere boy/girl vocals squeal, before launching into skyscraping woah-ohs that light up like a garish shop display at Christmas.You'll love this song: no tune this year parades its pop craft so openly and gleefully, or puts so much on the line in the name of pure giddiness. Danish group Alphabeat know you want to hit them, but they don't flinch: They're confident that by the time they reach the end of their interminable but brilliant ""The word is on your lips/ Say the word!"" call and response, the hand that was raised to smack will have turned itself into an enthusiastic fist-pump. -",Tim Finney,47,Pitchfork,The 100 Best Tracks of 2008
M83,Graveyard Girl,2008,"Being a teenager sucks. You hate everybody. Nobody gets you. You want to die. Yet through the magic of florid melodies and sweet, rushing guitars, M83's Anthony Gonzalez makes the teen years seem idyllic, a time in life when all emotion is pure and beautiful. ""Graveyard Girl"" is a tale of a young goth who ""collects crowns made of black roses, but her heart is made of bubble gum."" When the stadium-rock drums and widescreen synths stop to make way for Morgan Kibby's mid-song monologue, and she whispers, ""I'm 15 years old and I feel it's already too late to live. Don't you?"", what former misfit couldn't relate? It's melodramatic, overblown, and even a little bit silly. But then again, so is high school. -",Amy Phillips,46,Pitchfork,The 100 Best Tracks of 2008
Antony and the Johnsons,Shake That Devil,2008,"On ""Shake That Devil"", Antony Hegarty's piano falls silent to make way for a cavernous drones-and-drums arrangement; it's leaner and tauter than anything he's done before. Gone, too, are his jazzy cabaret inclinations; this free-form jag of energy has more in common with Xiu Xiu than Nina Simone. But in other ways, it's textbook Antony. It's an especially intimate song by a musician known for them, so intense and quiet during its simmering build-up that you can hear salivary noises as he sings. And as always, he's hell-bent on self-actualization. He calls upon his malevolent spirits-- a dog, a bird, a pig-- isolating each in its own tense verse. Then he gathers them all up and flings them out in raucous gospel climax. The verses are identical, yet the tone of the music and Antony's singing changes them immensely-- a fearful prayer suddenly becomes a fearless exorcism. -",Brian Howe,45,Pitchfork,The 100 Best Tracks of 2008
Hot Chip,One Pure Thought,2008,"The problem with clever is that it can be cold. And the risk of pastiche, particularly on Hot Chip's ambitious scale, is joyless, overintellectualized calculation. But ""One Pure Thought"" blithely breezes by both roadblocks, cycling through rawk riffs, glassy analog synth, smooth beats, and a flipbook of neon new wave poses to arrive at its joyful destination. Leaning on the groan-inducing conceit of ""it was only a dream,"" the band nonsenses its way through forests and rail stations, namechecking both the cool (Chic guitarist/disco hero Nile Rogers) and the un- (the much-maligned Macarena) in pursuit of that elusive state of being. Eliminate thought from this equation: It's all about that catchy killer chorus and the way it makes you feel. -",Amy Granzin,44,Pitchfork,The 100 Best Tracks of 2008
Kelley Polar,Entropy Reigns (In the Celestial City),2008,"Kelley Polar's new-agey second record, I Need You to Hold on While the Sky Is Falling, left a lot of people cold, other than the zippy ""Entropy Reigns (In the Celestial City)""-- its most accessible and translatable moment. Earlier this year, I exuberantly compared this boy/girl duet to Human League's ""Don't You Want Me"" and it still feels cut from the same cloth. Between the syrupy strings, winding vocal melodies, frosty drum claps, and that big, straining chorus, ""Entropy Reigns"" hangs together perfectly. It's probably a stretch to hope that someone as academic and as art-minded as Polar would ever care to make overtures to the mainstream, but this is proof that if he ever decided to, he wouldn't be lacking for tunes. -",Mark Pytlik,43,Pitchfork,The 100 Best Tracks of 2008
