Artist,Song,Year,Review,Reviewer,Ranking,Source,Source Title
Jamila Woods,Tiny Garden,2023,"Jamila Woods finds abundance in humility and incremental growth on “Tiny Garden.” Despite confessing her “iceberg heart,” the Chicago R&B auteur embraces self-discovery as she digs into a burgeoning relationship. “It’s gonna be a tiny garden, but I feed it every day,” she sings. When she shifts into the chorus, a cushy pad of bass blooms behind her, and melodic dapples of keys peek through the mix like rays of late-afternoon sun. New York singer-songwriter duendita’s guest verse, which recalls the encouragements of Des’ree’s “You Gotta Be,” adds another tender layer to the track. “Tiny Garden” celebrates the heart as a place where wild and beautiful feelings can thrive, as long as it’s tended to with care.",Allison Hussey,66,Pitchfork,The 100 Best Songs of 2023
AyooLii,Shmackin Town,2023,"Rambunctious Milwaukee rapper AyooLii’s catalog is vast, including over 150 YouTube uploads in 2023 alone, but one thing is clear across his many, many songs: He wants everyone to know he’s got jokes. “Shmackin Town” feels like a tossed-off gag brought to life, as it flips Lipps Inc.’s wedding-reception staple “Funkytown” into an absurdist celebration of AyooLii’s hometown sound. Producer 2PHONENOAH adds the booming bass and four-on-the-floor beat that are everywhere in Milwaukee, while AyooLii rattles off one-liners about girls whose butt lifts he paid for—one because her booty was flat, and another because her booty was fat.",Shy Thompson,65,Pitchfork,The 100 Best Songs of 2023
Kali Uchis,Moonlight,2023,"With an extraterrestrial’s sense of discovery, Kali Uchis notes that love between two human beings can be so wonderful all across her third album, Red Moon in Venus. She sings of messy sheets and spilled wine in a fluttery rasp that suggests deserved exhaustion. And on “Moonlight,” the Colombian-American artist hones her R&B credentials, slipping into Spanish to share her dirtiest thoughts. She wants to get high with her lover? Sure, why not. With a bassline that undulates like a waterbed, Uchis looks in the mirror and imagines what could be.",Alfred Soto,64,Pitchfork,The 100 Best Songs of 2023
SZA,Blind,2023,"SZA is the poet laureate of love’s excruciating complications, and “Blind” is packed with the kind of searingly uncomfortable truths about damaged relationships that have inhabited an entire generation’s consciousness. Every painful admission of sexual desire, emotional deficiency, and romantic suffering is compounded by the cherubic plucking of a harp or a soul-severing string crescendo. When she raps, you can feel her claws protracting, muscles tightening in defense against the man coming for her heart. But her sung falsettos bear the ache of someone undone by their own needfulness. When your pussy precedes you, and your past can’t escape you, you don’t always know how to honor the love that resides in you. “Blind” dreams of security and self-assurance, but as bell hooks says, even radical love offers no place of safety.",Isabelia Herrera,63,Pitchfork,The 100 Best Songs of 2023
Jess Williamson,Hunter,2023,"On “Hunter,” a song about the indignities of dating as a newly single person in a big city, Jess Williamson memorably declares that her love is “honest as an ashtray.” The simile is a puzzle, something to be pondered over repeated listens, but on a gut level it also just rings true. This is how Williamson’s music works. A native Texan who embraced her twang after moving to the West Coast, she writes songs not to tell us something, but to figure something out about herself—in this case, how a discouraging experience can sharpen her resolve: “I’m a hunter for the real thing,” she sings, resolutely.",Stephen Deusner,62,Pitchfork,The 100 Best Songs of 2023
Danny Brown / JPEGMAFIA,Fentanyl Tester,2023,"Picture this: You’re cutting it up on the dancefloor when you realize—all too late—that you’ve been too indiscriminate in your drug use. Reality glitches. Time goes non-linear. Your fun night out is suddenly about to become a wild, white-knuckle ride into the abyss. “Fentanyl Tester” exists in the queasy, amphetamine-fuelled delirium of that moment. JPEGMAFIA layers subterranean bass and frenetic drum breaks over chopped-up, helium-speed samples of Kelis’ “Milkshake,” marrying the velocity of ’90s jungle with hyperpop’s ADHD whiplash. He and Danny Brown trade frantic bars about Molly and Marmaduke, the words tumbling out so fast you can barely parse them. There’s no respite, no empty spaces to catch your breath. All you can do is hang on and hope you make it to the other side in one piece.",Bhanuj Kappal,61,Pitchfork,The 100 Best Songs of 2023
Caroline Polachek,Pretty in Possible,2023,"Amid the deep yearning and conceptual romance of Desire, I Want to Turn Into You, “Pretty in Possible” throws meaning to the wayside, choosing abstraction to summon the unpredictability of love. Caroline Polachek free-flows over a shuffling breakbeat, channeling the vocal stylings of Imogen Heap and Suzanne Vega, along with the cinematic strings of Massive Attack. She takes us through the bustling streets of her mind, slipping past volcanoes, blood, and drowning insects. It’s a trip that’s as intoxicating as it is confounding.",Margeaux Labat,60,Pitchfork,The 100 Best Songs of 2023
Feist,Love Who We Are Meant To,2023,"Leslie Feist’s sixth album, Multitudes, functions as a series of permission slips to be whatever we are—sad, strange, content, alone, engaged, anything, nothing. Though she addresses “Love Who We Are Meant To” to an unnamed “you,” she sings it like a note to self, a reminder that it is better to be herself without the man who has left than to be disingenuous with him. Yes, they will see one another again, and she will surely run amok with feelings when they do—her voice is so careful here, over delicate fingerpicking and gossamer strings, that it suggests a dam straining to hold back a flood. But that’s OK, because it’s who she is right now.",Grayson Haver Currin,59,Pitchfork,The 100 Best Songs of 2023
Octo Octa,Late Night Love,2023,"For the chronically anxious, thumping beats and writhing bodies can present an obstacle to transcendence, not a path to it. But for Octo Octa, who has been open about her own anxiety, the dancefloor is a balm. Her greatest skill as a producer is welcoming clubgoers of all dispositions into its communal space, and “Late Night Love” perfects her inviting style of house. A throbbing bass lures everyone onto the floor and a pounding kick drum keeps them there for the 12-minute ride, until celestial synths reveal their destination: not forward to the end of a sweaty night, but upward to an ecstatic climax. Octo Octa clears the way—all that’s left to do is ascend.",Matthew Blackwell,58,Pitchfork,The 100 Best Songs of 2023
NOIA,eclipse de amor,2023,"“eclipse de amor” is fundamentally a bolero, and the Spanish electronic pop artist NOIA and Raquel Berrios of Buscabulla devastate as they grieve a love. Their vocals reflect this doomed affair’s impermanence; both singers navigate precise melodic lines, ending in trills that fray the melody thin. NOIA’s production makes the song modern, as horror-trailer SFX, sci-fi-console error pings, and a dembow riddim that bangs like a failing hard drive heighten the emotional wreckage.",Katherine St. Asaph,57,Pitchfork,The 100 Best Songs of 2023
Charli XCX,Speed Drive,2023,"“Speed Drive” flips Toni Basil’s pining cheerleader relic “Hey Mickey” on its head: Charli XCX wouldn’t dream of begging for a boy’s attention—this passenger princess only has eyes for the girl in the driver’s seat. Her bubblegum Barbie cut, which also samples Robyn’s “Cobrastyle,” is as light and fizzy as pink champagne as it celebrates young women’s vanity and intellect. (Charli shouts out both model Devon Lee Carlson and Enlightenment philosopher Voltaire on the song.) It’s the greatest celebration of love and friendship between thrill-seeking female motorists since Thelma & Louise.",Peyton Thomas,56,Pitchfork,The 100 Best Songs of 2023
Little Simz,Gorilla,2023,"Plenty of rappers can string together a mythmaking verse, but truly selling it takes the kind of swagger you can’t teach. On “Gorilla,” Little Simz exudes a detached cool, rapping with uncommon confidence. A horn fanfare builds hype—you can imagine Simz standing stone-faced, shouldering a championship belt—before shifting into a face-scrunching groove. It’s the type of classic bassline-and-breakbeat hip-hop that’s aged as beautifully as practical film effects. Simz oozes into the pocket, side-eyeing lesser rappers and fairweather fans when she’s not boasting about the depth of her skills and the futility of challenging them. She’s unbothered and in her lane, offering a masterclass in the subtle art of talking that shit.",Dash Lewis,55,Pitchfork,The 100 Best Songs of 2023
Chappell Roan,Red Wine Supernova,2023,"The entire history of pop music is built on songwriters dreaming up poetic ways to convince hot people to sleep with them. Chappell Roan has no time for that. “You just told me/Want me to fuck you/Baby I will ’cause I really want to,” is just one of many delightfully direct come-ons peppering “Red Wine Supernova,” a horny, Sapphic highlight from her debut album, The Rise and Fall of a Midwest Princess. Over strutting synth-pop, Roan showers the girl of her dreams in singalong hooks tailor-made for drunken karaoke nights. Subtlety is, like, so overrated.",Amy Phillips,54,Pitchfork,The 100 Best Songs of 2023
The Smile,Bending Hectic,2023,"The beauty of the slow-growing “Bending Hectic” is wrapped up in how Jonny Greenwood, Thom Yorke, and Tom Skinner make death and power seem equally, lavishly seductive. Is the song’s “vintage soft-top from the ’60s” careening off an Italian mountainside the hell-bound chariot of a doomed couple—or the last vestige of status belonging to a disgraced fat cat who’s going out swinging? It’s all rendered with such delicate romance. The way Greenwood’s arpeggios bend upward at the end of every line in the first half evokes the intoxication of a lover’s touch; Skinner’s drumming feels more like the fluttering of cilia. These airborne qualities parachute your heart up to your throat even before the terminal velocity of Yorke’s guitar, gnarled and striated as an ancient oak, signals absolution—or damnation.",Laura Snapes,53,Pitchfork,The 100 Best Songs of 2023
Olivia Rodrigo,vampire,2023,"Olivia Rodrigo introduced her second album, GUTS, with a ballad-as-exorcism, her narrator shaking a past self free from an older partner’s sordid illusions. “vampire” pinballs between liberation, relitigation, and self-scrutiny, each verse a study in contrast: front-loaded with giddy, urgent exposition—the fucked-up thrills and diamond nights that he deluded her into viewing as a “forbidden paradise”—before recoiling into rueful couplets surveying the emotional damage. As on “drivers license,” Rodrigo vaults into an incendiary bridge, this time hinting at an appetite for revenge. But just as she seems primed for a scorched-earth assault, she reasserts control: The curtain drops, the music stops, and the fantasies created by this “fame fucker” finally shatter.",Jazz Monroe,52,Pitchfork,The 100 Best Songs of 2023
Aphex Twin,Blackbox Life Recorder 21f,2023,"Aphex Twin’s first song in five years hums with gentle nostalgia, blurring at the edges like a happy memory that’s fading away. Dedicated to his late parents, “Blackbox Life Recorder 21f” begins mellow and summery, with much of the warmth and comfort of 2014’s Syro, seen through a softer filter. The bob-and-weave drum programming counters pretty synth melodies that float like celestial bodies. More elements eventually get stacked on—punchy breakbeats, crash cymbals in clusters—but the sentimentality at its core can’t be obscured.",Dean Van Nguyen,51,Pitchfork,The 100 Best Songs of 2023
Carly Rae Jepsen,Psychedelic Switch,2023,"You’d be forgiven if you thought Daft Punk reunited to produce “Psychedelic Switch,” the latest in Carly Rae Jepsen's growing collection of A-side-worthy B-sides. With synths strobing like Rainbow Road (or, you know, “One More Time”), Jepsen rides a euphoric ’70s bassline all the way to French-touch nirvana. As ever, the Canadian pop star is relatively coy about her desires, but it’s still charming to hear her “puttin’ on the ritz,” as she frames it, in 2023. You get the sense that even if her proverbial switch flips back off, this fleeting crush was worth the high.",Peyton Toups,50,Pitchfork,The 100 Best Songs of 2023
Sampha,Spirit 2.0,2023,"The lead single from Sampha’s follow-up to 2017’s Process, “Spirit 2.0” is an airy journey toward enlightenment in which the singer finds transcendence in himself and his community. Starting with piano chords and arpeggiating Moog synths, the song swells into something luxurious but still light on its feet, as Sampha begins to effortlessly float over nimble percussion and sweeping strings. Switching flows and drawing out lines about “drifting into open skies,” he sounds freer than ever before.",Hannah Jocelyn,49,Pitchfork,The 100 Best Songs of 2023
Pangaea,Installation,2023,"A decade and change since the electronic producer Pangaea pulped UK clubland’s collective brain with the diced syllables and drunken percussion of “Hex,” he repeated the feat—but sweeter, sexier this time—with “Installation.” The tongue-juggling vocal chops are still front-and-center, but where “Hex” swirled around drum hits that seemed to disintegrate just as they reached your ears, “Installation” pumps a full-blooded Jersey house bounce through bubblegum-pop framing and demands a singalong—even if you’ve got no idea what the words are. I’m going with “eso es,” or Spanish for, “That’s it!”",Will Pritchard,48,Pitchfork,The 100 Best Songs of 2023
Armand Hammer,The Gods Must Be Crazy,2023,"On We Buy Diabetic Test Strips, Armand Hammer’s constantly molting new album, phones are always intruding into the songs: landlines crackle and die, calls are blocked or dropped, and Siri is a harbinger of death. El-P’s beat for “The Gods Must Be Crazy” sounds like the uneasy fusion of data and flesh—in this case, human voices stripped from their bodies and collapsed into a rhythm that could double as a ringtone. Elucid and billy woods write about the fraught interconnectivity this motif suggests, the former wielding Xeroxed visas while the latter inches “to the edge of Earth/Sunburnt—black as Pompeii.” When woods later raps about “overlapping Venn diagrams overlapping,” the tenuousness of those connections is laid bare.",Paul A. Thompson,47,Pitchfork,The 100 Best Songs of 2023
Tinashe,Needs,2023,"Sometimes, you just need dick. Tinashe doesn’t play coy about what she wants from a man on “Needs,” the no-frills, sex-positive standout from this year’s BB/ANG3L EP. Especially when coupled with a dynamic video full of freewheeling grocery-store choreography, the alt-R&B artist’s confidence in collecting simps is infectious. Reinforcing the idea that everyone has a reason to get some, “Needs” is ready to turn any Hinge-prone loner into a gleeful one-night stand.",Peyton Toups,46,Pitchfork,The 100 Best Songs of 2023
Indigo De Souza,Younger & Dumber,2023,"“Younger & Dumber” is a crowning anthem for empaths everywhere. Over chalky pedal steel and piano drenched in reverb, North Carolina indie rocker Indigo De Souza looks back on her own knotted history with glassy eyes. She appears reluctant to share at first, but then pushes to a desperate scream at the song’s climax. For De Souza, love of self offers more than a comforting embrace: It sits deep within bones, and when it leaves, it does so in a violent rush.",Rachel Saywitz,45,Pitchfork,The 100 Best Songs of 2023
DJ Koze,Blissda,2023,"DJ Koze is widely hailed for the flashy eclecticism of his studio albums, but he’s also an ace club DJ, and “Blissda” distills the empathic bliss of his dancefloor genius into six heavenly minutes. It’s a dreaming deep-house moonrise: The melody drips like mercury falling from a dropper as it coats a slanting contraption of knocks, claps, and cymbals. The bass is more of a presence than a proper line, burning in smudge pots somewhere nearby. The perfectly titled track turns catharsis into a container—a little eternity in a chilled bottle.",Brian Howe,44,Pitchfork,The 100 Best Songs of 2023
MIKE / Wiki / The Alchemist,Mayors a Cop,2023,"The mayor of New York is a cop—an incontrovertible fact with damning implications. Rather than belabor the premise, NYC loyalists Wiki and MIKE use it to frame an experiential dialogue. Conditions include sweltering heat and slushy cold, skyrocketing rents and crumbling infrastructure; hemmed in on all sides, the rappers are left to assert their own personhood. “Mayors a Cop” is at once deliberate and meandering, with Wiki and MIKE exchanging wordy, emotive bars. Alchemist’s swirling horns evoke a military roll call, but the leaden tempo and muffled snare expose it for what it really is: a funeral dirge.",Pete Tosiello,43,Pitchfork,The 100 Best Songs of 2023
Blonde Redhead,Snowman,2023,"On the opener to Blonde Redhead’s first album in nine years, the dream-pop band remains as sly and playful with language as ever. A workmanlike beat lays the foundation for an elliptical chorus: “So like a no man that you are,” recites Amedeo Pace, the phrase later dissolving into the titular word. The music suggests a false sense of contentment: There are coos and yelps and beautiful harmonies, but any tenderness soon starts to feel mechanical. Love, the band implies, can leave you mired in doubt and insecurity—the elegant groove that keeps “Snowman” trudging along is ultimately the sound of stasis.",Joshua Minsoo Kim,42,Pitchfork,The 100 Best Songs of 2023
Kylie Minogue,Padam Padam,2023,"“We don’t need to use our words,” Kylie Minogue reminds us near the end of “Padam Padam.” The Australian pop lifer has long been an expert at the non- or barely-verbal: the la la la of “Can’t Get You Out of My Head,” the yeah yeah yeah of “All the Lovers.” And she just knew this heartless year called for more hearty onomatopoeia. Pumped up by producer Lostboy’s thumping bass and engorged whooshes, Kylie didn’t just give the gays and girlies a new pop standard, she gave us a secret code. We hear it and we know. Padam.",Jesse Dorris,41,Pitchfork,The 100 Best Songs of 2023
"Mandy, Indiana",Pinking Shears,2023,"“Pinking Shears” rattles with post-apocalyptic, post-punk aggression, but more than anything, Mandy, Indiana frontwoman Valentine Caulfield is exhausted. “J'suis fatiguée tu sais pas c'que j'suis fatiguée"" (“I'm tired, you don't know how tired I am”) she declares, full of despair, as she rails against militaries, corrupt politicians, and nations that allow refugees to die in unheated buildings. The Manchester band’s music unfolds piece by unnerving piece, mirroring Caulfield’s fatalistic cry into the void: unsettling electronic percussion interlocks with live drums before descending into sheets of seething, inhuman noise.",Zhenzhen Yu,40,Pitchfork,The 100 Best Songs of 2023
Kara Jackson,dickhead blues,2023,"Chicago singer-songwriter Kara Jackson spends most of “dickhead blues” sounding exasperated—that’s what dealing with an endless stream of, as she puts it, “losers who find themselves losing me” will do to a person. But it’s not about them. It’s about Jackson proclaiming her self-worth in the wake of so much nonsense. She wields her voice forcefully, first to hypnotize you, and then to slap you across the face with lucidity. “I am pretty top-notch,” she concludes, slowly and steadily learning to live for herself.",Jaeden Pinder,39,Pitchfork,The 100 Best Songs of 2023
Hudson Mohawke / Nikki Nair,Set the Roof,2023,"In a year when many DJs reached for edits of Y2K-era chart pop by the likes of Britney, Vengaboys, and t.A.T.u. whenever they needed to energize the dancefloor, Scottish vet Hudson Mohawke and Atlanta upstart Nikki Nair proved that an original banger could still take the club by storm. An irreverent continuation of dance music’s long-running transatlantic conversation, “Set the Roof” joyfully sits somewhere between UK garage and hip-house. But it’s the chipmunked vocals of Tayla Parx, whose sassy delivery recalls the days when Rye Rye was the hottest thing on the Hollerboard, that make the track such a sugary delight: Her maniacally looped phrasing can and will unlock the serotonin pathways of every raver in earshot.",Shawn Reynaldo,38,Pitchfork,The 100 Best Songs of 2023
Joanna Sternberg,I’ve Got Me,2023,"Joanna Sternberg’s lamblike voice and air of cartoonish innocence may make their deeply felt songs seem lighter than they are at first, but that impression doesn’t last long. Desolation and quaintness coexist in “I’ve Got Me,” a jaunty ode to the relationships we have with ourselves. Its meaning is dependent on the emotional contours of those fraught bonds: Depending on the listener, the opening lines—“I’ve got me in the morning, I’ve got me in the evening”—could either be taken as a salve or a cause for concern. No matter who enters or departs your life, you’ll never be apart from yourself. And how comforting, or terrifying, is that?",Emma Madden,37,Pitchfork,The 100 Best Songs of 2023
BAMBII,WICKED GYAL,2023,"Over the past decade, the Toronto DJ BAMBII has brought a boundaryless, utopian spirit to her Jerk raves, smoothly merging club music with the cultures of the Caribbean diaspora. “WICKED GYAL,” from her debut EP, Infinity Club, furthers this concept, as UK MC Lady Lykez spits Jamaican patois over wobbly synths and skittering beats. Providing fair warning for her unruly behavior, Lykez belches into the mic and cautions that, with one wrong move, her hands might end up around your throat. The dancefloor beckons, but when she gets twisted, “anything goes.”",Jesse Locke,36,Pitchfork,The 100 Best Songs of 2023
Julie Byrne,Moonless,2023,"Julie Byrne’s “Moonless” is a staggering breakup ballad furnished with sparse, impressionistic details: an old hotel, smoke curling toward the ceiling, sea and sky blurring together in the night. By eschewing a straightforward narrative, “Moonless” captures the more ambiguous ways that a relationship erodes: What does the story matter, she asks, if absence looms so large? Set against a wandering piano melody and windswept strings, Byrne’s voice builds towards a quietly forceful declaration of autonomy: “I’m not waiting for your love.” It’s a reminder that from the ruins emerges a chance to rebuild.",Quinn Moreland,35,Pitchfork,The 100 Best Songs of 2023
yeule,x w x,2023,"yeule launches into their rock-star salvo softscars by tearing themselves apart from the inside out, like an Alien chestburster. Fusing their overtly digital sound with an affinity for ’90s alternative hooks and guitars, they expel their self-destructive habits—retail therapy, drug-induced numbness—with one of the most guttural, cleansing screams heard on record this year. It’s a nuclear kind of catharsis.",Jaeden Pinder,34,Pitchfork,The 100 Best Songs of 2023
Yaeji,For Granted,2023,"All the way back to her debut 2017 EP, Yaeji projected presence with a hush—singing soft enough that the listener had little choice but to draw close. That same miniaturism leads off “For Granted,” as she half-whispers in English and Korean atop an elastic downtempo beat, with zero foreshadowing of anything untoward. But then: Years of probing doubt and gritted-teeth gratitude finally detonate, unleashing a cyclonic intensity that hurtles past breakbeat pop toward breakcore outright. Even while swinging anthropomorphic hammers overhead, Yaeji remains unflappable, her liquid intonation rising above the squall: “Let it floo-o-ow.” And how.",Gabriel Szatan,33,Pitchfork,The 100 Best Songs of 2023
boygenius,Not Strong Enough,2023,"On “Not Strong Enough,” boygenius adopt the energy of Vacation Bible School dropouts who now find themselves wandering into random churches. Straddling the line between self-contempt and weaponized incompetence, they describe rotting away in their bedrooms and cowering from the people they love; they harmonize as though seeking courage from a higher power, giving the acoustic track the feel of a worship song. Near the end, Lucy Dacus beams through the melancholia: “I think I’ve been having revelations,” she exclaims, her rich vocals sounding like salvation amid an unrelenting universe.",Heven Haile,32,Pitchfork,The 100 Best Songs of 2023
Jim Legxacy,old place,2023,"Here we have an incredible feat of alchemy that fuses seemingly every single one of London rapper-singer-producer Jim Legxacy’s disparate interests into 98 seconds of sublime pop music. “old place” feels like scrolling through a Zoomer’s TikTok feed: second-wave emo revivalism sits side-by-side with UK drill, Jersey club, and heartfelt R&B. The magic is in how effortlessly the song blends these sounds into an irresistible whole in service of Legxacy’s wistful nostalgia. “I know I probably shouldn’t take you back,” he croons at the outset, setting the clear-eyed yet lovelorn tone. In all, it proves that musical omnivorousness and efficient songwriting aren’t mutually exclusive.",Mehan Jayasuriya,31,Pitchfork,The 100 Best Songs of 2023
