Artist,Song,Year,Review,Reviewer,Ranking,Source,Source Title
Nick Cave and the Bad Seeds,"Dig!!! Lazarus, Dig!!!",2008,"In the gospel according to John, Lazarus is raised from the dead after four days spent moldering in the grave. And in Nick Cave's wry and wicked update ""Dig!!! Lazarus, Dig!!!"" it is all downhill from there. Returned to life and transported to America, Lazarus careens through a world of sex, fame, and weapons as Cave bears bemused witness, chronicling a journey that leads inevitably to ""prison, then the madhouse, then the grave."" Clearly reinvigorated by his raucous Grinderman side project, Cave is here joined by the Bad Seeds in a stripped-down garage rock mode, with multi-instrumentalist Warren Ellis punctuating Lazarus' tale with all manner of noises and back-alley sound effects. And lest it might appear that Cave is enjoying Lazarus' downfall a bit too much, he does offer up one final head-shaking ""Oh, poor Larry!"" as the Bad Seeds escort him from the scene, another valuable lesson apparently learned. -",Matthew Murphy,42,Pitchfork,The 100 Best Tracks of 2008
No Age,Sleeper Hold,2008,"Like Dinosaur Jr.'s ""Freak Scene"" with the slacker mope washed away, ""Sleeper Hold"" is an intoxicating mix of hurry up and wait, showcasing No Age's ability to make a song ebb and flow while never actually taking their feet off the gas. Many of Dean Spunt's lines here start with the phrase ""with passion,"" and that's key-- he and Randy Randall's belief in the urgency of what they're playing transforms the song from floating rave-up into chaotic bliss. It helps that No Age sound larger than life, like two guys in a tiny garage doing the work of five on a huge stage. But the magic of ""Sleeper Hold"" lies in the way the duo's frantic rushes and pregnant pauses sound like identical sides of the same coin. -",Marc Masters,41,Pitchfork,The 100 Best Tracks of 2008
T.I. [ft. Rihanna],Live Your Life,2008,"People usually save their moralizing for after they leave jail, or at least for during their stay. That T.I. uses the second verse of ""Live Your Life"" to dispense with life advice registers as just a little more ridiculous than its ""Dragostea din Tei"" (Numa Numa) sample, courtesy of Just Blaze. It's not the words though, it's the mood created by ""Live Your Life""-- all minor chords and choppy strings-- that makes T.I. sound wistful. And it's the music that, in Blaze's hands, morphs from novelty into melancholy, more so than T.I.'s words or Rihanna, who here is little more than Auto-Tune and a haircut. There's something so incredibly sad about the foaming keyboards, the organ line that appears halfway through the verses, but there's something about the chorus that inspires arms-around-shoulders swaying-- or at least some solo webcam lip-synching. -",Jessica Suarez,40,Pitchfork,The 100 Best Tracks of 2008
Kanye West,Love Lockdown,2008,"We know Kanye had a hard year because he publicized it well. He got arrested. He blamed himself for his mother's death in interviews. Wounded and lost, he set out to follow his heart, and it led him back to the free market: On September 8, his blog read, ""LOVE LOCKDOWN.... wrote a week and a half ago, it's my favorite song 2 date!!."" He streamed two studio versions over the following week. Days later, iTunes released it.As pop psychology, ""Love Lockdown"" is rich. He's healing deep wounds under bright lights. As a lyric about relationships, it's awful-- it's robotic, immature, and one-dimensional. But as a piece of music, it's his most deceptively ambitious: android vocals over expressive, soul-style piano; 20th-century drum machines underpinning 5th-century Japanese percussion; a pulse borrowed from Marvin Gaye and sense of space reminiscent of Spoon-- in short, strikingly contemporary. -",Mike Powell,39,Pitchfork,The 100 Best Tracks of 2008
TV on the Radio,DLZ,2008,"This song is an enigma: nonchalantly badass, effortlessly purposeful. That simple, lock-step beat, no-nonsense bass line, spare synths nipping at the edges-- it's unstoppable, and Tunde Adebimpe just rides it with his highly rhythmic vocal. For a band that uses so many synthetic sounds, TV on the Radio sound amazingly gritty here. And there's plenty of ear candy beneath the song's skeletal strut, from the distant thunder of the deep percussion to the spooky whistling that sneaks around in the background at the end. The chorus of ""la la las"" might sound incongruous in other hands. On ""DLZ"" it just drives home how casually cool these guys are, like they could do anything without their pulses rising above 80. -",Joe Tangari,38,Pitchfork,The 100 Best Tracks of 2008
Big Boi [ft. Raekwon and André 3000],Royal Flush,2008,"When Raekwon and Outkast last collaborated in 1998's ""Skew It on the Bar-B"", it was an audacious challenge to rappers stuck in their ways both artistically and geographically-- ""you gotta come provocative…with crazy, bust your shit open beats."" A decade later, its follow-up initially sounds mixtape-like: There's almost nothing to ""Royal Flush""-- no hook, a wallpapery sort of beat, and no groundbreaking album to attach itself. Which just shows how much of a premium there still is on superior rapping. In fact, it's actually more of a reprise of ""Git Up, Git Out""-- Big Boi and Chef alternating political disgust with burly flash talk, while Andre 3000 beautifully goes from playful to thoughtful to enraged to bemused. ""Royal Flush"" came out of nowhere and it's still difficult to say where it's going-- we've been promised three Outkast albums in 2009, the actual release of Only Built 4 Cuban Linx II...yeah, tell me more about that lakefront property in Idaho. But with ""Royal Flush"" as a teaser, we have all the more reason to hope against hope and wait. -",Ian Cohen,37,Pitchfork,The 100 Best Tracks of 2008
Arthur Russell,I Couldn't Say It to Your Face,2008,"We already know of Arthur Russell's astounding range, but it's still hard to believe he's responsible for ""I Couldn't Say It to Your Face"". Here's a guy who made his name on elaborate left-field disco and ethereal cello-and-voice experiments, chucking it all in favor of earthy vocals and an arrangement that wouldn't sound misplaced on an AM Gold compilation. This is his polite take on the mean break-up (getting dumped via song probably stings, but it beats a text message). ""It's my song/ Didn't ask you to sing along"" is as harsh as he gets, and his triumphant refrains feel more like relieved catharsis than genuine spite. -",Brian Howe,36,Pitchfork,The 100 Best Tracks of 2008
Shearwater,The Snow Leopard,2008,"Zoological fact: The snow leopard cannot actually roar, thanks to the formation of its feline larynx. Fortunately, Jonathan Meiburg, an ornithologist and frontman for Shearwater, ignores this genetic trait, making a lot of noise on ""The Snow Leopard"", the climax of Shearwater's fifth album. Rook marks the point when Meiburg finally climbed out of Okkervil River to create an album that could stand alongside that band's best work. He's been honing his otherworldly singing and pagan songwriting over several albums, and ""The Snow Leopard"" stands among his best compositions, full of glowering majesty and anthropomorphic lyrics. The band prowl at a death-march pace, growing more ominous and menacing with every beat, while Meiburg holds his notes inhumanly long and Scott Brackett's trumpet tops the mountain. -",Stephen M. Deusner,35,Pitchfork,The 100 Best Tracks of 2008
Fuck Buttons,Sweet Love for Planet Earth,2008,"When pop music listeners try to explain their love for the cacophony of Street Horrrsing, the debut from Bristol noise duo Fuck Buttons, they might mention melody and major chords. And while those non-noise notions contribute to its distorted bliss, the album's 10-minute launch pad, ""Sweet Love for Planet Earth"", establishes its magnetism with transition and tempo: Deliberate, patient sonic choices lift the listener to heights and sights unimagined just seconds before. The track's vocals-- almost black metal, almost cheerleader chants-- recharge the beat when needed, while the song's persistent forward throb recalls the Field working in an oil refinery rather than a laboratory. That is, fists pump just as often as heads nod. -",Grayson Currin,34,Pitchfork,The 100 Best Tracks of 2008
Animal Collective,Street Flash,2008,"Animal Collective ascended as a metropolitan band exploring imaginary worlds, and finished 2008 touring the globe with songs about moldy takeout and getting stoned after chores. I used to think they made everyday life look wild and tedium seem cataclysmic, but I was wrong-- they're just about appreciating your surroundings, which is neither weird nor disagreeable.Like ""Street Flash""-- a ballad about wandering the city at night. No orgiastic drums, no fluorescence, no hysteria; just inertia and echoes. Avey Tare sees loving couples behind windowpanes, fruit shimmering at the corner market, gummy bears, and the friend rotting on his couch because the city's too expensive-- and it is, if you need money to be entertained. -",Mike Powell,33,Pitchfork,The 100 Best Tracks of 2008
Crystal Castles,Untrust Us,2008,"Wisely siphoning off the ear-grabbing opening bits from Death From Above 1979's ""Dead Womb"", Crystal Castles disposes of the unremarkable remainder of the song and manages to turn a garbled little vocal loop into something ridiculously catchy and fascinating. Like many of their Nintendo-jocking fellow travelers, the group's glitchy product can grate over the course of a full-length, but for a few minutes these jokesters can dazzle. Almost every sound, instrument, and effect on ""Untrust Us"" seems like it's speaking, and-- irrepressible as it is-- there's something haunting about a symphony of lonely, computerized syllables we can't decipher or hope to understand. -",Joshua Love,32,Pitchfork,The 100 Best Tracks of 2008
Aeroplane [ft. Kathy Diamond],Whispers,2008,"Hercules and Love Affair were this year's champs of new disco, but Belgium-based production pair Aeroplane ran a close second. Without even a proper full-length to their name, Stephen Fasano and Vito Deluca were name-checked by heavyweights Lindstrøm and Prins Thomas and tapped to add their Balearic spin to songs by Cut Copy, MGMT, and Grace Jones. Even in their rich catalog, ""Whispers"", though, is in a class all its own. Built on a foundation of forceful synths, deep bass, and Olympic-timed handclaps, the instrumental alone is a runway freight train; it's kept from careening off the rails by UK crooner Kathy Diamond's tender coos. Diamond sings of a fractured relationship, but in this song there's no room for turning back, no time for repair. ""Whispers"" just keeps chugging along, full-steam ahead. -",Joe Colly,31,Pitchfork,The 100 Best Tracks of 2008
MGMT,Time to Pretend,2008,"MGMT's Alex VanWyngarden says ""Time to Pretend"" was originally about his pet praying mantis (original title: ""The Mantis Sailing Home""). He and partner Ben Goldwasser transformed it from a fantasy about an insect sailing on a pirate ship into a fantasy about becoming a rock star, all the better use for that warbly seven-note hook. Brash and dumb, sure, but its second verse, where VanWyngarden sings about leaving playgrounds and pets and his family behind, sounds like a kid boarding a spaceship, a ""Major Tom"" for coked-out child stars. That sense of loss colors the first verse's cartoonish fantasies; fame and excess become nighmarish film montages whose soundtracks are too fun to be tragic. -",Jessica Suarez,30,Pitchfork,The 100 Best Tracks of 2008
Vampire Weekend,M79,2008,"In the fuss made over the traces of Afropop in Vampire Weekend's sound, it's easy to miss that they're just as sly and nimble when swiping from Western traditions: the charming chamber music flurry that opens ""M79"", for instance. It's an amused nod to their presumed gentility whose brisk rhythm jumps from harpsichord, to strings, then to guitar and drums as the song opens out. Ezra Koenig has mastered the key indie pop skill of stringing phrases together that hint at deeper significance but are really just there to color the mood: Bus route 79, Jackson Crowder, French kids and the Khyber Pass-- these riddling specifics do wonders for the song's texture, but the emotional kick of ""M79"" is in the way the string refrain whirlpools down and then rushes delightedly back in the final minute. -",Tom Ewing,29,Pitchfork,The 100 Best Tracks of 2008
No Age,Eraser,2008,"Before Nouns, many wondered if No Age could make more of the instrumental noise passages and more immediate hooks that they split the difference between on the singles compiled on Weirdo Rippers. After ""Eraser"", it was pretty clear they'd figured it out. Everything this duo conjured on its earlier singles-- placid instrumentals, surging waves of noise, quick-fix melodies, and sweaty exuberance-- is here in less than three minutes. Even as the band's sound has expanded, No Age have retained a sort of innocence; the shrugging voice of drummer Dean Spunt is almost stunned by the sound summoned here and elsewhere on Nouns. -",Jason Crock,28,Pitchfork,The 100 Best Tracks of 2008
T.I.,No Matter What,2008,"Memorizing raps instead of writing them down is now a de rigueur studio practice for hip-hop's elite. Jay-Z, Lil Wayne, and Kanye West do it. And so did T.I., for a while. But, awaiting a year in jail on weapons charges and smarting from the deaths of a good friend and a child due to miscarriage, the Atlanta MC started jotting things down again. It seems safe to say ""No Matter What""-- with its moral depth, fluid continuity, and clear-eyed clarity-- is a product of some meticulous pad-and-paper work. ""Even when winning's illogical, losing's far from optional,"" reasons T.I., but it's not mere braggadocio -- it's self-help minus the flotsam, a stark-yet-triumphant look in the mirror. So when he concludes with, ""Wonder how I face years and I'm still chillin? Easy: Let go and let god deal with it,"" it doesn't sound like a cop-out as much as a confession. -",Ryan Dombal,27,Pitchfork,The 100 Best Tracks of 2008
The Walkmen,In the New Year,2008,"The title relates to time, but ""In the New Year"" is just as much about place. ""Oh, I'm still living/ At the old address,"" the Walkmen's Hamilton Leithauser rasps. When bass, drums, and a festive organ fill arrive to join the brittle central guitar figure and distant orchestration, the vexed space they share becomes somehow vivid. If You & Me's detractors wonder where the songs are, one of the New York band's best since Bows and Arrows is right here. How it starts: strings whimpering. How it ends: cymbals crashing. Where it lives: at the old address behind your sternum, like a memory of a lost love. ""I'm almost home,"" Leithauser concludes. ""I'll see you in the New Year."" Auld acquaintance isn't easily forgot. -",Marc Hogan,26,Pitchfork,The 100 Best Tracks of 2008
The Hold Steady,Constructive Summer,2008,"There's a lot in this song that sticks with what worked on the first couple of Hold Steady albums: classic rock tropes, stories of escapism through drinking, in-joke references to the Dillinger Four, invocations of religious upbringings. But the drinking on top of the water tower is a counter to the unhappy fate of working at the mill until you die, the D4 reference (""Me and my friends are like/ Doublewhiskeycokenoice"") namedrops one of their most broken-up lonely-drunk anthems, and icons-- secular or otherwise-- only prove to disappoint: ""I met your Savior, I knelt at his feet/ And he took my 10 bucks, and he went down the street."" Despite all that, the fact that Craig Finn is less concerned with the travails of a few specific characters than a generally inclusive ""us"" makes it one of the Hold Steady's clearest moments of epic, aspirational populism. As those familiar rock maneuvers are blown up into wall-of-sound monoliths, Finn declares: ""Let this be my annual reminder that we can all be something bigger."" -",Nate Patrin,25,Pitchfork,The 100 Best Tracks of 2008
Gang Gang Dance,House Jam,2008,"""House Jam"" is the kind of title you'd normally find scrawled on a band's practice-space CD-R demo, denoting some incomplete experiment or a one-off joke. But the one that appears in the middle of Gang Gang Dance's fourth and most accomplished album, Saint Dymphna, sounds like the moment these Brooklyn mystics have been working toward their entire career. With their hyperactive tribal rhythms harnessed into a steady 4/4, the psychedelic synth textures yielding a brain-massaging bliss, and Lizzi Bougatsos cooing ecstatically like the Cocteau Twins' Liz Fraser if she were zoning out at Danceteria in 1982, ""House Jam"" marks the point where Gang Gang Dance turn into the Dance Dance Gang. -",Stuart Berman,24,Pitchfork,The 100 Best Tracks of 2008
Beyoncé,Single Ladies (Put a Ring on It),2008,"The best song from Beyoncé's misguided I Am…Sasha Fierce album is half ""Get Me Bodied"", half ""Irreplaceable"": a break-up song in going-out shoes. Maybe it wouldn't be as good without the video choreography-- and maybe Beyoncé's superstardom is able to will anything into a hit-- but credit goes to the song's agitated claps and ticks, to its purring keyboard hums and squiggles. Credit also goes to Beyonce's realization of a nearly universal desire-- to project ourselves onto a screen, even if that screen is a person (or persona). Her screen is called Sasha Fierce. Ours is called Beyoncé. Don't believe me? Just ask the hundreds of YouTube stars in heels and cut-up leotards. -",Jessica Suarez,23,Pitchfork,The 100 Best Tracks of 2008
Santogold,Lights Out,2008,"Santogold tries on as many genres on her album as she does outfits in the video for ""Lights Out"", so there's perhaps a little irony to be had in this particular year-end list featuring her most indie-rockin' track. It's a strum-and-drum affair that works the loud-soft angle, and adds a generous helping of harmonized ah-ahs to the mix. You've probably heard those harmonies trying to sell you some low-calorie beer, if you haven't already heard the song by choice, and it's hard to un-hear it once you've been exposed. Tom Ewing wrote in his LP review that the track ""finds a fascinating middle ground between the Pixies and the Go-Go's,"" but though ""Lights Out"" sounds maddeningly familiar, and the checklist of obvious reference points might be on the tip of your tongue, it doesn't really sound like anything else other than a wizened, longtime industry vet finally writing songs for herself. -",David Raposa,22,Pitchfork,The 100 Best Tracks of 2008
Hercules and Love Affair,Hercules' Theme,2008,"Antony Hegarty and Kim Ann Foxman received loads of shine on the Hercules and Love Affair debut, and rightfully so, but ""Hercules' Theme"" shed light on the ensemble's linchpin, Andy Butler. Despite ratcheting the vocals down, Butler manages to weave primal dancefloor coolness with the insecure, almost melancholy Hercules persona more heavily featured on other tracks. The theme starts as an anthem, cocksure and tightly wound around a four-on-the-floor beat, though the facade unravels quicker than the character's lives in Boogie Nights. There's something vaguely unnerving about the pestering horns, and the breakdown towards the end smacks of drug trips and hook-ups gone awry. The best part? The frenzy sounds so fresh and new, not like some threadbare revival. -",Adam Moerder,21,Pitchfork,The 100 Best Tracks of 2008
The Juan MacLean,Happy House,2008,"""I think aggression in music is the domain of really young people,"" Juan Maclean said in an   interview earlier this year. He demonstrated an alternate way for older, more centered artists to display their power with this 12 and a half minute bliss-bomb. It's everything good about the DFA collective in one place, a track that sinks its roots deep into the history of dance music (the relentless piano riff that serves as its spine is jacked from Dubtribe Sound System's ""Do It Now"" by way of every Chicago house record of the 1980s, not to mention ""Din Daa Daa"") and extends in numerous directions at once. ""Thank you for just being so damn excellent,"" Nancy Whang declares, and she sings it like that's precisely what she means. ""Happy House"" is an in-your-face song, but it melts into your face. -",Douglas Wolk,20,Pitchfork,The 100 Best Tracks of 2008
Vivian Girls,Where Do You Run To,2008,"Vivian Girls appropriated an oft-referenced outsider-art touchstone for their band name, and nicked numerous well-worn tricks from your favorite lo-fi Phil Spector acolytes-- the cavernous reverb, the extra percussion, the rough-and-tumble harmonies-- for their first full-length. But possession is nine-tenths of the law, and when ""Where Do You Run To"" reaches the chorus, and the song's rumbling thunder starts sucking face with the girls' intermingled voices, it becomes pretty clear that these ladies are taking what's not necessarily theirs, and making it their own. -",David Raposa,19,Pitchfork,The 100 Best Tracks of 2008
Women,Black Rice,2008,"Once you fight off the initial knee-jerk urge to toss this psych ditty onto the blog-rock scrap heap, you'll find ""Black Rice"" rewards more with each listen. That's because these roughshod Albertans are actually closet post-punk deconstructionists who happen to have a killer knack for citric hooks. A minimalist Wire-esque riff and fussy stop-start sections temper the saccharine vibes, though it doesn't hurt when drowsy singer Patrick Fiegel rolls off the couch to deliver a stunningly euphoric chorus. The result is a lo-fi pop gem that's (fortunately) too lethargic and stand-offish to exploit the many indie trends it alludes to. -",Adam Moerder,18,Pitchfork,The 100 Best Tracks of 2008
Wiley,Wearing My Rolex,2008,"""Here's my number-- she already knows it"": Wiley's MC persona is often an icy, defensive control freak, so no surprise that his pop breakthrough is about the horror of losing that control. He's in a club, drunk, short-term memory starting to go: What's he been doing? Why is everything repeating itself? Who has he just given his tremendously expensive watch to? The music, built on a sample of DSK's house classic ""What Would We Do?"", is a tight electro loop, keyboards arcing woozily upward, perfectly capturing a night out on the brink of disintegration. ""Rolex"" birthed a dance craze, an answer record (Mz Bratt's ""Wearing His Rolex""), and gave Wiley a top 3 UK hit, but beyond the novelty it's his befuddled paranoia that makes it so memorable. -",Tom Ewing,17,Pitchfork,The 100 Best Tracks of 2008
The Mae Shi,Run to Your Grave,2008,"The Mae Shi lost their singer and their label in 2006, but instead of being defeated, these apostles of good vibes and distorted electronics attacked 2008 with a rapturous self-released collection that celebrates life, god, and the joy of buzzing synthesizers. And with ""Run to Your Grave"", HLLLYH's blissful climax, they manage to alchemize all of their arty experimentalism into a blatantly ecstatic anthem, complete with an addictively chanted chorus, bright, videogame-worthy keyboard bleeps, and revival-tent handclaps. Despite ingredients that in lesser hands could be grating-- spazzy nasal shout-singing, preachy lyrics about abandoning worldly possessions to give into spirituality, and a repetitive melody-- the Mae Shi crafted a winning pop gem of exultant abandon. -",Rebecca Raber,16,Pitchfork,The 100 Best Tracks of 2008
Amadou and Mariam,Sabali,2008,"At once futuristic and crushingly nostalgic, this blind couple from Mali's first collaboration with Blur's Damon Albarn is a haunting electro-pop experiment that drips with soul. It begins with Mariam Doumbia in a conversation with gentle violins that sound beamed down from the International Space Station, then gives itself over to a synthetic rhythm and an arpeggiating keyboard. It has a lonely tinge that equally evokes Alan Shepard all alone on a suborbital flight and a lone traveler crossing the desert on a cold, starry night. It's honestly hard to pin down a song that has as many emotional currents running through it as this one, but it's truly a song for any state of mind, no matter where you are. -",Joe Tangari,15,Pitchfork,The 100 Best Tracks of 2008
Lil Wayne,A Milli,2008,"Somewhere, Orville Redenbacher's Gourmet Popping Corn is ruing a missed marketing opportunity. Somewhere else, Dennis Rodman has mixed feelings about his only 2008 cultural reference. Goblins are up; goons are down. Erykah Badu is excited to be repped by an MC not named Common. Big, Jay, and 2Pac are looking on, humbly satisfied. Andre 3000 wants his plaid pants back. Mike Lowry is watching Bad Boys 2 climb up Netflix queues. Gwen Stefani is remembering she's also in a band called No Doubt. People in charge of venereal disease awareness are reluctantly pleased. The almighty dollar is pining for its pre-meltdown glory days. The Bible is happy to have been mentioned in the most booming hip-hop song of the year. And Wayne? He's still rapping. Or maybe singing. -",Ryan Dombal,14,Pitchfork,The 100 Best Tracks of 2008
