Artist,Song,Year,Review,Reviewer,Ranking,Source,Source Title
Helena Hauff,Hyper-Intelligent Genetically Enriched Cyborg”,2018,"In its dark, hypnotic call-and-response of acid squibs and synths jumping over distorted snares, “Hyper-Intelligent Genetically Enriched Cyborg” feels like a peek into the best rooms of techno’s past: the clubs of 1994 Berlin, or the industrial spaces of Cleveland in 1988. But this standout track from Helena Hauff’s excellent second album, Qualm, is rooted firmly in the present, too, down to its title subject matter: This year, pop culture has percolated with paranoia about technology, and, quietly, we’ve already seen futurism realized in gene-modified births. The techno future is here, and if we haven’t spent a lot of time questioning its fancy new tools—who has them, how they should be used—then we ought to. Hauff’s radical politics make it easy to hear this track as a sonification of the mind of such a gene-“cleansed” genius cyborg, as unmoored from humanitarian ethics as the corporations who built it. So listen warily to this siren’s warning.",Daphne Carr,75,Pitchfork,The 100 Best Songs of 2018
Yves Tumor,Noid”,2018,"“Noid” seems to present an artist reborn: an antic experimentalist pivoting to pop in riotous fashion. But close inspection reveals Yves Tumor to be as intense as ever, with the song lurching into urgent extremes. It’s perhaps the year’s most visceral response to brutality against black bodies, refocusing the singer and producer’s dissident energy into music that involves, enraptures, and implicates. As Tumor repeats a few biting phrases (“9-1-1, can’t trust ’em...”), time seems to stall in a heightened moment, as if violence might be imminent. The beat propelling the cinematic strings, so harried and urgent, would sooner flee than fight, and indeed seems already on its way. From there, “Noid” presents a spectacular balancing act in which paranoia threatens to snap into terror. Rarely is radical art so neatly set at the precipice of delirium.",Jazz Monroe,74,Pitchfork,The 100 Best Songs of 2018
Gunna,Sold Out Dates” [ft. Lil Baby],2018,"Both Gunna and Lil Baby grew from Young Thug’s rib, but the pair’s breakout collaboration, “Sold Out Dates,” owes just as much to Lil Uzi Vert’s “XO Tour Llif3.” It’s a mission statement for overmedicated troubadours with chemical dependencies, low-level paranoia, and $20,000 in one-dollar bills. “Dates” is produced by Turbo and Ghetto Guitar and sounds like the kind of thing a grizzled country star might pull out at an after-hours club, much to the dismay of his three publicists. Gunna and Lil Baby are likely destined for different kinds of stardom—slow-and-steady and stratospheric, respectively—but “Sold Out Dates” finds them perfectly in concert.",Paul A. Thompson,73,Pitchfork,The 100 Best Songs of 2018
Slowthai,Ladies”,2018,"Slowthai raps like every song is his last gasp. “Ladies,” a paean to the women who shaped the UK grime MC, is no less fevered, but it’s also his most open and wholehearted song yet. Delivered over a stuttering, 8-bit beat, Slowthai’s lyrics jump from the gaps in his teeth to the promise of a yellow brick road, rattled off with a characteristically impish grin. But there’s newfound tenderness and an unexpected kind of feminism here as he raps, “I appreciate queens ’cause they made us.” It’s a quality made even more evident in the accompanying music video, where he lays naked and prostrate next to a clothed woman and later faces the camera wrapped in her arms. He’s searching for redemption and, whether he finds it or not, the excursion is exhilarating.",Eric Torres,72,Pitchfork,The 100 Best Songs of 2018
Pistol Annies,Best Years of My Life”,2018,"Heartbreak, of course, is country music’s meat and potatoes—and Pistol Annies’ Miranda Lambert, Ashley Monroe, and Angaleena Presley candoheartbreak. “Best Years of My Life” is a deceptively simple, devastatingly intimate domestic drama about love that left with a whimper, not a bang, and the mundane narcotics (prescription opioids and brainless TV) that help numb the ache. It’s a song that feels like listening to someone’s heart slowly snuff out from lack of emotional oxygen, with a sweet, sad, spare guitar line that slowly grows louder and fuzzier. The lyrics detail a compounded sadness; we mourn for the dead relationship, yes, but more so for all the possibilities its lingering dead weight is taking the place of. There are interior epics hidden and thrumming underneath the most ordinary events in human lives, and Pistol Annies excel at revealing them.",Alison Fensterstock,71,Pitchfork,The 100 Best Songs of 2018
Kamasi Washington,Fists of Fury”,2018,"Los Angeles saxophonist and composer Kamasi Washington’s second album commences with a rallying cry. “Fists of Fury” is a cover version of sorts, a bold refresh of Joseph Koo & Ku Chia Hui’sblaring theme tunefor the 1972 Bruce Lee filmFist of Fury. In the hands of Washington and his band, though, it becomes explicitly political: a noble call for justice and retribution that feels like a call-to-arms for the Black Lives Matter era. There is a righteous anger here, but the track itself is utterly beguiling. The arrangements invoke the rhythmic motifs of Blaxploitation funk and Latin music, massed strings adopt a honeyed swoon, and Washington and pianist Cameron Graves turn out magnificent solos that give the song’s 10 minutes a sense of perpetual lift. A feat of graceful pugilism, “Fists of Fury” floats like a butterfly, stings like a bee.",Louis Pattison,70,Pitchfork,The 100 Best Songs of 2018
Marie Davidson,Work It”,2018,"On the surface, “Work It” is a walloping dancefloor motivational for the secure-the-bag generation. Quebecoise singer and producer Marie Davidson weaves an elegant lattice of analog percussion—thudding kicks, dotty drums, clanging digital cowbell—before swooping in with a stern, business-bitch monologue listing the virtues of hard toil. “I don’t wanna see any fake-ass workers,” she demands. “I needreal builders.” Job done? Not quite. Considered in the context of its parent album,Working Class Woman, “Work It” emerges as part of a nuanced reflection on the psychological cost of being a touring musician—the physical and mental toll of hedonism, the stress of being your own boss. With this in mind, the song’s spoken text emerges as something more precarious: an admission of workaholism set to a runaway pulse that just can’t—or won’t—stop. It’s an important reminder of a truth that’s seldom spoken: You can still work yourself to death doing something you love.",Louis Pattison,69,Pitchfork,The 100 Best Songs of 2018
Empress Of,When I’m With Him”,2018,"“When I’m With Him” is a Trojan horse of a song, an exuberant dance-pop banger that conceals the internal loneliness of secretly falling out of love. Like Robyn, Empress Of’s Lorely Rodriguez refracts her sorrow through assertive drums and blossoming, golden synthesizers. The track’s skipping beat and sunny production transform heartache into tantalizing melodrama. Rodriguez does this with remarkable self-awareness, acknowledging that she is repressing emotions while still attempting to articulate those tangled feelings. She sings in both Spanish and English here, and each language provides a unique cadence; the Spanish phrases in the pre-chorus tend to be more staccato, while the following English phrases flow like cursive. Like sugar added to a savory stew, the contrast enhances both sensations.",Vrinda Jagota,68,Pitchfork,The 100 Best Songs of 2018
Lizzo,Boys”,2018,"In a year buoyed by auspicious hip-hop women, fromCardi Bto Tierra Whack, Lizzo continues to brand herself as the no-fucks poster girl for the utopian promise of letting your freak flag fly. The classically trained Minneapolis musician’s single “Boys” is an infectious dance tribute to all things XY chromosome, topped by a saucy black-and-whitevideofilmed in front of urinals. The song is freewheeling retro fun: The exuberant rhythm track recalls Timberlake and Timbaland’s “SexyBack,” and when was the last time you heard an old-school electric guitar solo during the bridge? Sassy to the hilt, Lizzo laundry-lists the boys who quench her thirst (“itty bitty boys, Mississippi boys”), and her declaration “Baby I don’t need you/I just want to freak you” pays homage toMissy Elliott’s combination of raunchy good-humor and sexual autonomy. Lizzo also racks up points for her inclusive approach to man crushes when she confesses: “I don’t discriminate, come and get a taste/From the playboys to the gay boys.” “Boys” ain’t rocket science, but it’s downright subversive to hear a plus-size black woman owning her sexual lust and essentially grabbing her own pussy in the face of persistent toxic masculinity.",Jason King,67,Pitchfork,The 100 Best Songs of 2018
serpentwithfeet,bless ur heart”,2018,"On the chorus of “bless ur heart,” the word “heart” swells to fill a whole line. It grows eight extra syllables and as many sonic embellishments; a wall of sound that sensually mirrors the way love buoys every molecule in one’s body. The lead single from serpentwithfeet’s debut albumsoil, “bless ur heart” is a perfect introduction to his fantastical and fleshy style of songwriting. Vocally, there are nods to his church choir background and to his Brandy fandom—the two singers utilize a tremble to texturally convey tenderness—but it’s lyrically that serpentwithfeet really flies. In a song about a lover who taught him gentleness and inspired his writing, he imagines creatures to carry his notes deep underground, stories that grow feet, and bodies that rid themselves of rivers. That love and language can both be transformative is not a new tale, but it takes a gifted storyteller to show how snugly they dovetail.",Ruth Saxelby,66,Pitchfork,The 100 Best Songs of 2018
Ariana Grande,Sweetener”,2018,"“Sweetener” is not subtle. “Hit it, hit it, hit it, hit it/Flip it, flip it, flip it,” Ariana Grande instructs on the chorus to her fourth album’s title track, resembling an X-rated game of Bop It. Amid the track’s svelte production—trickling percussion, cushy bass hits, a lusty and cascading synth line—Pharrell punctuates Grande’s commands with a high-pitched “sheesh!” like a steam whistle cutting through the air. It all adds up to a gleeful evocation of sensuality on an album consumed with the heady pleasures of new love. “Sweetener” carries a tender streak, too, embracing the notion of finding the good in so much bad, and toasting to the people in one’s life who encourage such perseverance. At a Manchester tribute concert following the deadly bombing at her show there last year, Grande said, “The fact that all of those people were able to turn something that represented the most heinous of humanity into something beautiful and unifying and loving is just wild.” And “Sweetener” embodies that same look-on-the-bright-side universality—a reminder that even the worst feelings can be turned into something radiant and nourishing.",Larry Fitzmaurice,65,Pitchfork,The 100 Best Songs of 2018
Kurt Vile,Loading Zones”,2018,"In the space of a few seconds, Kurt Vile blends several feel-good guitar textures on “Loading Zones.” When the opening wah-wah flourish gives way to more intricate acoustic fingerpicking, the singer-songwriter shows an ability to channel artists as different as Peter Frampton and Fleet Foxes. In the first verse, his droll voice unspools in lines of uneven length—telling a fractured, dreamlike story about an improbable small-town power broker—suggesting a sincere love for vintage talking blues. Happily, none of this weaving of popular traditions sounds forced; the song’s distractible journey is the work of a mellow, lightly perplexed narrator. By now, though, Vile’s more committed listeners likely understand the narrative haze as the work of a deceptively purposeful songwriter, one who knows exactly where he wants to lead them.",Seth Colter Walls,64,Pitchfork,The 100 Best Songs of 2018
Snail Mail,Heat Wave”,2018,"Snail Mail’s “Heat Wave” is built atop contradictions. The song begins as a delicate ballad before unleashing triumphant, devil-may-care bursts of fuzzy indie rock. All the while, Lindsey Jordan displays both a tonal brattiness appropriate of her 19 years and a worldly wisdom, as she addresses a green-eyed ex who’s decided to move on: “I hope whoever it is holds their breath around you, ’cause I know I did.” Toward the end of the song, the rhythm section quiets and Jordan introduces a bold refrain—“I’m not intosometimes”—that turns into an anthemic distillation of unrequited young love. “Heat Wave” is neither acerbic farewell nor mopey retrospective, but a clear admission of the pain of rejection, and the hope that we’ll all eventually find whatever it is we’re searching for.",Noah Yoo,63,Pitchfork,The 100 Best Songs of 2018
Octavian,Hands”,2018,"How do you follow up a sleeper rap hit? That was the question faced by London MC Octavian after “Party Here” catapulted him into the mainstream (thanks to one Aubrey Drake Graham). The answer: An idiosyncratic slice of dreamy electro-R&B. “Hands” does away with anything resembling traditional song structure. Instead, twinkling synths, pitch-shifted lyric snippets, and a driving bassline are brought together in experimental, James Blake-esque interplay. In all its genre-bending oddity, “Hands” serves as a clear sign that this young artist has ambitions that go way beyond a Drake co-sign.",Will Pritchard,62,Pitchfork,The 100 Best Songs of 2018
Jeff Tweedy,Having Been Is No Way to Be”,2018,"Jeff Tweedy has been around long enough to know that any song he releases is a song that he'll have to live with for the rest of his life. So “Having Been Is No Way to Be,” off his memoiristic solo albumWARM, sounds like he’s keeping his future self in check, crafting a surefire live staple that will force him to confront his urges and addictions night after night. The music is low-key, humble even: a loping acoustic strum; a low and sympathetic bass, like a steadying hand on his shoulder; a room-spinning guitar solo. But the lyrics are some of the most probing he’s ever written—in particular when he’s confronting the fact that some fans prefer the music he made while addicted to painkillers to the songs he wrote after he got clean: “But they’re not my friends/And if I was dead/What difference would it ever make to them?” With startling honesty, “Having Been Is No Way to Be” celebrates the fact that Tweedy gets to keep on living.",Stephen Deusner,61,Pitchfork,The 100 Best Songs of 2018
The 1975,It’s Not Living (If It’s Not With You)”,2018,"Of the many, many insults Matty Healy served himself on the 1975’s last LP, none dug deeper than “I’ve been romanticizing heroin.” Whatever countercultural cachet opioids once held has been negated by the undignified deaths of Tom Petty and Prince, along with the suffering of guys like Danny, the physically broken gas station employee that Healy uses as a stand-in for himself on “It’s Not Living (If It’s Not With You).” Though it’s a dark meditation on drug use, the song could anchor a crushed-out mix if you ignore its lyrics—a decent likelihood, since it’s one of those ruthlessly efficient pop machines that merges hair metal and ’80s stadium synth-pop. But “It’s Not Living” devastates because it presents Healy—a guy who’s scrutinized every aspect of our modern existence—as someone who knows he can never satisfactorily answer the one question that tortures anyone close to an addict:Why?",Ian Cohen,60,Pitchfork,The 100 Best Songs of 2018
Arctic Monkeys,Four Out of Five”,2018,"After a dozen years, six albums, and more success than anyone expected, Alex Turner is bragging about Yelp reviews on the damn moon. WithTranquility Base Hotel & Casino—and this track, its centerpiece, in particular—Arctic Monkeys present a ’70s rock lounge-lizard homage to future problems: What happens when we also ruin outer space with aggressive capitalism, gentrification, and information overload? It’s a scary, funny thought, and Turner, ever the deft vocalist, plays up both qualities in equal measure. His pitch-blackBowiecroon shows a flash of conviction when he boasts of a four-star user review for his lunar taqueria—“And that’s unheard of!” At first, the song starts and stops in fits, like a latter-dayJack Whitetrack that can’t quite figure out if it has a rock rhythm or a rap one, before taking on a dreamy psychedelic quality. Maybe the moon’s marketing creeps are lulling listeners into a fake sense of security, which makes you wonder: Who’s vetting all these glowing reviews, anyway?",Jillian Mapes,59,Pitchfork,The 100 Best Songs of 2018
MorMor,Heaven’s Only Wishful”,2018,"The debut single from Toronto’s Seth Nyquist bears all the hallmarks of a homespun indie-pop project: the sullen jangly guitars, the vacuum-sealed production, the skeletal “Billie Jean” beat that sounds like an outline for some pro drummer to embellish later on. And this is to say nothing of the open-ended yet intensely introspective lyrical confessions of a “poor boy” who’s “waiting for answers” and “hoping to find meaning” so that he can “break this feeling.” But despite its greyscale mood, “Heaven’s Only Wishful” nonetheless bottles up the thrill of a DIY producer realizing his potential in real time. While the song’s tempo never changes, the temperature certainly does: As Nyquist piles on Morse code squeals and grinding guitar solos, his understated cool gives way to unrestrained anger. “Some say/You’re the reason I feel this way,” he screams at an unspecified target in the song’s dying moments—an emotional breakthrough as dramatic and revelatory as his musical one.",Stuart Berman,58,Pitchfork,The 100 Best Songs of 2018
BlocBoy JB,Look Alive” [ft. Drake],2018,"There’s a running joke that getting a feature from Drake is like handing him the keys to a vehicle that won’t be returned: When he hops on a young artist’s track, he can’t help but steal their shine. But BlocBoy JB’s breakout single “Look Alive” bucks this trend—not only does JB manage to hold his own throughout the song, he actually draws attention away from Drizzy. Over ominous production that mixes the lowest of piano notes with bulky bass, JB breathlessly jumps in as Drake’s verse ends, radiating confidence with rapid rushes of goofy punchlines that are as witty as they are amusing (“I’ma spray ’em, just like Febreze”). After this track, JB’s career is on a fast climb, and it’s not hard to see why.",Trey Alston,57,Pitchfork,The 100 Best Songs of 2018
Amen Dunes,Miki Dora”,2018,"Amen Dunes’ “Miki Dora” is a wave that never breaks, a cosmic surf beat that pulses for five minutes as singer-songwriter Damon McMahon’s reassuring voice and oceanic lyrics hover above the swell. All of the song’s basic information—melody, groove, texture—arrives in the first 30 seconds, a compact and transcendental good feeling. Then the small shifts keep coming: ever-widening guitar parts around the central thump, miniature drama with a vocal modulation about halfway through, a pile of stacked self-harmonies near the end alongside guitar lines that sound like they’ve been run through a warbling cassette tape. It’s a long way from the discombobulated constructions of McMahon’s earliest work nearly 10 years ago, with the haze now transmuted into a gentle glow, the sun sinking into the digital surf.",Jesse Jarnow,56,Pitchfork,The 100 Best Songs of 2018
Yaeji,One More”,2018,"Polyglot club phenom Yaeji spent 2017 offering up track after track of deep house filtered through the minimalist insouciance of modern R&B. She was strong enough to blow through electronic music’s biases and remix nightlife in her own image, all the while launching lyrical doozies like “I don’t fuck with family planning.” But the rolling bullshit of this year left her personally betrayed, frustrated with the industry, and rationally furious. So Yaeji returned this fall with “One More,” a self-made and self-released middle finger to men who expect women to do all the work. It is amood, tossing and turning from gauzy quiet storm to Björk-y drum breaks and heartbreak, where even a quick turn towards euphoria ends up twitchy. It not only moves the body, it surely moveson.",Jesse Dorris,55,Pitchfork,The 100 Best Songs of 2018
Cardi B,I Do” [ft. SZA],2018,"Flipping a phrase commonly associated with matrimony, “I Do” drastically shifts the narrative with just three little words: “I dowhat I like.” The closing track from Cardi B’sInvasion of Privacy, it finds the rapper taking back power in the face of hearsay—all while reaping the benefits of her self-made empire. With nods to Gucci and YSL, “I Do” can seem at times like a shopping list for Barneys, but it endures above all as a celebration of financial autonomy and sexual empowerment. Cardi and SZA stalk the foreboding beat, flexing atop skittering hi-hats and something like detuned church bells. They count out their cash and accomplishments without a scrap of shame; Cardi feels so sexually superior, she claims to shout her own name in the sack. They don’t shy away from naming their desires, but as usual, they’re not asking others to provide for them—they’ve got that part handled.",Madison Bloom,54,Pitchfork,The 100 Best Songs of 2018
Sheck Wes,Wanted”,2018,"For many teenagers in New York—whose days are spent wandering through the city being ignored by adults and stalked by cops—nowhere ever really feels like home. On “Wanted,” Harlem’s Sheck Wes embodies that nomadic lifestyle as he tries to maneuver through a place where everyone just wishes he would go away, convinced he’s only up to no good. Realizing that he won’t be accepted no matter what, he opts to wreak havoc: boosting items from downtown to sell uptown and wilding on the subway, carving out some control wherever he can. It’s why Sheck Wes has become the voice of the unheard youth in NYC, and beyond.",Alphonse Pierre,53,Pitchfork,The 100 Best Songs of 2018
Sons of Kemet,My Queen Is Harriet Tubman”,2018,"Sons of Kemet’s “My Queen Is Harriet Tubman” is a standout from a strong year for London’s burgeoning jazz scene. The song was written as an interpretation of the famed abolitionist’s initial escape from slavery via the Underground Railroad. Tubman’s bid for freedom is brought to life in an urgent, relentless, and tightly wound melee of sax, drums, and tuba; players weave in and out like those moving along a loosely defined network of routes. The song is reflective of more contemporary times as well. Over five-and-a-half minutes, the track plumbs the UK capital’s rich, diasporic mesh of cultures: Afrobeat rhythms and freeform sax playing with an energy that resembles the golden era of pirate radio grime sets, typified by huddles of MCs passing a microphone around. Exclamatory stabs from the sax sound like reactive ad libs, and there’s a sense of unbridled joy running throughout. “My Queen Is Harriet Tubman” ends as abruptly as it began, leaving pure adrenaline coursing from ear to aorta.",Will Pritchard,52,Pitchfork,The 100 Best Songs of 2018
Sandro Perri,In Another Life”,2018,"Over a bubbling synth beat and lyrical guitar fills, Canadian singer-songwriter Sandro Perri vividly imagines a better place, one where “the seed of greed dissolved in thirst.” But by walking us step-by-step through his impossible dream, steadily unfolding one verse after another for 24 patient minutes, Perri offers an additional experience that enlivens his description of this weary utopia. This parallel existence isn’t just in our imaginations: By taking the song in and following its gentle curves, we start to become one with its rhythms, syncing with its gurgling, ceaseless flow. “In Another Life” isn’t a perfect prescription—many lines don’t make sense—but rather a space to inhabit, one that can be transformational in the right headspace. As we so often find ourselves struggling to cram in every last piece of crucial data, here is a song that has all the time in the world.",Mark Richardson,51,Pitchfork,The 100 Best Songs of 2018
Lucy Dacus,Night Shift”,2018,"It’s called the graveyard shift for a reason. Night can bring terrors, but moments of lucidity can also lurk within its quiet shadows. Lucy Dacus knows this duality all too well in “Night Shift,” a strung-out swamp of feelings about a breakup and the ensuing attempts to trying to hack away at the emotional cartilage that binds you to an ex-lover. The nearly-seven-minute track portrays a person flung off her axis and haunted by specters. Its racked, exquisite agony—and teeth-gritting determination to face the future without that loser ex—marks it as one of Dacus’ greatest songs to date. After a hushed opening, the song ignites as a chugging guitar riff cedes to Dacus screaming, in a bludgeoning wail, that she’s settled for second-rate treatment for the last time. They say that you learn something, good or bad, from every relationship. Dacus’ emotional purging feels like a much-needed vomit after a night of excess. The taste lingers, but wipe your mouth and keep on walking.",Owen Myers,50,Pitchfork,The 100 Best Songs of 2018
