Artist,Song,Year,Review,Reviewer,Ranking,Source,Source Title
Shawn Mendes,If I Can’t Have You”,2019,"Shawn Mendes seems beamed in from a pop era before face tattoos and pink hair and cursing: Last year, when the Canadian heartthrob revealed he liked to—gasp!—smoke weed, his squealing army of fans was appalled, with one of themadvising himto “think about going to rehab because we cant lose u like this. u are going to overdose and die.” But amid his chart peers’ rampant insolence, the 21-year-old’s tangy white funk slices through like a double rainbow. Take “If I Can’t Have You,” a sparkling single propelled by gargantuan Elton John piano chords and a glorious descending vocal line that should squeeze stress sweat out of Justin Timberlake. On paper, Mendes is pining after the girl who got away with the obsessiveness of an Instagram stalker—and yet his effervescent delivery, and shameless cheesing inthe video, make it clear that this winning rom-com of a song has a happy ending.",Ryan Dombal,100,Pitchfork,The 100 Best Songs of 2019
DJ Nate,Fuck Dat”,2019,"A deceptively sparse cut from Chicago stalwart DJ Nate’s first footwork record in nearly a decade, “Fuck Dat” is a fitting return to the genre: The steady clap of a snare drum recalls the style’s roots in ghetto house, while a meandering synth line hovers in the air, teasing the onslaught to come. But DJ Nate’s power is restraint: With a stream of warm TR-808 hits and a few errant hi-hats, he allows the footworkers who compete indizzying dance battlesto fill in the energy. The titular vocal sample, chopped into oblivion, is a suitable mantra: Nate returned to footwork while recovering from an injury that left him temporarily paralyzed from the waist down, a particularly cruel irony in a scene defined by movement. But just because he’s notkilling a circledoesn’t mean he can’t give it new life.",Arielle Gordon,99,Pitchfork,The 100 Best Songs of 2019
Brittany Howard,13th Century Metal”,2019,"On “13th Century Metal”—the centerpiece of Brittany Howard’s debut solo album,Jaime—the leader of Alabama Shakes lays out a personal mission statement, her rock mantras on self-care and empathy building into the courage to denounce those “who are determined to keep us in the dark ages of fear.” The song reflects her search for optimism, with chants that grow in intensity as her inward resolutions become outward pleas for kindness. A potent juxtaposition of crashing noise music and pure ideals, “13th Century Metal” feels unconquerable, a maelstrom settling into place.",Sheldon Pearce,98,Pitchfork,The 100 Best Songs of 2019
Klein,Claim It”,2019,"Perhaps the biggest shock on Klein’s latest album,Lifetime,is the appearance of a halfway conventional beat. Nestled among an album of brilliant—if sometimes exhausting—intensity, “Claim It” is a pause for thought as the South London producer peels back the sticky layers of her songs to reveal the textural skill beneath. What emerges is a strangled, melodic hook offset by unsettling vocal effects and chords that spiral upwards in a nervous twist of energy. Like a single malt whiskey with a drop of spring water, “Claim It” both dilutes and liberates Klein’s distinctive musical flavor, a reminder from this most maximalist of producers that less can occasionally be more.",Ben Cardew,97,Pitchfork,The 100 Best Songs of 2019
Ciara,Thinkin Bout You”,2019,"If “Thinkin Bout You” is any indication, even after three years of marriage to her football-star husband, Ciara is still in the honeymoon stage. As she puts it: He’s a habit she can’t break; he’s her destiny. The exhilarating track from her seventh studio album,Beauty Marks, follows the singer in the throes of infatuation, with a throwback disco beat that mimics her joy. The song’s straightforward production matches the force of her emotions; little more than a simple beat, bassline, and backing vocals elevate her voice. It’s a rare, all-out work of pop from Ciara, and her voice glides over every line as she gives in to the force of her heart.",Colin Lodewick,96,Pitchfork,The 100 Best Songs of 2019
Boy Scouts,Get Well Soon”,2019,"The heartbreaker and the heartbroken—aka the villain and the victim—are often the stock characters in songs about failing relationships. On “Get Well Soon,” Taylor Vick, the Oakland-based folk-pop singer who has performed as Boy Scouts for nearly a decade, chooses instead to look at how breaking someone’s heart can break yours, too. Singing over her lilting guitar, she makes it known that her decision is a compassionate act. There are no balloons, no condolence cards here; Vick knows that as bad as it feels, she can’t stay around to comfort someone who hasn’t treated her well.",Colin Lodewick,95,Pitchfork,The 100 Best Songs of 2019
Lil Keed,It’s Up Freestyle”,2019,"Lil Keed is from the same Cleveland Avenue apartments in Atlanta as Young Thug. He has an eccentric and versatile ear for melody similar to Thug, and has even remixed his songs. But Keed is more than just another Young Thug clone. On “It’s Up Freestyle,” Keed perfects his high-pitched delivery, screeching and harmonizing over a beat from JetsonMade that sounds ready for a dystopian sci-fi movie. Whether he’s rapping at an inhuman pace or piecing together his ad-libs, whatever leaves Keed’s mouth is recitable: “Walked in, walked in, this Bentley truck you can crawl in,” he wails on a hook that’s since gone viral on TikTok. It’s that sugary delivery and his control that elevates the track into a standout in a city that has no shortage of hits.",Alphonse Pierre,94,Pitchfork,The 100 Best Songs of 2019
Sky Ferreira,Downhill Lullaby”,2019,"Despitemany rumors to the contrary, Sky Ferreira didn’t sample the strings of “Bitter Sweet Symphony” on “Downhill Lullaby,” but hers did share that mood: a fatal swoon, something like the score of a David Lynch film. Their sound is shamelessly opulent and sumptuous with rot, like fruit losing its color but deepening in scent. If Ferreira’s previous albumNight Time, My Timechanneled ’90s alt-pop, “Downhill Lullaby” nods to the decade’s trip-hop with languid drums and bass, dank atmosphere, and a vague seediness. Ferreira’s vocals alternate from husky and over-heavy to lullaby-plaintive, then slide into the vulnerability that's marked her best songs. She sings about a relationship that’s not healthy yet no longer up for reconsideration; around her, the strings swoop and keen as if they're racing to the ground, too.",Katherine St. Asaph,93,Pitchfork,The 100 Best Songs of 2019
Róisín Murphy,Incapable”,2019,"Róisín Murphy begins “Incapable” as cheerfully as its disco-ready bassline suggests she will. The Irish dance-pop vet is ready to move, happy to feel wanted and free, even boasting that she’s never had a broken heart. But soon, the song’s steady groove and bright handclaps underpin a growing skepticism, as her perfectly intact heart begins to strike her as its own worrisome condition. “Am I incapable of love?” she asks herself. Though the song may be tongue-in-cheek, it highlights one of dance music’s core truths: Even a great beat can’t shield you from self-doubt.",Colin Lodewick,92,Pitchfork,The 100 Best Songs of 2019
Jay Som,Superbike”,2019,"Nothing symbolizes freedom quite like the pairing of a motorcycle and open road. It’s a staple of American mythos; it’s the central conceit of Jay Som’s “Superbike.” Melina Duterte, who helms the project, is sparing with her imagery, piecing together the story as if from glimpses out a moving vehicle: hurt followed by hope, a two-wheeled escape, a painful memory. What she can’t fit into words plays out in the song’s swirl of major-key jangle, shoegaze fuzz, and tambourine, all churning like air currents. Betrayal may be the song’s fuel, but the overarching feeling is one of ease, unburdening, and independence regained.",Philip Sherburne,91,Pitchfork,The 100 Best Songs of 2019
Hand Habits,placeholder”,2019,"Love and loss are twin pillars of songwriting, but there’s far less attention paid to the space in between: the relationships that last for three dates, the regrettable one-night stands, the rebound flings that never really had a chance. On the title track of their stellar second album, L.A.-via-Albany indieguitar heroMeg Duffy—a.k.a. Hand Habits—gives voice to the lovers left behind by non-committal types on the hunt for something better, as the song’s slow, Neil Young gait sets the pace for their fellow walking wounded. “I was just a placeholder, a lesson never learned,” they sing and sigh, like someone who’s grown all too accustomed to getting that “I think we should just be friends” text. For a remedy, they delve deeper into Youngian psychology, unleashing a series of pained fretboard squeals that sound like the guitar-solo equivalent of screaming into your pillow.",Stuart Berman,90,Pitchfork,The 100 Best Songs of 2019
Control Top,Office Rage”,2019,"In the 1997 filmClockwatchers, an office temp pontificates on what work life has in store for her: “When I look ahead, I imagine infinite possible futures repeated like countless photocopies, a thousand blank pages.” In “Office Rage,” Philadelphia’s Control Top storm the cubicles and find that although the blank pages have been replaced by screens, the lethal ennui remains. “Staring at a screen/Makes me itch and scream,” Ali Carter yells. “Click click click click click/Makes me fucking sick.” A highlight of theirCovert Contractsalbum on Get Better Records—company slogan: “for the queers, by the queers”—“Office Rage” employs a network of guitar lines more tangled than a messy router and drums like someone kicking a vending machine to liberate a trapped bag of chips. But in this economy, it’s worker liberation Control Top is after. “Service with a smile? EAT SHIT!” Carter screams. It’s a sentiment all of us can believe in.",Jesse Dorris,89,Pitchfork,The 100 Best Songs of 2019
Saweetie,My Type”,2019,"Invoking 2000s nostalgia in a bid to create her own rap hit, Saweetie samples from a crunk classic: Petey Pablo’s Lil Jon-produced “Freek-a-Leek.” But instead of adopting Petey’s suave, come-hither vibe, Saweetie delivers “My Type” with bite: “That’s my type!” she yells, as if she’s just spotted a man at the other end of the club and she’s ready to take a swipe at any woman who dares approach him. Saweetie’s raucous energy falls in line with another generation of women in rap: Three 6 Mafia’s Gangsta Boo and Crime Mob’s Diamond and Princess, who were exhilarating to listen to because theyweren’tmeek, pleasant, or well-mannered. Against the throwback beat’s rumbling synthesizers that could get anyone on the dancefloor, Saweetie turns “My Type” into an anthem for women who want to be unabashedly loud.",Michelle Kim,88,Pitchfork,The 100 Best Songs of 2019
Taylor Swift,Lover”,2019,"There’s room in Taylor Swift’s galaxy for celebrity warfare, veiled political commentary, and enthusiastic allyship, but her work is finest when it’s laser-focused on flawed, hopeful people making a connection. “Lover,” the title track from her most recent blockbuster LP, is a reminder of how effortlessly she can translate specific gestures and moments into universal expressions of romance. With its rustic arrangement and domestic imagery, it sounds like a spiritual sequel to “New Year’s Day,” the acoustic cleansing that closes 2017’s divisiveReputation. Both songs are tributes to the dirty work that goes into keeping a relationship healthy, and they’re spiked with the fear and doubt people feel even when that work is paying off. How can you make sure a good thing lasts forever? “Lover” features a classically swooning, Swiftian bridge—one designed to soundtrack wedding vows in renovated barns until the end of time—but its most penetrating lines depict the unglamorous stuff: telling dirty jokes, saving seats, deciding whether or not to drag out the air mattress for your college friends. This is the stuff of real intimacy, of partnership, of creating a language and a life together. It turns out the woman who built a career on fairy tales and scorched-earth breakup songs is just as deft with the simple and soulful.",Jamieson Cox,87,Pitchfork,The 100 Best Songs of 2019
Bedouine,Bird”,2019,"As clichés go, “If you love someone, set them free” is textbook fare; making a memorable song out of it requires a certain magic touch. “Bird,” the emotional centerpiece of folk singer Azniv Korkejian’s second album as Bedouine, transforms that familiar conceit into a cinematic marvel. Backed by an orchestra that sounds plucked from Hollywood’s Golden Age, she sings with compassion and grace to a lover she likens to a bird she’s releasing from its cage. The contrast between the rhapsodic instrumentals and Korkejian’s stoic, heavy-lidded alto draws out the disparity between what is felt and what is said when lovers part ways. Bedouine’s heroine stares wistfully at the night into which her bird has flown off, the echoes of their final words implied by avian flute trills. You may have seen this ending before, but you’ll cry all the same.",Olivia Horn,86,Pitchfork,The 100 Best Songs of 2019
Duwap Kaine,Flyin’”,2019,"Teenage Atlanta rapper Duwap Kaine has been releasing lo-fi bedroom recordings on SoundCloud for about three years with little fanfare, and his music feels almost yawned out, dotted with Chief Keef-inspired Auto-Tune melodies, mumbled punchlines, and featherlight beats. A cartoon fever dream about getting high like a pilot, liking girls’ pics on IG, and the designer brands he wears while he glides through the streets of Georgia, “Flyin’” is the quintessential Duwap single. It’s hypnotic, effortless. On the song, he sounds like he’s wandering around in a daze, and his music is a perfect soundtrack for doing the same.",Alphonse Pierre,85,Pitchfork,The 100 Best Songs of 2019
Ari Lennox,New Apartment”,2019,"Ari Lennox had to fight to put “New Apartment” onShea Butter Babybecause,she said, Dreamville label head J. Cole didn’t quite “understand” it. But Lennox thought it was the most important song on the album, because for a young woman like her, having her own apartment signifies safety and independence. On “New Apartment,” Lennox conveys this particular sense of freedom with a delightful string of images. Over a sample of Hubert Law’s soulful 1979 jazz composition “Land of Passion,” she sings about popping her “woo-hah in the sky,” drinking out of dollar-store wine glasses, and leaving her hair to clog the shower, all with the kind of sensual croon usually reserved for a romantic slow jam.",Michelle Kim,84,Pitchfork,The 100 Best Songs of 2019
Kasper Marott,Drømmen om Ø (Forever Mix ’19)”,2019,"Yoshinori Mizutani’s cover photograph of vivid lime-green parakeets outside a drab urban building is ingeniously suited for Kasper Marott’sForever MixEP. The record’s A-side, “Drømmen om Ø (Forever Mix ’19),” is a sumptuous, 14-minute mini-suite that lofts picturesque bird calls atop sleek drum pulse, rubbery acid synths, clattering Latin percussion, and other meticulously rendered subtleties. “Drømmen om Ø (Forever Mix ’19)” (the first part of the title translates to “The Dream of the Island”) is also a strange bird within Marott’s own Copenhagen techno scene.Forever Mixis thesecond releasefrom Kulør, the label run by fellow Danish artist Courtesy, following a compilation that introduced the city’s “fast techno” style. But the music here is slower-paced, introspective. “Drømmen om Ø (Forever Mix ’19)” may hit like a shock of tropical color against a gray city exterior, but it takes the length of an early-morning dream to achieve its blissful effects.",Marc Hogan,83,Pitchfork,The 100 Best Songs of 2019
Black Belt Eagle Scout,At the Party”,2019,"Pop stars slumped into nihilistic torpor this year, too paranoid and depressed to migrate from their beds to the dancefloor.Party? In this economy?they seemed to ask. But not all revelry equates with excess, even when the world is crumbling. In “At the Party,” Black Belt Eagle Scout’s Katherine Paul, a radical indigenous queer feminist, affirms the necessity of communal gathering for those who have suffered. The opening track of her second album,At the Party With My Brown Friends, it is Pacific Northwest indie rock at its finest—all quiet humming and watery guitar, mist and cold air—but it retains the redemptive quality of gospel. The central refrain lulls like gentle ocean waves: “We will always sing,” Paul murmurs. “We will always sing.” Her words drive home the power of music as refuge and even as self-defense. Sometimes what looks like a party is really salvation.",Cat Zhang,82,Pitchfork,The 100 Best Songs of 2019
Young Thug,What’s the Move” [ft. Lil Uzi Vert],2019,"One of the most consistent sources of joy on Instagram in the past year has been Lil Uzi Vert’s feed, which serves as a running catalog of the rapper’s outfits. There’s something heartwarming about seeing the young talent—his sartorial tastes unbridled and his budget now virtually unlimited—take on looks that range fromResident Evilherotohypebeast Halloween ghoul. All of Uzi’s various flexes coalesce during his appearance on “What’s the Move,” a highlight from Young Thug’s albumSo Much Fun. Atop a bed of 808s and bird calls, Thugger’s yearning melodies set his Philadelphia counterpart up for a captivating (if all-too-brief) guest verse. “Flexin’ on these haters,” Uzi jeers, after rattling off all the designer labels on his person. “Richer than your first, richer than your last.” Success is the best revenge.",Noah Yoo,81,Pitchfork,The 100 Best Songs of 2019
black midi,bmbmbm”,2019,"Black midi traffic in beautiful convulsions, spazzing between rhythms, textures, and keys with a dexterity that’s so precise it’s dazzling, so fluid it’s showy. It’s tempting to take the quartet’s audacity as a challenge—to pop sensibilities, to listener patience—but it’s more rewarding to embrace their constant sense of wonder. On “bmbmbm” (pronounced “boom boom boom”), they are puckish and aloof, stacking oblique lyrics and a warped sample of a wailing woman over a calm bass riff and steady drumming. The resulting mood is placid but tense, like a flame meandering down a fuse. Energetic bolts of noise and percussion materialize from the sky and vanish just as quickly, disrupting the groove but not toppling it. As the song continues, these disruptions become more frequent, building to a tempest of discord that’s cathartic, indulgent, and kind of silly. But that’s the thrill of black midi: They’re as unsure of where the muse will lead them as the listener is.",Stephen Kearse,80,Pitchfork,The 100 Best Songs of 2019
Vagabon,Flood”,2019,"Lætitia Tamko, who makes music as Vagabon,has saidthat “Flood” was initially written for another act to record. She described the process of creating for someone other than herself as “relief” from writer’s block, saying that there was freedom in that transference. The word “relief” implies a temporary state, a short break from a more permanent condition, but Tamko’s statement can also be seen as an acknowledgement of what creativity in 2019 looks like: at its best when untethered from the exhaustive rituals of self-promotion. “Flood,” which served as the introduction to Vagabon’s self-titled second album, diverges from previous Tamko recordings, which were rooted in the singer-songwriter’s melancholy croon and guitar playing. On the chorus of “Flood,” in the shadow of a drum machine and synthesizers that rise tall like futuristic oaks, Tamko’s voice embodies that modern-day creative isolation, taking on an almost robotic sheen.",Anupa Mistry,79,Pitchfork,The 100 Best Songs of 2019
2 Chainz,NCAA”,2019,"2 Chainz’Rap or Go to the Leagueunpacks a long-held belief: The only two ways for some kids to make it out of the hood are to rap or play ball. The marching, Honorable C.N.O.T.E.-produced “NCAA” is the album’s centerpiece, detailing the rapper’s rise fromamateur ballerto pro rapper while taking on corruption in the sporting world. The song marks college players as victims of institutional suppression of opportunity, implicating the system as exploitative of the primarily black stars who earn billions in revenue for others. Untilrecently, the governing body that oversees college sports wouldn’t let student athletes profit in any way off their talents or likenesses, and 2 Chainz, a former player himself, weaponizes that hypocrisy into a rallying cry. Here, his flows are leisurely as usual but he sounds slightly perturbed, too, as if he can’t believe theunmitigated gallof it all. “NCAA” reinforces a fundamental 2 Chainz philosophy: Balling hard should be rewarded.",Sheldon Pearce,78,Pitchfork,The 100 Best Songs of 2019
Powder,New Tribe”,2019,"At first, Powder’s “New Tribe” looms ominously. The left-field techno anthem’s beat is reminiscent of Laurie Anderson’s “O Superman,” except here those slow, staccato exhalations sound more like the huffing of some titanic beast; the lumbering bassline might be its swishing tail. But a funny thing happens as the song continues its endless build: It pulls you in. What started out forbidding and impenetrable becomes a bubble you live inside. But that’s exactly the kind of thing Powderwoulddo. The Tokyo electronic musician is famous for lengthy, off-kilter DJ sets that disorient and envelop in equal measure. Here, she effortlessly flips the specter of colossal menace into a warm embrace.",Philip Sherburne,77,Pitchfork,The 100 Best Songs of 2019
Empath,Roses That Cry”,2019,"When you listen to a great punk song, you should be holding your breath a little, fearing for its survival. Empath’s “Roses That Cry” is so joyous and unsteady, so beautiful and compromised, that you feel compelled to pray for its existence immediately. The Philadelphia quartet’s anthem rises out of the center of their albumActive Listening: Night on Earthlike a thought bubble over the head of a cartoon character, hazy and unreal. “Remember when/That tree fell on your car?/Glass spilled/All over the yard,” warbles singer-songwriter and guitarist Catherine Elicson as the band collapses around her in streams of detuned synthesizers and guitars that sound like wind tunnels. She sounds positively serene.",Jayson Greene,76,Pitchfork,The 100 Best Songs of 2019
Oso Oso,One Sick Plan”,2019,"Long Island native Jade Lilitri makes emo that could only exist in 2019. He draws from the rollercoaster hooks and blown-out emotion of his early-’00s Nassau County forebears, but strives to write, in his words, more “conscious” lyrics. That intention shines and crackles through “One Sick Plan,” the centerpiece of his third and best record,Basking in the Glow. Amid the rest of the album’s radiant gloss, “One Sick Plan” sounds like a hissy cassette demo, as if the sentiment—one of coming to see what really matters, like an epiphany—is so urgent and crucial that Lilitri had to release it straight away. His choppy acoustic strums seem to cut through a breeze, as he sings out to the person he cherishes: “Don’t sweep it under the rug.” Through all the self-doubt and pained longing Lilitri describes in this simple acoustic song, he has one sick plan to defy time: enduring love.",Jenn Pelly,75,Pitchfork,The 100 Best Songs of 2019
Faye Webster,Room Temperature”,2019,"The hook of Faye Webster’s “Room Temperature” serves as a mantra for depressed millennials everywhere: “I should get out more.” Webster got started as the odd-one-out at Atlanta’s Awful Records, a singer-songwriter with a soft rock sound on a label mostly known for releasing rap, and she doesn’t exactly fit into a tidy genre either; her slightly soulful country-western style sounds more like ’70s FM radio than contemporary indie rock. “Room Temperature” exemplifies Webster’s lyrical specialty, that all-too-familiar summertime sadness, those late capitalism blues. Her voice expresses a gentle yet pervasive melancholy, but the swaying cymbals, woozy guitars, and lazy pedal steel keep you from sinking too deep into self-pity.",Nadine Smith,74,Pitchfork,The 100 Best Songs of 2019
Maxo Kream,Meet Again”,2019,"Maxo Kream doesn’t glamorize. He doesn’t preach. He tells stories. With a reporter’s sense for detail and a matter-of-fact delivery, the rapper tells of lives marked by crime and poverty with gut-punching pathos and bleak humor. Those abilities were on striking display on his breakout album, 2018’sPunken; “Meet Again,” the lead-off single from this year’sBrandon Banks, take them to another level. Borrowing the epistolary conceit of Nas’ “One Love,” Maxo narrates a letter to an incarcerated friend. The song hits an emotional peak when the beat drops and Maxo starts talking about his own family, ripped apart by prison sentences and drug addiction.",Marc Hogan,73,Pitchfork,The 100 Best Songs of 2019
