Artist,Song,Year,Review,Reviewer,Ranking,Source,Source Title
Ice Cube,“It Was a Good Day”,1992,"Ever since Chuck D analogized rap music as television news for Black America, critics, scholars, and fans have referenced how it reflects the everyday injustice and inequality in these communities in a way that’s often missing from mainstream media. But the Black experience is about more than just oppression—something Ice Cube eloquently captured with this joyful single from his 1992 album The Predator. Written at the peak of his solo career, Cube’s good day centers not on the trappings of wealth but on everyday events in his neighborhood; breakfast with his momma, the pickup game in the park, shooting dice with the homies. He experiences the kind of fortuitous luck afforded only to the most blessed: he cleans up at craps, his favorite basketball team beats a rival, and he connects with a girl he’s long pined for. But beneath the happiness of a day when everything seems to go right is a latent anxiety over how easily things could go another way. He may have evaded the carjackers, the cops and the specter of death, but he knows they always lurk just around the corner.",Matthew Ismael Ruiz,141,Pitchfork,The 250 Best Songs of the 1990s
Nirvana,“All Apologies”,1993,"The melody to “All Apologies” is so simple it seems as though someone, somewhere, must always have been singing it. Appropriately, it followed Kurt Cobain around for years in different forms: His undated acoustic home demo, thought to have originated around 1990, was pleading and sincere, while the version the band tracked in 1991 but left off Nevermind was sardonic and sloppy. As the song lurched towards its final self, sharpening early lyrics and gaining a cello, it began to radiate a vast, frightening exhaustion. Feelings this big trail us for years before revealing their awesome face, and by the time Cobain was onstage performing it for MTV Unplugged: Live in New York, it had the clarity and finality of epiphany. It’s always been interpreted as a suicide note, but really it’s just a master statement. The song held everything: tenderness and bitterness, anger and acceptance, love and hatred, resignation and revelation. What else could he say?",Jayson Greene,140,Pitchfork,The 250 Best Songs of the 1990s
Souls of Mischief,“93 'Til Infinity”,1993,"The in-the-booth, stream-of-consciousness rap song intro is a trope as old as hip-hop itself; mostly, these are space fillers that add little. But such is the magnetism of “93 ’Til Infinity” that when Tajai Massey says, “Right now, we just maxing in the studio,” all of a sudden you’re right there with him, blunt smoke tickling your nostrils. For a hair under five minutes of breezy, rolling boom-bap, a single sax note glides in and out, pads drift and cut, and the drums—bop your head—don’t ever stop. Tajai and crew toss bars and ad libs back and forth, all in sync, swigging from the same 40 in a freewheeling, effortless jam. By the time the final, closing roll call of who’s chilling sails in, you half expect to hear your own name called out.",Will Pritchard,139,Pitchfork,The 250 Best Songs of the 1990s
Soho,“Hot Music”,1990,"New York in 1990 was a vibrant place. Hip-hop and house music were changing by the month, and ruling the clubs in the process. It was also a scary one—the city’s murder rate reached its peak that year with 2,245 killings, a huge increase over 1989. Joseph Longo was perfectly situated to capture that vibe in a bottle. A clerk at the 12-inch storehouse Vinylmania in Manhattan, he became a producer in the late ’80s and by 1990 was producing classics in both rap—Boogie Down Productions’ “Love’s Gonna Get’cha (Material Love)”—and house, under aliases like Earth People and Pal Joey. As Soho, his “Hot Music” reconfigured airy Wynton Marsalis snippets over an all-business kick-drum pattern just off kilter enough to carry more than a hint of menace. “Playing ‘Hot Music’ usually caused chaos,” Longo recalled in 2013. Decades on, it still does.",Michaelangelo Matos,138,Pitchfork,The 250 Best Songs of the 1990s
OutKast,“Elevators (Me & You)”,1996,"“Elevators (Me & You),” the lead single from ATLiens, was the moment when OutKast became bona fide stars. The beat is unmistakably cool, built around smooth bass, hi-hat drums, and an echoing wood block; there’s just enough there to make the instrumental distinct, but also keep it uniquely mimnal. André 3000 and Big Boi match the understated poise in their verses, every word rolling off their tongues impeccably while telling the world how they patiently planned their ascent, all skill, no luck and no haste. It’s the ultimate come-up song, a track that recounts André and Big Boi’s rise from “Player’s Ball” to ballers.",Matthew Strauss,137,Pitchfork,The 250 Best Songs of the 1990s
Pavement,“Summer Babe”,1992,"Was Pavement for real, really? The debate over how much frontman Stephen Malkmus gave a damn dangled perpetually over the Stockton, California band for its entire existence. Beavis and Butt-Head implored them to “try harder”; Robert Christgau saw through their hunched postures and declared them “well-schooled”; Pavement’s original drummer, local hippie Gary Young, split the difference when he remarked, “This Malkmus idiot is a complete songwriting genius.”",,136,Pitchfork,The 250 Best Songs of the 1990s
Craig Mack,"“Flava in Ya Ear (Remix)” [ft. The Notorious B.I.G., LL Cool J, Rampage, and Busta Rhymes]",1994,"The first single released by Sean “Puff Daddy” Combs’ influential Bad Boy Records, Craig Mack’s “Flava in Ya Ear” signaled a paradigm shift for New York rap via Mack’s off-kilter flow and producer Easy Mo Bee’s elasticky head-knock production. With the remix, featuring vets LL Cool J and Busta Rhymes, plus Bad Boy up-and-comer the Notorious B.I.G., Puffy cemented himself as a true forward-thinker. Mack and Biggie—pre-“Juicy”—are all laid-back bravado, a perfect foil for an unhinged Busta. But even amidst this posse cut’s stacked lineup, Biggie’s star power shone through. Nearly thirty years later, “Don’t be mad, UPS is hiring” still stings.",Claire Lobenfeld,135,Pitchfork,The 250 Best Songs of the 1990s
k.d. lang,“Constant Craving”,1992,"“Constant Craving” signified the Canadian crooner k.d. lang’s official shift away from her alt-country roots toward a blend of klezmer and adult contemporary, a move which afforded its own set of risks and rewards. “I knew it was a hit, and I was mad at it for that,” lang succinctly said of the song in 2018. It’s easy enough to understand—lang’s knotty songwriting, yearning mezzo-soprano, and that slyly sexy chorus are instantly undeniable, which led to new audiences and celebrity once it came out alongside an eerily beautiful video riffing on Waiting for Godot. But the song struck a separate nerve in 1992. What was usually made subtext in pop songs—that specifically queer longing that settles in the forefront of your attention for someone you aren’t supposed to want, an emotion that may not be reciprocated but achingly lives on—was suddenly brought to the surface, sung by a woman who wore all the unmistakable markers of butch iconography, from the spiky gelled bouffant to the sharply tailored suits. lang came out as a lesbian in an issue of The Advocate the same year “Constant Craving” was released, leaving behind a large chunk of her country fan base in the process. But it was a choice that reaffirmed her status as an icon, once the song infiltrated the Hot 100 and assumed a life of its own in the cultural zeitgeist, tilting expectations for lang and all the queer singer-songwriters who have come since.",Eric Torres,134,Pitchfork,The 250 Best Songs of the 1990s
The Roots,“You Got Me” [ft. Erykah Badu and Eve],1999,"“You Got Me” is a short story and a love song, a duet for three voices and a collective arrival, a ballad that enters with classical guitar arpeggios and exits with a drum‘n’bass break. It’s also the lead single from Things Fall Apart, the Roots’ fourth studio album, recorded with the hopes of helping them finally break big. The devil’s bargain? Switching out Jill Scott, who co-wrote the song, for Erykah Badu, the neo-soul queen of the moment. (The band made up with Scott later by taking her on tour.) Meanwhile, the song—a lovers’ back-and-forth, with Black Thought as the male lead and the female character split between an Eve verse and Badu’s gentle, reassuring vocals—stuck, and helped propel the Roots to the mainstream. Despite the melancholic tone, the song is comforting, committing to the kind of care that keeps a relationship going strong despite the turbulence—as true for the track’s collaborators as for its fictional protagonists.",NM Mashurov,133,Pitchfork,The 250 Best Songs of the 1990s
Sonic Youth,“Tunic (Song for Karen)”,1990,"The ’90s arrived right on time for Sonic Youth, whose transition from heroes of New York art-punk to bona fide rock stars came six months into the dawning decade with the release of Goo, their major label debut. In style and subject matter, “Tunic (Song for Karen)” embodies their dual citizenship in the mainstream and the underground. For most of the song’s six-minute runtime, it sounds like Sonic Youth as their cult of fans had come to know them thus far: The guitars are dense and dissonant, the groove is propulsive and unrelenting, the vocals follow a dreamy spoken cadence that has more in common with experimental theater than rock’n’roll. But when they downshift into the chorus, a half-time riff that swaggers in tandem with Kim Gordon’s menacing refrain—“You aren’t never going anywhere”—you can practically see the Lollapalooza crowd forming in front of them. The lyrics memorialize and pay homage to soft-rock megastar Karen Carpenter, who died of complications from anorexia—perhaps an unlikely subject for a group whose professed tastes ran toward the avant-garde. But Gordon shows real empathy for Carpenter, inhabiting her wounded psyche and celebrating her resilience in the face of public scrutiny. It’s a fitting encapsulation of early-’90s Sonic Youth: unabashed about chasing fame, but clear-eyed about its dark side.",Andy Cush,132,Pitchfork,The 250 Best Songs of the 1990s
Fugees,“Ready or Not”,1996,"When Lauryn Hill first sang the hook on “Ready or Not,” she had already decided to leave the Fugees. With tears in her eyes, she laid down a demo for the group to use; a few months later, when she’d rejoined them, she spent five hours trying to re-do the vocals, but no version came close to the rawness of that first recording, the one that gives the song its potent sense of foreboding and focus. Hill sings every word of the Delfonics interpolation with precision and anguish as she, Wyclef Jean, and Pras take turns flexing in the face of their rivals. The song is a kiss-off to other rappers, but her verse and performance also serves as a love letter to her bandmates. It’s a poignant moment of cohesion from a group whose time together was steeped in turmoil.",Vrinda Jagota,131,Pitchfork,The 250 Best Songs of the 1990s
Jeff Mills,“The Bells”,1997,"A figure of Jeff Mills’ stature doesn’t necessarily need a signature tune. But “The Bells” is exactly that: a fulcrum of his DJ sets to this day, and a cornerstone of Detroit techno in general. Unusually, for a tune with such an instant level of recognition, there’s no obvious audience appeasement going on here—no crowd-pleasing sample, no big chorus. Instead, the effectiveness of “The Bells” seems to spring straight from its sleek simplicity. Just a springy 4/4 kick and snare, a pinging riff that dances around the offbeat, and a four-note chime set in a teasing refrain, all arranged to give the sense of a tumble down an infinite wormhole. Mills was playing “The Bells” out as early as 1994, so by the time it finally appeared on his Kat Moda EP in 1997, it already felt like a classic.",Louis Pattison,130,Pitchfork,The 250 Best Songs of the 1990s
Green Day,“Basket Case”,1994,"The members of Green Day grew up on the first wave of punk, and rethreaded the genre’s pop fringes through the slacker vibe that would come to define the ’90s. “Basket Case” was a fizzy and petulant self-doubt anthem featuring sex and immortal existential questions like “Am I just paranoid, or am I just stoned?” (The answer was both.) Below its flippant veneer, the track is a sly reflection of ailing mental health: It was written when a 22-year-old Armstrong was struggling with severe anxiety, later diagnosed as a panic disorder. Lines like “Sometimes my mind plays tricks on me” and “I think I’m cracking up” sound blasé and unidentifiably snotty, but they reveal a young man desperately trying to make sense of his own thoughts. “Basket Case” does much more than whine, demonstrating an internalized self-fear finally breaking through to the surface, transferring punk energy to millions of young people coming of age and feeling just like Armstrong did.",Jane Bua,129,Pitchfork,The 250 Best Songs of the 1990s
MF DOOM,“Rhymes Like Dimes”,1999,"MF DOOM claims he “came to destroy rap” at the beginning of his 1999 debut Operation: Doomsday, but “Rhymes Like Dimes” proved his love of craft was equal to his love for chaos. He spends over four minutes juggling his disdain for the industry with his innate ability to spit truth, not just rocking a mic but giving people “something to remember like the Alamo.” DOOM’s malevolent and wry words clash with the self-produced beat, a loop of Quincy Jones’ “One Hundred Ways” that plinks and bounces with warm colorful synths. “Rhymes Like Dimes” is both a love letter to and a formal complaint about rap music that also introduced one of the largest personalities in the genre’s history. Who else but a supervillain could manage all that?",Dylan Green,128,Pitchfork,The 250 Best Songs of the 1990s
Shania Twain,“Man! I Feel Like a Woman!”,1997,"Shania Twain’s opening credo—“Let’s go, girls!”—isn’t so much a call to arms as a champagne pop, an effervescent invitation to celebrate. Arriving at a time when riot grrrl’s space-claiming had shifted into the capitalistic sheen of girl power, Twain’s twangy pop equated feminism with being unapologetically herself, short skirts and all. Frenetic fiddles over the chorus marked the fading traces of her country music origins, as she deliberately pursued a more global pop audience without any of the hand-wringing that so often precedes that kind of leap. Twain’s ambition, and the swaggering confidence fueling it, found millions of giddy listeners who just wanted to have a little fun right alongside her.",Amanda Wicks,127,Pitchfork,The 250 Best Songs of the 1990s
2Pac,“Keep Ya Head Up”,1993,"One of the greatest tricks 2Pac ever pulled was cultivating a tough-guy persona based on sensitivity. For all his party tracks and songs steeped in misogyny, he wasn’t too cool to show emotion or delve into current events with a comforting sense of empathy. Even by those standards, “Keep Ya Head Up” is an ode to Black women and abortion rights that stands out as a gem in his discography. Producer DJ Daryl’s funky sample of Zapp’s “Be Alright” is the perfect cushion for reassurances of Black empowerment (“Some say the Blacker the berry, the sweeter the juice/I say the darker the skin, then the deeper the roots”) and a full-throated defense of women from rapists and deadbeat fathers in a music world that rarely focused on them. All this clashes with the fact that barely a year after its release in October 1993, 2Pac was convicted of sexual assault. These contradictions have left 2Pac with a complicated yet enduring legacy, but the proud message of “Keep Ya Head Up” remains one of his most powerful.",Dylan Green,126,Pitchfork,The 250 Best Songs of the 1990s
Goldie,“Inner City Life”,1994,"“Inner City Life” wasn’t the first jungle tune—the sound was in early creative flush in 1994, when the song was released—but it provided the breakthrough moment for this most British of musical genres and remains jungle’s vertiginous peak. On “Inner City Life,” Goldie, alongside producer Rob Playford, proved that the style’s experimental energy—cut-up drums, bombshell bass, neo-hardcore synths, and dazzling production trickery—could not just co-exist but sit snugly with a vocal from singer Diane Charlemagne that balanced optimism and despair, romance and torment, creating an anthem for youth that was desperate but never hopeless. In the UK, “Inner City Life” grazed the charts and made a star out of Goldie, while jungle would go from strength to strength, dynamiting its reputation as a mere playground for twisted ravers. Twenty-eight years on, the song’s amalgam of innovation and soul remains astonishing.",Ben Cardew,125,Pitchfork,The 250 Best Songs of the 1990s
Silver Jews,“Wild Kindness”,1998,"The atmosphere of “Wild Kindness” is heavy, laden with nitrogen gas and cigarette smoke. It’s the last song on Silver Jews’ American Water, the most important album of band leader David Berman’s career. As songwriter and a poet, he’s at the height of his powers here, at his most fluid, macabre, and surreal. The images jump directly into your mindspace, one after another: grass growing in an ancient icebox, drug store hair dye dripping into a cracked motel sink. At the song’s center, Berman tries to wrap his head around what it means to be kind, to watch time slip out of your control. It’s a hallucination that begins with terror and ends with transcendence.",Sophie Kemp,124,Pitchfork,The 250 Best Songs of the 1990s
Bell Biv DeVoe,“Poison”,1990,"Before “Poison” rocketed them to superstardom, Ricky Bell, Michael Bivins, and Ronnie DeVoe were pretty much only known as “the other guys in New Edition.” That gave them the freedom to try out a risky new sound, a groundbreaking blend of R&B and hip-hop that framed the group’s vocal harmonies in gritty production. At the time, the casual misogyny of the song’s raps were the clearest sign that these guys were done wooing “Candy Girl”s; thirty years later, it’s hard to find anything smooth about lines like “the low pro ho she’ll be cut like an afro.” But that opening dirty snare roll, now as iconic as “Be My Baby,” still finds a way to fill any wedding or bar mitzvah dance floor, regardless.",Jessica Suarez,123,Pitchfork,The 250 Best Songs of the 1990s
Method Man,“I’ll Be There for You/You’re All I Need to Get By” [ft. Mary J. Blige],1995,"At his peak, Method Man wasn’t just the Wu-Tang Clan’s brightest commercial prospect—he was also the member with the most sex appeal, as his charisma and smooth voice made him a natural for the kind of sultry rap-R&B hybrids that dominated the ’90s. Remixing “All I Need”—a love-centric track from his 1994 solo debut Tical—with Mary J. Blige was an easy call, and “I’ll Be There for You/You’re All I Need to Get By” turned Meth’s sweet nothings into an undeniable anthem. As Blige’s vocals coast smoothly over samples of Marvin Gaye and Biggie, Meth’s bars are affectionate without losing the hard edge that got him there: “You didn’t have to funk with me/But you did, now I’m going all out, kid/And I got mad love to give, you my nigga.”",Dylan Green,122,Pitchfork,The 250 Best Songs of the 1990s
Radiohead,“Let Down”,1997,"“Let Down” missed out on being OK Computer’s lead single only because the band was unhappy with the music video. You can see it, though, right? It’s a perfect introduction to the album’s themes of automation and alienation: “Transport/motorways and tramlines/Starting and then stopping /Taking off and landing /The emptiest of feelings,” Thom Yorke sings, conjuring the lack of control in getting stuck in traffic or sitting in a tin can at 33,000 feet, and the horror of being stuck within one’s own body. Modern transportation has gotten bigger, faster, and stronger, and it threatens to overwhelm us humans, crushing us like bugs.",,121,Pitchfork,The 250 Best Songs of the 1990s
DJ Shadow,“Midnight in a Perfect World”,1996,"“Midnight in a Perfect World” nearly caused DJ Shadow’s landmark sample tapestry Endtroducing… to be mothballed entirely. Though a rising star for UK label Mo’ Wax, Shadow was beset by self-doubt, and the burden of finding room for (among others) Meredith Monk, David Axelrod, Rotary Connection, and Organized Konfusion to all perch harmoniously on the same five-minute waveform left him vibrating with stress. In the end, those long hours spent recasting ancient glyphs into a language of his own paid dividends: He mastered the art of lo-fi beats to study to two decades before the trope even had a name. And “Midnight” endures as a peerless companion of choice for introverts, stoners, and late-night ponderers because, in that moment of creation, Shadow was all three.",Gabriel Szatan,120,Pitchfork,The 250 Best Songs of the 1990s
Salt-N-Pepa,“Shoop”,1993,"Like the universe, women’s sexuality is expansive, ever-evolving, and predominantly unexplored by man. The distance traveled between Salt lowering her sunglasses and ogling a guy in a three-piece suit on Coney Island beach in 1993’s “Shoop” video and Megan Thee Stallion and Cardi B scissoring onstage to “WAP” at the 2021 Grammys, for example, is galactic. Though it might seem quaint in comparison now, “Shoop” was pioneering when it came out, a sex-positive anthem delivered over a reworked Ikettes hook that encouraged women to go after whomever they wanted, however it was hanging, and whenever they wanted it. Salt and Pepa glide over the track with libidinous gusto, sharing punchlines and inventing new ways to flip hetero conquests and objectify the male form.",Emma Carmichael,119,Pitchfork,The 250 Best Songs of the 1990s
Rage Against the Machine,“Killing in the Name”,1992,"Rarely has a band nailed its sound and agenda from day one like Rage Against the Machine did on its ceaselessly thrilling debut single—not just the blueprint for everything that the Los Angeles quartet would do but the apogee, too. Every component of Rage’s musical battlewagon is firmly in place: the rhythm section’s wrecking-ball funk, Zack de la Rocha’s shattering fury, Tom Morello’s Swiss-Army-knife guitar playing. It’s enough to fool you into thinking that fusing hip-hop, punk, and metal was easy, although the ’90s would provide numerous counterexamples. De la Rocha’s verses targeted the LAPD in the immediate wake of the Rodney King uprising, but he made the song eternal by boiling down decades of protest songwriting into a single personalised roar of denial—“Fuck you, I won’t do what you tell me”—that made resistance sound like the most natural, and exhilarating, impulse on earth.",Dorian Lynskey,118,Pitchfork,The 250 Best Songs of the 1990s
Dawn Penn,"“You Don’t Love Me (No, No, No)”",1994,"A rejection the whole world embraced, this rocksteady anthem by Kingston’s Dawn Penn has deep roots that still flower today. In 1967, the teenaged Penn sang her song to ska and reggae kingpin Coxsone Dodd, who turned it into a modest hit on the iconic Studio One label. A few more singles followed, but in 1970 she left a music industry she says never paid what she was due. Almost 30 years later, she showed up at producer Clevie Browne and Steely Johnson’s studio with a tape; instead, they re-recorded her first recording in a single vocal take. Penn, radiant among golden-hour horns, sounds wise and defiant over the track’s crisp swing. By 1994, the cult hit became a new standard, and soon everyone from thickets of jungle producers to the legends of 21st century pop music—Rihanna, Mary J. Blige, even Beyoncé—would say yes to Penn’s irresistible hit. As if anyone could possibly say no.",Jesse Dorris,117,Pitchfork,The 250 Best Songs of the 1990s
The Pharcyde,“Passin’ Me By”,1992,"Thirty years ago, the Pharcyde figured out that silliness can be an avenue into darkness. The L.A. group’s defining song, “Passin’ Me By,” unfolds as a series of vignettes, the four rappers each telling of a love interest that didn’t give them a shot. Producer J-Swift, who was trained as a classical pianist, approaches sampling as a bandleader might, and the track’s locomotive bassline lends it a playful, bluesy rumble. It’s a fitting backdrop for verses that are undercut by a streak of sadness, like Fatlip getting a “return to sender” notice on his love letter, or Slimkid3 growing older with a girl and watching the feelings fizzle out. Sandwiched between these tales is that cloudy saxophone, a slow sigh that draws you into the song’s wistful loneliness.",Mano Sundaresan,116,Pitchfork,The 250 Best Songs of the 1990s
