Artist,Song,Year,Review,Reviewer,Ranking,Source,Source Title
L7,“Pretend We’re Dead”,1992,"In 1991, outraged by Reagan and Bush Sr.’s years of attacks on reproductive freedom and galvanized by Anita Hill’s testimony against Clarence Thomas, the L.A. punk band L7 co-founded Rock for Choice, a benefit concert series raising money for abortion rights groups. (Over the course of the following 13 years, Rock for Choice would feature almost every major alt-rock band, from Nirvana to Rage Against the Machine to No Doubt, and raise hundreds of thousands of dollars.) The following year, L7 released “Pretend We’re Dead,” a protest anthem that bottled their activist spirit into four minutes of grunge perfection. Singer-guitarist Donita Sparks warned against the danger of political apathy over riffs as heavy as bricks; the only way forward was to “turn the tables with our unity,” she beckoned. Thirty years later, the consequences of that unheeded warning are catastrophic beyond anything L7 could have imagined.",Amy Phillips,197,Pitchfork,The 250 Best Songs of the 1990s
Fiona Apple,“Sleep to Dream”,1996,"Released when she was 18 years old, the first song on Fiona Apple’s debut album is a mature and clear-eyed statement of self-determination—whether you read it as a breakup song or a preemptive, prescient rejoinder to the small minds who would willfully misunderstand her in the early years of her career. Unlike the rest of Tidal’s piano-forward tracks, “Sleep to Dream” builds from the beat up, a rumble anchoring Apple as she spits bars, her words so sharp and precise they could have been written with a scalpel. “I’ve got my own hell to raise,” is her proclamation in the chorus. Through formal innovations and radical forthrightness, she has spent the decades since fulfilling that prophecy.",Olivia Horn,196,Pitchfork,The 250 Best Songs of the 1990s
Björk,“Venus as a Boy”,1993,"Not to get all What Women Want about it, but it’s hardly surprising that the idealized male figure Björk rhapsodizes about in “Venus as a Boy” is described in terms of how he makes the narrator feel, and not what he looks like. This is beauty, according to Björk: attentiveness, the capability of making one’s partner feel beautiful, and an apparent willingness to go down on her. She’s not excited by his biceps or the bulge in his pants, but his sense of humor. Sonically, this Nelle Hooper-assisted single from Debut is something like a chanson in the Earth section of Epcot on Mars. Strings recorded at film studios in India do a ton of heavy lifting; every figure sounds like a different variation on swooning. At once intelligible and singular, “Venus” encapsulated Björk’s particular pop genius so preciously.",Rich Juzwiak,195,Pitchfork,The 250 Best Songs of the 1990s
The Sundays,“Here’s Where the Story Ends”,1990,"Released right at the start of the 1990s, the Sundays’ second single had more than one leg stuck in the 1980s, its gentle jangle pop and bookish miserabilism inevitably recalling fellow Rough Trade signees the Smiths. At the same time, “Here’s Where the Story Ends” has such a titanically strong pop melody—conveying a bittersweet tale of nostalgic longing that has withstood covers by artists as diverse as sugary house merchants Tin Tin Out and American Idol runner-up Crystal Bowersox—that it feels untethered to anything as prosaic as the calendar year. “Here’s Where the Story Ends” is an irresistible ode to moping around in your bedroom, borne aloft and into the stars on David Gavurin’s silk-slipper acoustic-guitar textures and Harriet Wheeler’s crystalline delivery. It influenced the gentler side of Britpop and it will resonate for as long as young people feel sorry for themselves—which is to say, probably forever.",Ben Cardew,194,Pitchfork,The 250 Best Songs of the 1990s
Aimee Mann,“Save Me”,1999,"Aimee Mann spent the ’90s sparring with a music industry that had desperately tried to control her. After leaving the ’80s synth rock group ’Til Tuesday, Mann went through a tumultuous run of contractual battles and label restructurings that left her both adrift and hardened. With “Save Me,” she found a way out. The melancholy song was written for Mann’s third solo LP—and first on her own label, SuperEgo—which shares DNA with the director Paul Thomas Anderson’s Oscar-nominated 1999 film Magnolia. Anderson wrote his screenplay using Mann’s cutting lyrics as dialogue, working together with the singer-songwriter to give flesh and blood to intricate stories about “the ranks of the freaks who suspect they could never love anyone,” as she puts it in the song. Subtly informed by a long period of disappointment, “Save Me” is wry but surefooted, with its loping guitar melodies, shuddering accordion, and gentle percussion. The featherlight production and songwriting belie its inevitable punch: Here, Mann underscores the raw tenderness that comes with searching for help.",Eric Torres,193,Pitchfork,The 250 Best Songs of the 1990s
Tony! Toni! Toné!,“Feels Good”,1990,"“Play this record as frequently as possible. Then, as it becomes easier for you, play the record once a day or as needed.” The old-timey voiceover that introduced the Oakland trio’s first big song set a high bar that this tune would be the cure for what ailed listeners, but that first drum hits like a full syringe of serotonin. With all the sweet harmonies and big beats that defined new jack swing, “Feels Good” stands out as a titan of the genre, a full-bodied five-minute mission to live up to its name, and a catalyst for the prolific career of artist-producer Raphael Saadiq. One of the thousands of songs to sample Lyn Collins’ 1972 James Brown-produced “Think (About It),” “Feels Good” drew heavily from older funk, soul, gospel, and jazz, while also embracing the hard-hitting sound of the era. It was part love song to a girl, part love song to music in general, and all party.",Evie Nagy,192,Pitchfork,The 250 Best Songs of the 1990s
My Bloody Valentine,“When You Sleep”,1991,"“When You Sleep” is a firework of emotion gone awry, a love song that leaves you so helplessly and hazily entranced. On their shoegaze-pioneering album Loveless, My Bloody Valentine were intent on making their instruments sound just as destructive as these emotions, and “When You Sleep” is filled with indelible blown-out noise, shattered guitar feedback, and muddled confessions narrowly escaping the surface: “When I look at you/Oh, I don’t know what’s real,” Shields sang, barely perceptible. Was this reality, or was it a dream? Either way, there was no exit.",Gio Santiago,191,Pitchfork,The 250 Best Songs of the 1990s
Gang Starr,“Mass Appeal”,1993,"“It was recorded as a joke,” Gang Starr’s DJ Premier once said of “Mass Appeal.” “We just wanted to make fun of the radio on what it sounded like to get airplay.” The infamous song is smooth like some chinchilla coat worn by a gangster’s daughter—but nowhere near as soft. Guru’s voice, scholarly and crystalline, is compact over Preemo’s precise beat. Even though Gang Starr were non-violent, they weren’t only for the backpackers, either. And while Guru wasn’t a hustler rapper, he was still hardcore, his flow too confident for any posturing or ornamentation. They spoke to so many of rap’s constituencies at once. Preemo might have created this song as a gag, but it stands firm as both criticism and corrective.",Jayson Buford,190,Pitchfork,The 250 Best Songs of the 1990s
Groove Theory,“Tell Me”,1995,"Groove Theory only had one album and one hit, but they made it count. “Tell Me” was a simple, sensual admission of affection by singer-songwriter Amel Larrieux that captured all of the genuine nerves and excitement accompanying bubbling romance, set over a heartsick and woozy groove. “If you thought I’d sleep on this/Boy, you're wrong ’cause all I dream about is our first kiss,” she sings, her voice both a sultry come-on and a raw confessional. All of this, combined with the unforgettable melody and producer Bryce Wilson’s bulletproof bassline, made “Tell Me” a near-perfect representative of the best that R&B could be.",Evie Nagy,189,Pitchfork,The 250 Best Songs of the 1990s
Cocteau Twins,“Cherry-Coloured Funk”,1990,"Cocteau Twins entered the ’90s with birth (Elizabeth Fraser and Robin Guthrie’s daughter), death (Simon Raymonde’s father), agony (Guthrie’s substance abuse), and success (their highest charting U.S. single, “Carolyn’s Fingers”). This complex concoction seems fit for a band that melded hope with heartbreak, embodying indescribable emotions through ethereal instrumentals and cryptic lyrics. “Cherry-Coloured Funk,” the opening track to their 1990 tour de force Heaven or Las Vegas, drips with thick, sticky desire. Over lush guitar and churning bass, Fraser begins in an almost sinister low register, painting an abstract bucolic scene, then climbs to an anguished falsetto cry. As a feeling, “Cherry-Coloured Funk” is familiar yet ineffable, and thankfully expressed by a band who understood the inexpressible.",Arjun Srivatsa,188,Pitchfork,The 250 Best Songs of the 1990s
Double 99,“Ripgroove”,1997,"Movie directors aiming to create suspense or tension have been known to deploy what’s called the Shepard tone, an arrangement that gives the illusion of a continuously rising siren sound. In 1997, UK garage producers were using a similar effect to signal the arrival of something much more thrilling: A big, bulbous bassline to put the wind up your Moschino shirt. In the hands of Double 99, that suspense comes from a wailing, rotating Tina Moore vocal chop that rides atop a trundle of plump kicks before eventually—it’s a long build even by speed-garage standards—a delayed, distorted “brock wild!” summons a walloping bassline that’s become instantly recognizable to ravers of all stripes over the subsequent decades. Just like that Shepard tone, it’s still going.",Will Pritchard,187,Pitchfork,The 250 Best Songs of the 1990s
Ghostface Killah,"“Daytona 500” [ft. Raekwon, Cappadonna, and Force M.D.s]",1996,"Beholding the power of Wu-Tang at their peak was like stumbling onto the world’s most esoteric track meet—cryptic smartasses bombing hammers and javelins all over the field, with points awarded according to the precepts of Supreme Mathematics. “Daytona 500” fulfills the title’s promise of speed: Over a rubbery strut sampled from Bob James’ jazz workhorse “Nautilus,” Raekwon’s leadoff leg effortlessly piles up internal rhymes and mordant asides. Ghost follows with his particular blend of artisanal flexes (“In the Philippines, pick herbal beans”) and invincibility (“I slapbox with Jesus, lick shots at Joseph”). They build a big enough lead for Cappa to break the tape, beer sloshing out of his cup.",Brad Shoup,186,Pitchfork,The 250 Best Songs of the 1990s
SWV,“Right Here (Human Nature Remix)”,1992,"In the comments section for a four-minute YouTube clip from 1993’s Free Willy, hundreds have communed to honor a cinematic moment from childhood that gave them “chills.” As Willy’s fins cut through the water, the sound of Michael Jackson’s reinterpolated “Human Nature” shimmers like the sun-jeweled waves, and the sound of SWV’s voices gently rain down like drops of holy water. Chills. Sitting somewhere snug between the ecstatic and absolute serene, SWV’s “Right Here (Human Nature Remix)” belongs as much in the church as it does the Free Willy soundtrack. With its gospel-infused harmonies, Teddy Riley’s remix combines the classic romanticism and cool insouciance of the original with updated, widescreen hip-hop production (including a cameo from his protégé, Pharrell).",Emma Madden,185,Pitchfork,The 250 Best Songs of the 1990s
Wilco,“Via Chicago”,1999,"In 1999, Wilco were set on blowing up their alt-country identity and stepping further into their truth as aesthetes. On Summerteeth, the band embraced the psychedelia of Beach Boys baroque pop, weaving in ever more textural experimentation. “Via Chicago” is the most stunning signal of what was to come on their 2001 opus, Yankee Hotel Foxtrot: the song deconstructs, as if slowly collapsing on the road back to their city and their people. “I’m coming home/Via Chicago,” Jeff Tweedy sings, gently and wearied, broken yet whole, proof that place is only the first stop en route to the complicated comforts of home.",Jenn Pelly,184,Pitchfork,The 250 Best Songs of the 1990s
Yo-Yo,“You Can't Play With My Yo-Yo” [ft. Ice Cube],1991,"Yo-Yo made her recording debut in 1990, matching Ice Cube bar for bar on “It’s a Man’s World”—but her second solo single, in 1991, was stratospheric, an infectious declaration laying out Yo-Yo’s plan for woman-domination in the entrenched male landscape of West Coast gangsta rap. Over Cube’s lowrider-slow sample of Earth, Wind & Fire’s “Devotion” and a refrain that cast a mournful pallor over its demands (“don’t try to play me out”), the Compton-born Yo-Yo flowed majestically about her skills, intellect, style, values, and street bona fides, all while laying out a credo for herself and her crew, the Intelligent Black Woman’s Coalition (IBWC). The blessing of Cube lent Yo-Yo some legitimacy in those sexist circles and helped her land a record deal by the time she was 18, but her flow spoke for itself, a protegee turned spiritual predecessor to current rappers as wide-ranging as Saweetie to City Girls to Omeretta the Great.",Julianne Escobedo Shepherd,183,Pitchfork,The 250 Best Songs of the 1990s
Spice Girls,“Wannabe”,1996,"Women. Ever heard of them? For much of the nineties the British cultural landscape had been suffused with the banality of blokiness, to the point where femininity felt like radical counter-programming. The Spice Girls were cartoonish splinters of British girlhood, each of them campishly endowed with femdom archetypes: Scary, Baby, Posh, Sporty, and… Ginger. “Wannabe,” their debut single, was a boisterous, friendship-forward anthem centering the most hoydenish parts of their personalities. The five women delivered sass and brattiness with the giddy mania of a toy commercial—Friendship! Fun! Zig-ah-zig-ah! The track itself is indulgently weird, frantically jittering from one idea to the next without any thought or collecting breath. It sounds like pop music held at gunpoint, but this energy reinscribed a much-needed sense of humor and unseriousness into the genre.",Emma Madden,182,Pitchfork,The 250 Best Songs of the 1990s
Dr. Octagon,“Blue Flowers”,1996,"Kool Keith has had plenty of receptive collaborators both before and after his initial turn as the time-traveling alien OB/GYN Dr. Octagon, but none understood or complemented him as well as Dan the Automator. On 1996’s Dr. Octagonecologyst, the producer keeps Keith from flying too far into the atmosphere with rocksteady boom-bap, while tickling the rapper’s one-of-a-kind brain with wiggly synth drones, and samples from porn flicks and the cult ’90s comedy Cabin Boy. One clear highlight is “Blue Flowers,” which features a horror-soundtrack-level flip of Bartók’s Violin Concerto No. 2 alongside a jazzy backbeat. It’s unsettling on its own, but Keith cranks up the disquiet with verses that are blood-soaked, heatsick, and wickedly funny.",Robert Ham,181,Pitchfork,The 250 Best Songs of the 1990s
Usher,“You Make Me Wanna…”,1997,"My Way was a path-changing album in Usher’s discography, and on a record where every song had the potential to break out, “You Make Me Wanna…” had to be particularly spectacular to slightly edge out the others. A sublime mix of hip-hop cool and R&B seduction in the vein of Usher’s idol, Bobby Brown, the song is sexy without being lascivious, playful without any childish inclinations, and just a little unbelievable. It’s common to mourn the “death” of smooth, danceable and carefully produced R&B—an apparent bygone of a lost era—yet Usher’s artistry has revealed itself to be committed to his roots, with a deep awareness of the foundational pillars lent to the genre by gospel and soul. As the years have passed, he’s shifted and experimented, all the while pledging allegiance to the melodies that raised and introduced him.",Tarisai Ngangura,180,Pitchfork,The 250 Best Songs of the 1990s
Metallica,“Enter Sandman”,1991,"In which prototypical ’80s speed metal headbangers trade in thrash velocity and prog drama for a more straightforward and compact grunge-adjacent churn, in service of a spooky-ooky bedtime story named for a 19th Century continental European shuteye myth you can trace through ’50s girl-group dreamers the Chordettes, dirging ’70s soft-rockers America, a ’30s DC Comic-turned-’80s Neil Gaiman graphic novel, and maybe, just maybe, months after the Gulf War, Saddam Hussein. Add references to the turn-of-18th-Century Protestant children’s prayer “Now I Lay Me Down to Sleep,” the Southern folk lullaby “Hush Little Baby,” and Peter Pan’s (if not Michael Jackson’s) Neverland, warn of “the beast under your bed, in your closet, in your head” (for the tween boy in the video, impending puberty maybe?), and you’ve got a sellout that goes bump in the night. Exit light, enter nye-yite, welcome to Metallica’s nightmare.",Chuck Eddy,179,Pitchfork,The 250 Best Songs of the 1990s
Raekwon,"“Ice Cream” [ft. Method Man, Ghostface Killah, and Cappadonna]",1995,"“Ice Cream” sounds just as roughneck as the grimiest Wu bangers, so it’s a little funny that Raekwon hated the song at first because he thought it was “too soft.” RZA turns jazz guitarist Earl Klugh’s plucky riff into a blood-curdling loop that cradles the Chef, Ghostface, and Cappadonna’s confidence-oozing player raps. The three of them sound like guys fighting to get the attention of a beautiful woman who just passed by their block, verbally shoving each other out the way to shout the wildest compliments imaginable. Not all of their hollering has aged well—especially parts of Raekwon’s verse—but it’s still a quintessential New York rap love story: a little too upfront, yet romantic in its own crude way.",Brandon Callender,178,Pitchfork,The 250 Best Songs of the 1990s
Garth Brooks,“Friends in Low Places”,1990,"One of the best-selling artist of the ’90s, Garth Brooks was primarily influenced by Texas country acts like George Strait, and he wore a Stetson to prove it. “Friends in Low Places,” the ultimate hat act single, starts off as a nearly a cappella story-song about storming an ex’s high-falutin’ shindig, and Brooks attacks that chorus in a way that justifies every Elvis comparison. The song inevitably climaxes as a barroom sing-along that’s musical and spiritual kin to Lone Star anthems like Tanya Tucker’s “Texas (When I Die).” It’s also Garth’s pledge as a country singer—especially one hailed as the genre’s conquering hero—to bring some low-class kicks to the high-class sales charts and record books.",Stephen Deusner,177,Pitchfork,The 250 Best Songs of the 1990s
The Prodigy,“Firestarter”,1997,"Rave as metal—or oi!, maybe—with indie rock wah-wah borrowed from the Breeders, deep house bam-bam from Ten City, proto-techno “hey hey!” from Art of Noise, and a pyromania-horror concept from Stephen King. Keith Flint, him of the Bozo the Clown hair-tufts, slings Cockney rhyming slang about what a bloomin’ rebel he is— or, per his chants, what a trouble starter, punkin’ instigator, mind detonator, twisted animator he is. That last one was particularly apt since these blokes were nothing if not cartoons—but cartoons with the big beat, sillier and catchier and buzzier than just about anything else on the radio at the time. All told, a master class in how to sell electronic dance music as what looks and feels like a “rock band.”",Chuck Eddy,176,Pitchfork,The 250 Best Songs of the 1990s
Galaxie 500,“Fourth of July”,1990,"Do you know just how low it feels to think the whole world is enjoying a party and you’re the only one not invited? Or to believe that most every possible comfort—the playfulness of a pet, the ecstasy of a holiday, the warmth of a smile, the silence of your space—is unavailable, denied for some reason you can’t comprehend? That is the listless sadness at the core of “Fourth of July,” a song about wanting to be loved by a crowd too busy to bother. Dean Wareham shuffles around New York, unimpressed by its Empire State Building’s stature and uninterested in its Independence Day clamor. Naomi Yang and Damon Krukowski perfectly illustrate his anxious pacing, their circular rhythm moving like someone who wants to go anywhere but has nowhere willing to take him. What to do when the world shuts you out? Shut yourself in and take a glorious guitar solo that forever wanders, just like you.",Grayson Haver Currin,175,Pitchfork,The 250 Best Songs of the 1990s
Noreaga,“Superthug”,1998,"“Superthug,” the breakout hit from goofily intense rapper Noreaga (aka N.O.R.E.), not only launched a new era of Queens rap, pushing aside the cool and collected storm clouds of Nas and Mobb Deep with one fell swoop of its indelible “what-what-what-what-what-what-what” hook. It also heralded the arrival of producers Pharrell Williams and Chad Hugo, aka the Neptunes, onto the international stage. Their signature stuttering drums and sci-fi synths sounded unlike anything playing on Hot 97 at the time, foretelling the innovative path Williams and Hugo would chart for decades to come.",Claire Lobenfeld,174,Pitchfork,The 250 Best Songs of the 1990s
Elliott Smith,“Waltz #2 (XO)”,1998,"In the long history of songs about other songs, “Waltz #2 (XO)” ranks as one of the best. Inside a smoky karaoke bar, a man and a woman—two people who may very well be stand-ins for Elliott Smith’s mother, Bunny, and his stepfather, Charlie—select songs that thinly veil their marital strife. She blankly performs the humiliating “Cathy’s Clown,” he sings the pointed “You’re No Good.” Smith uses karaoke night, or as he calls it, “the substitute scene,” to give us this meta novella about pop music and heartbreak. He becomes an audience member inside his own composition, distant and helpless to do anything but silently show his love for his distraught mom, signed with a kiss and a hug.",Jeremy D. Larson,173,Pitchfork,The 250 Best Songs of the 1990s
En Vogue,“My Lovin’ (You’re Never Gonna Get It)”,1992,"Lord help the man at the business end of an “Oooooooooooo BOP.” With its searing James Brown sample, stunning vocals, and biting parenthetical title, “My Lovin’” was En Vogue’s 1992 entry into the proud tradition of soul anthems by pissed-off women who were absolutely done being used and disrespected. But the four-member girl group from Oakland added the all-important squad element, and this dirtbag trying to sweet talk his lady back after treating her like crap never stood a chance. What makes you think you can just walk back into her life, indeed.",Evie Nagy,172,Pitchfork,The 250 Best Songs of the 1990s
Slowdive,“Alison”,1993,"Shoegaze is about capturing the shimmering melancholia at the edge of existence, that too-stoned sense of being unmoored in the world. “Alison,” from one of the best shoegaze acts to ever do it, taps into that sinking feeling of lying in bed, wishing you could stay there forever but knowing you eventually have to face the universe. The song has a shaggy, nostalgic comfort, its warmth shining through like a lazy sunbeam on your face. But it’s also tinged with unbearable loss, as the protagonist addresses a flawed person whose existence animates their being. “I’ll be here in the morning,” Neil Halstead sings, even as he’s the one who needs reassuring.",Cat Zhang,171,Pitchfork,The 250 Best Songs of the 1990s
Puff Daddy,"“All About the Benjamins” [ft. the Notorious B.I.G., Lil’ Kim, Jadakiss, and The Lox]",1997,"You can practically feel the breeze of a whirring cash machine in your face. Produced by Deric “D-Dot” Angelettie of Bad Boy Records’ Hitmen production squad, this instrumental floats like a swarm of wasps, held aloft by a slowed and reversed sample of the opening guitar lick from R&B trio Love Unlimited’s 1977 single “I Did It for Love.” There’s enough room in the pocket of this beat to fit a giraffe riding a 747—or a rap crew at the peak of their powers.",,170,Pitchfork,The 250 Best Songs of the 1990s
Ace of Base,“The Sign”,1993,"“The Sign” is the kind of uncomplicated, unserious pop song that’s easy to love: there are those diet-reggae guitar licks, that pulsing drum-machine beat, and vague, chirpy lyrics that you can memorize almost instantly, even though you don’t actually know what the song is about. (Technically, it chronicles a couple discovering a renewed sense of purpose in their relationship, but that’s beside the point). When it was released in 1993 on the Swedish quartet’s debut album, it exploded internationally; even member Ulf Ekberg’s past in a skinhead gang didn’t stop the band’s ascent, though it definitely demanded some damage control. “The Sign” was a product of the Swedish pop machine, a system that produced a certain kind of flawlessly constructed, ultra-polished pop commodity. Exemplified by groups like ABBA in the ’70s, “The Sign” heralded its return two decades later, restoring a formula that would dominate the pop charts in the years to come.",Isabelia Herrera,169,Pitchfork,The 250 Best Songs of the 1990s
